author_name,rating,text
Mechelle,1,"不予置評的爛，看完直接大發炎，
後來掛急診，醫生感覺一副不屑的態度!"
Pin.,5,婦產科葉紹錡醫師很讚👍
Chih Chang,5,從小就在耕莘看診，每一次就診經驗都很好，醫生和護理人員都很親切專業。
阿寶,5,帶小朋友到小兒科診所要等很多人，去永和耕莘醫院小兒科門診醫師細心開的藥媲美醫學中心，也不用人擠人等很久重點是掛號費用不比診所貴，大推耕莘醫院。
陳木木,1,急診室反應極慢！明明知道病患出車禍，肋骨已經撞斷了，內臟在流血，卻放著人在急診大廳躺三、四個小時才通知要轉院，從下午放到晚上！期間內傷不斷出血院方卻未立即處理，轉院的跟車護理師也明顯不專業，簡直拿人命開玩笑！
Hsu Olivia,1,對於醫療病情方面一直不是很了解，相信醫師護士等人員的辛勞，奶奶因年紀大跌倒後開刀器官開始出問題，腎衰竭十二指腸潰瘍尿毒症等併發症進入加護病房，聽曾有護士經驗的表姐看過了之後永和耕莘醫院的團隊將我奶奶的胃出血流出來的是鮮紅色而未告知家人，本來跟家人說好轉了卻不見恢復，表姐說奶奶也有壓瘡，我認為家人有權利在第一時間透過醫院等報告告知家人其病者的身體情況而作出是否要轉院的決定，而非是把該說的事隱瞞，耽誤了救治時間。
趙英二,1,急診室效率很差，以後寧願跑遠點去雙和醫院。
Serge HSIAO,2,這裡很少有學名藥，代表著在賺錢之餘還有社會良心，可惜某些醫生實在不怎麼樣。
陳攸昇,1,急診爛到無以復加 給一星都太多
pual tsao,1,"體檢報告陋東陋西
報告還要等醫師一個禮拜
拿到報告後，結果還有項目沒有測驗到
回去測驗後，結果又有選項沒有打勾，蓋章
一直跑醫院心很累"
