author_name,rating,text
Hsueh H,4,"餐點十分美味，
且無論主餐或下午茶都是份量十足，
麵包超好吃，尤其是抹醬！
(個人口味：藍莓的五告讚、蒜味奶油一般、番茄的偏酸不是很喜歡)
可惜沒有販售……

整體費用稍高，
尤其是飲料的CP值實在不怎麼樣"
Michelle Ho,5,餐點好吃又健康 份量很大（加套餐）
BrianPlay布雷不累,5,第二次吃了，真的是超划算的一家德式餐廳！
jessica,1,"點了元氣早餐和德式豬肉燉飯很貴又不好吃，元氣早午餐的其中一個圓麵包非常硬，唯二好吃的是果醬和雞肉。德式豬肉燉飯的飯就像白米和白醬混在一起

人手太少，不管是點餐還是送餐，都等非常久

套餐120滿划算，但是餐點上菜的沒有秩序，主菜先上了一陣子才問是不是有套餐沒有上

店員甚至不知道我們點了什麼，或是什麼餐點還沒上，套餐的沙拉甚至根本沒上，飲料三催四請到快吃完才拿出來，我們最後才發現沙拉沒上，但已經快閉店，也吃的沒食慾所以就算了

雖然店員態度不差，但是一直讓我們等待跟催促讓心情變的很糟，不推薦也不再回訪"
黃佩琳,5,今天點烤午魚套餐，每一道的滿意度都滿分！面對著外面的綠樹和親愛的家人一起用餐，真是美好的大享受啊⋯⋯謝謝服務我們的歐嬤德式美食工作人員。
Yu Tzu Wu,5,很好吃的德式餐點
陳小豪,4,來份豬腳吧！！
Jilp Liu,5,乾淨氣氛燈光好高價位但是好吃
Sakurs Wu,5,剛出爐藍莓麵包好吃😃蕃茄蛋白餅❤
Linda Fan,5,健康美味，肉質好。
fanny jo,3,同一個地段有兩家店，一家純餐廳可午餐、可午茶，另一家販賣麵包、蛋糕，也可用餐∼座位則是在店外騎樓。蛋糕麵包口感端看個人喜愛，飲料是低消，單就蛋糕加飲料約$220∼$270
Huimin Chen,5,很好吃麵包特讚
Ivy Wu,5,麵包好吃！抹醬好吃😋，但可惜沒有娃娃椅
わがまま,5,新鮮好吃，環境舒適。今天又來~
Mia Chen,2,看到廁所門附近有一群小精靈在群居
S L,5,"要開始有點擔心評論的服務和餐點問題
但今天點的早午餐（烤雞、沙拉、麵包）都很棒
服務也很好唷！推薦"
H Doris,5,第一次來 餐點非常好吃份量夠😋
白曉芬,5,食材新鮮，蔬食選擇多樣化選擇，場地舒適明亮～^ _ ^
Jiang Mavis,5,來光顧五次了，東西新鮮又好吃，推薦
alice wang,5,"今天點了沙拉餐加套餐，不錯。
環境安靜，用餐的好地方。"
Yi-Ming Kao,5,"附餐豬肉湯好喝
奶油蘆筍烤雞很讚！"
Noemi Wang,5,餐點美味不馬虎，加點套餐也很超值，麵包沾醬很好吃！
Jonathan Lin,5,餐點很特別、好吃！
Shockyou Cheng,4,"室內溫馨
以德式料理為主
服務相當親切有理
食物算中上 麵包熱熱的 每個人都有自己一份三種口味的麵包沾醬
加120元就可以有豐富的套餐
主餐豬腳很不錯 皮脆肉嫩
蛋糕很多選擇自選
給四分主要是根據食物美味的程度
但我認爲怪不得店家
是德式料理本身不夠討喜所致"
Irene Cheng,5,最愛海鹽焦糖起士蛋糕。
MINGJU CHEN,5,"Cp值超高 食物都非常好吃
會在二訪"
HuanHsi Chen,5,舒服的空間、好喝的咖啡☕️，下次來試試看鹹食～
黃柏昇,5,餐點好吃，加套餐很划算，份量多
Shirly Lee,5,蘆筍蘑菇奶汁雞腿肉好吃～
Chris Chang,2,食物味道還行啦！但不小心吃到鋼刷削...
PF Chen,4,"早午餐份量很足，兩個人點了Guten Morgen元氣早午餐($390+80)和厚切肉排太陽蛋帕尼尼($380+80)，都加了80元的湯和甜點套餐。
沙拉新鮮而且分量很足，雞腿排煎得很香，豬肉排本來擔心會吃起來像午餐肉，沒想到口味接近沒有腸衣的德國香腸，食物很好吃，甜點還可以直接去蛋糕櫃挑自己喜歡的種類，只是最後分量真得太大沒有吃完。店裡的自選沙拉看起來也很誘人，下次可能會改點一份沙拉加一份套餐分食。
整體而言物有所值，環境也不錯，是聚餐的好選擇。
(2019.10.)"
Kris Cheng,5,這裡的餐點很多元，尤其是注重健康的人ㄧ定更要來嚐嚐。
黃晨瑋,5,餐點美味，份量超大。高CP值
許菀庭（條條）,5,"推薦起司麵與德國豬腳
非常好吃😋"
李婷婷,3,餐前麵包選擇蠻多樣的。商業午餐的主餐還好。
Daryl Cheng,1,"服務態度很差，有個女的服務生臭著臉完全沒笑容，該怎麼點餐或基本的介紹都沒有，明明店內空位一堆卻只給角落陰暗窄小的位置，令人不悅。
要點餐了卻沒看到半個服務生在廚房外面，也是莫名其妙⋯完全可以感受到這家店連服務的基本流程準則都還沒有建立。
用餐時間有限制也有提早告知，但時間到的時候依舊是非餐期的時間，而且本來說好到整點後來卻來告知只到五十分？？這什麼規矩？都店家說了算嗎？當下店內空位還一堆，卻開始趕客人走？從沒有在任何餐廳遇過這種服務。
結帳櫃檯也是莫名其妙，結合烘焙坊與餐廳在同一個機台，選麵包的客人猶豫不決也不先幫餐廳的客人結帳？趕人走還要罰站等結帳嗎？
最後，嚴重懷疑有逃漏稅的疑慮，沒有主動提供發票，希望店家儘速改善！"
呂依真,5,營養素和美味兼具
金珍蘭,3,沙拉很不錯，主食很健康，但沒有可提供放皮包的置物袋，東西都沒地方放
Cedric Lin,5,沙拉美味，多種選擇可混搭！
MT WU,5,奶醬蘆筍雞腿肉好吃！
Ian Peng,5,健康的東西很難吃，但這家例外。
YI SHAN TSAI,1,我想告訴老闆，不管你們的食物在好吃，你們店員那非！常！糟！糕！的服務態度是足以讓一間店毀滅（希望老闆有看到！）從用餐方式說明就很不專業，店內空位還很多，卻用一種不想點就快走的不屑態度⋯⋯⋯真是會吃的一度子氣！食物部份如同大家評價沒有問題～但店員的服務態度真的是開了眼界的差，跟有些顧客評的一樣⋯⋯不敢恭維
家瑜葉,5,麵包和果醬味道很棒，離捷運台電大樓站又，適合當成聚餐首選
Wayne Shih,5,麵包好吃，沙拉好吃又健康，很常來哦！
Chang Enzo,2,"食物目前吃起來都還不錯，只是豬腳的皮烤到咬不下去，我沒去德國吃過不知道這樣是不是正常的..

菜單的編輯有點沒邏輯，感覺是在秀設計，要用點心看幾遍還是要問服務生才知道怎點..

兩個人點一份大分六百多的豬腳再單點其它食物一起吃，後來在我吃很飽準備離開時跟我說另一個人低消不足要我加點，一開始就跟我說我就點小分的各自吃......

的確菜單有寫低消的事，但是是我沒有用看法律文件的專注度去看......因為跟一般餐廳一樣總金額超過人數低消就可....."
Linda Huang,4,麵包點心好吃，選擇也多，套餐飽足感高
李孝詠,5,東西好吃 服務人員態度很好👍🏻👍🏻👍🏻
Jason Li,4,餐食可口，價格實在，近捷運站
劉美華,5,食物不錯吃且扎實
周欣穎,5,沙拉很讚！服務態度很好！
Wang Ylwang,4,很道地德國菜，輕食及低油健康，喜歡！
Carol Kuan,5,非常道地的德國料理！
kyrie eleson,5,"食物：100分
環境：100分
服務：100分
德國精神 ，完美演繹 。"
hsiufeng Chen,4,沙拉多樣，麵包好吃，酸菜豬腳湯滋味棒，紅茶蛋糕也不錯，蠻推薦的
ML L,1,"早午餐內容算ok,但服務人力明顯不足且欠缺訓練。
進餐廳時只有一位客人（其他都是空位），服務人員只顧忙著弄其他事，然後才很不專業的指著角落說：坐那邊（？？）。
結帳時，也因為有電話來，櫃臺人員視而不見的在處理電話事宜⋯⋯
應該不會再來了，即使麵包、餐點還行，寧可去別家。"
Buta Watanuki,4,店裡有很多不同口味的沙拉餐，全日供應的早午餐，，好吃料理，蠻推薦給喜歡嚐鮮的人。
王馨（古怪歪問神學生）,5,我就是歐罵呀！
Jim Chen,5,餐點分量十足。啤酒豬排稍嫌乾
chia ching chu,5,好喜歡的一間餐廳 好吃 大份量
鍾歆宜鍾歆宜,5,餐點美味，上菜迅速，份量又多，服務人員親切。新店址裝潢明亮乾淨，比從前羅斯福舊店址昏暗感覺好很多！推薦！
Eugene Chang,4,"東西不錯, 價位合理, 麵包配抹醬真的很不錯吃"
Yi-fang Tsai,1,"本來看了評價想說食物好吃的話，服務品質打折一點應該還好，但真心覺得店主要仔細篩選店員，不然好吃的食物真的被這樣的服務品質浪費了！

一個剪著齊瀏海的年輕女生以及負責櫃檯點餐的金色短髮女性的服務態度真的不敢恭維，原本想要好好享用美食的興致都沒了"
Sean Wang,5,餐點很有特色，好吃，套餐比較划算，份量足
jack chang,5,簡單乾淨。食物好吃，特別是沙拉跟德國豬腳。
賴韋霖,5,啤酒好喝，豬肉好吃
More Wu,5,比起老店顯得年輕感
Chiu James,3,"上完麵包跟湯之後
等了半小時才上沙拉
之後的主菜跟飲料也等很久

服務 1
餐點 3
整潔 5"
詹蕙宇,5,和朋友點的每一道菜都很美味！
洪可容,5,非常推薦加購套餐，餐點好吃😋
陳芳瑜,5,餐點好吃😋 份量十足
Hung-Ru Lin,5,食材新鮮，德國豬腳、沙拉、麵包都很好吃
Peiteh Chen,5,餐點好吃
Roger Tsai,5,週間早上去享用一個豐富的早午餐是很愉悅的一件事。份量十足而且感覺很健康。
Peggy Liu,5,麵包類好吃，蘋果派好吃！
鄭明宏,4,不錯的德式餐廳，該店的德式豬腳蠻好吃。
m c,5,餐飲道地 服務週到
潘士賢,5,健康好吃的餐點，之前就很愛去仁愛店，現在在公館也開了分店真是太棒了！
Sally Smidt,5,食材新鮮，健康，美味。
Ming-Hsiu Chiang,5,環境舒適，餐點好吃有特色，收入口袋名單
allen,5,價錢稍高
ching yuan wei,5,副餐蔬菜多樣、色彩豐富，甜點非常好吃
IKU,5,餐點美味，豬腳非常非常好吃😋
RQ Z,5,乾淨舒適的空間，很適合朋友間聚餐
ryder chang,5,綠色景觀，德式風格裝潢與音樂，服務態度好，氣氛佳
Tina Tseng,4,食物很驚艷！早午餐、沙拉、豬腳都超好吃！甜點雪花蛋糕也很好吃，非常適合多人聚餐，麵包也非常美味，吃的出店家的用心。
蘇牛奶,5,高蛋白餐點好吃又均衡，甜點跟飲料都很好吃
Cindy Lee,4,食物蠻好吃的 但價錢相對於餐點份量有些小貴 雖然是個可以喝到好喝德國啤酒的地方 但居然只營業至晚上9:00 不太合情理 沒有特別提前詢問的話 會聊到一半突然被告知營業時間到了 感覺不是很好 建議店家可以延長營業時間
Alan Chen,5,大推「喝醉的馬克斯」，還有「茄汁咖哩牛肉起司丸」
曹momo,5,生意很好，服務也好。單點份量就很多。
洪禎蔚,1,服務態度很差
羅靖傑,5,屠夫套餐不錯吃，份量也夠！
Nancy Chang,5,環境很舒服，餐點CP很高👍
花花世界,4,厕所環境乾淨無油煙，有很多的健康餐點可供選擇，飲料也調製得很好.現在餐廳附的紅茶已很少又濃甜度又能調得剛好的店了.紅茶正確的口味應是這樣；現在外面的飲料店和咖啡店不是過甜，就是矯往過正不加糖.
賴宜君,1,"1. 女兒在廁所跌倒 從小馬桶上跌到地上 頭著地馬上腫一個大包 皮下出血 覺得廁所設計不良 小馬桶旁邊完全沒有任何支撐矮牆或把手空蕩蕩在大馬桶旁邊 女兒重心不穩跌落地上 但餐廳除了給予冰塊慰問之外沒有任何表示...
2. 一個廁所具有兒童專用馬桶 菜單有兒童餐 但是整個餐廳只有一張兒童椅？！！？所以要帶小孩來的人可能要考慮一下
3. 我們六個大人點了家庭餐可以給六個大人吃的 但是兒童仍然被要求要低消 所以必須再點200元以上食物 其實份量超多根本吃不完 上菜速度慢 …"
洪文彬,5,麵包，蛋糕水準一流。餐點有特色，德式主菜加120元變成有麵包，湯，沙拉，蛋糕，飲料的套餐，超划算，也超撐！適合帶家人，朋友共享美食的理想選擇。靠近捷運「台電大樓站」，附近有停車場，交通方便。
伊芳,5,豬腳好好吃🥰 湯也好好喝🥺 推推
WU KASEI,5,蛋糕沙拉餐點都很好吃❤️
林雅惠,4,最愛自選沙拉餐  (´ε｀ )♡
謝怡萱,5,麵包好吃～服務親切！
Ho Steve,4,比較建議點豬腳喔！
Sunny Huang (Sunny),5,餐點都好好吃服務又好😊😊
陳志道,5,健康蔬食，美味精饌，讚！
雅琪,5,好吃有飽足感
Iden Hou,4,"價格在這區域算中價位但滿滿健康原型食物
愛麵包"
黃珮庭,5,很美味！套餐加價也十分划算！
hung tung-tung,5,沙拉很棒 健康又好吃 選擇多樣
林行,5,服務態度很好，麵包好吃
Jason Chien,5,好吃但是一定要訂位
Yu Chen Chang (玉貞的網路日技),4,剛開幕不久，點三合一沙拉套餐送湯和飲料、整間坐滿滿的，覺得蠻吵的，但人多因此出餐時間有點慢。如果沒送約420元。但口味普通。
張文莉,5,超好吃，很實惠，又有營養
簡茜儀,5,適合健身的人來吃！👍
Abbie Huang,3,提供多種早午餐可選擇。方便。
獨孤求食,3,新開幕的店（應該是從溫州公園搬遷至此），還沒機會入內用餐，下次找機會試試
Kai-Yu Fun,5,點套餐cp值高，麵包的醬料和沙拉主餐都很好吃
李苡甄,1,麵包好吃，但主餐很不符合胃口，幾乎剩一半以上，店家似乎沒有要關心的意思。
GloriaHsuxo,3,"餐前麵包很好吃，湯品也不錯，
主餐的部分真的要慎選⋯⋯
焗烤松露野菇燉飯佐料不單單只有菇類有蠻多配料，口味蠻清淡的，
另一道主餐牛肩的部分真的很不ok，吃起來以為是無味乾肉難咬到不行之外，肉不知為何口感粉粉的比重組肉還糟糕，醬汁也是無味，在德國餐點都很重口味，可能是要配合台灣飲食習慣才做調整但真的好清淡，但原以為可以品嚐道地德國味，加上餐點品質真的還好，所以有點失望⋯
飲料放到最後才上也不是德國會有的(通常都會最先上再點餐)，除了餐後會再點杯咖啡以外，但飲料甜點也都是好吃的。
價位跟德國餐廳差不多，但品質部分可以再加強。"
吳曉貞,5,環境舒適宜人，食物健康美味
陳顥文,1,"餐點口味過於重鹹，鯷魚濃湯味道相當死鹹，導致後面主菜享用時無法盡興品嚐！更甚者，湯喝完後口會更渴！無法接受～
.
1. 牛肩完全不用擔心寄生蟲，全熟～需考驗自己的咬勁，很有咬橡皮筋的感覺！再淋上完全冷掉的湯之後，我頓時以為是在吃法式冷盤，旁邊的菠菜泥更是一絕，完全不知道幹嘛用的，搭配牛肩更搶戲，冷掉的菠菜泥很噁心！
.
2. 綜合臘腸拼盤醬汁很少，中間的起司臘腸很閒～酸菜偏臺式酸菜，整盤有一點像台式臘腸，與我在德國當地吃到的哥德風味相差甚遠！！！
.
3. …"
楊美蘭,5,"好吃的食物，清爽乾淨的環境
聚餐的好地方喔！"
Dan Shih,5,美食，服務細心，環境很好。
張瑜倫,5,"食材新鮮，餐點美味,且多選擇多樣"
JiaRu Li,5,德國豬腳皮焦夠入味。
Vivian Wu,5,"氣氛佳，食物美味， 服務人員態度好 ❤
超級推推推"
Lee飛,5,餐點好吃健康，極度推薦！
Ivy Lin,5,適合健人運動後的健身餐點！
文翔,5,德國豬腳皮脆，肥肉化開，好吃！
Leonie Kuo,5,餐點好吃，啤酒好喝，用餐環境佳，服務態度好。希望搬家之後的環境一樣舒服～～～
淑宜,5,"食物份量大又好吃又健康，服務人員很nice,值得再訪的好店"
Lee Tanya,4,道地的德式麵包(ㆁωㆁ*)
Manto Huang,3,餐點口味不錯，甜點蛋糕甜膩
Erica Fung,4,"它搬家了
好喝的德國啤酒
很扎實好吃的蛋糕
可以來吃早午餐
到2019/8/31
德國啤酒買一送一喔"
Odile Shih,5,餐點好吃，沙拉吃兩次都滿意，蛋糕也很棒
WENDY LIN,5,很好吃～已經吃好幾次了
Bruce Liu,5,以德國道地口味為號召，吃得出與台灣飲食習慣不同的滋味，麵包與湯品都十分用心，主餐份量足，冰紅茶風味獨特，甜點巧克力蛋糕甜而不膩。
chenghao den,3,單價偏高，食物不錯
元梃,4,不喜歡太健康的料理
陳紀伶,5,蛋糕好吃，服務佳
Viola Chen,5,"起司奶醬肉丸超入味＆麵包都超好吃
搭套餐超划算"
林精一,5,價格公道，口味佳。麵包、啤酒有特色。
I-Chun Lee,5,好吃又健康， 煎雞腿排非常嫩又多汁
Aaron Meng (AA),5,好好吃，要來吃雞腿唷！
yu-ming chie,5,麵包及抹醬好吃，午魚及紅藜飯好吃，值得一試。
Gene Hong,2,有做失敗的時物，還想以價制量?
劉家俊,5,份量大，帕尼尼超好吃，口味剛好
吳紹陽,5,乾淨，料理好吃外，甜點不會過甜是優勢，吃完完全不會有甜膩感
李尋歡,4,德式料理很美味，歐式麵包口感紮實，但主餐的維也納豬排稍微乾了點
蔡鄭運,5,好吃！有回到蜜月的感覺~
LiesegangRings里色崗斑馬紋,4,商業午餐實惠好吃，服務親切，不過被告知2019/7/7要搬家換地方。
張西米,5,菜單的設計讓單點或套餐都有彈性，價位也算實惠，自有烘焙的麵包糕點都很美味。餐廳位質很好，眼前就是古蹟和公園，大眾運輸也方便(捷運台電大樓站)。
賴思均,5,很好吃！推薦👍🏻
陳彥竹,4,"主餐蠻好吃 希望配菜沙拉可以多一些 豐富些
不然有些單薄"
chang denver,5,餐點好吃又滿足有德式風味
張琳,5,套餐的麵包抹醬好吃
秉學吳,5,這家德式料理的餐點價格稍貴，約在300-500之間，但有著相當飽足的商業午餐，在非假日的晚上，亦有350左右的超值晚餐可以點，菜單豐富，餐點可以說是琳瑯滿目，從必備的豬腳、香腸到國民美食德式肉丸一應俱全，適合想要嘗鮮又有一點預算的朋友。 …
Ann Hsin,5,好吃！店員親切！可惜麵包塗醬沒有青醬了…
