author_name,rating,text
洪伊柔,4,"去的時候很晚，湯賣完了有點可惜，換成甜點。
甜菜根沙拉跟黑麥麵包吃得不太習慣，剛吃覺得很新奇，滿不錯的，但吃多了還是不太合自己的口味。
主菜非常好吃，肉很嫩很入味，馬鈴薯泥也可以吃飽！
甜點也是很新奇但無法吃多。
整體來說算是去吃個俄羅斯菜的經驗，口味因人而異，還是頗值得去嘗試一下的😊"
Lee-Lien Wang,5,樓下有賣一些有趣的俄國小商品
david Wang,5,餐點美味又道地。
邱定卉,3,有特色的俄羅斯風味菜
yawei lee,5,風味獨特，價格合理
Hawk Lee,5,餐點特殊，味道也不錯
陳偉誌,4,很特別、精緻的異國美食
林娟,4,溫馨用餐氛圍，異國料理 很實惠了
Chan 14s,2,"最便宜400塊
一進店裡沒人招呼
餐跟餐上菜間隔太久 20分鐘吧
我只好一直看影片
味道還行"
愛可,5,超值，道地俄國美食
Jerry Wang,5,非常有特色的一間異國餐廳，餐點非常的道地且有特色，從湯品道甜點都很令人驚艷。
Jui ping Lee,4,食物不錯，單價偏高但可接受
KUANGFU TENG,5,價格合理，味道特殊的異國風味，店裡佈置也很用心，值得推薦
Min Wu,4,"沒吃過俄羅斯料理
餐點好吃，羅宋湯很好喝"
Clement Wu,5,餐點好吃有特色的餐廳
詹佾哲,5,服務跟食物都很好
papa lee,5,餐點好吃！甜菜根沙拉沒有討厭的土味，小朋友都喜歡，羅宋湯也好喝！甜點的布林餅炒好吃，奶茶也香濃，值得推薦！
陳俊樺,5,餐點美味的好地方
Please Sitdown,3,前菜跟甜點都可以，當下以為自己說不定能喜歡俄羅斯料理，結果主菜沙皇烤肉口味很不愛，很鹹以外，肉也煮的很老。不過就算了，豬肉燉久了就本來就會變老。店家附上的馬鈴薯不差，但沒有飯也感覺怪怪的。
Yijun Chen,5,"羅宋湯很美味
器皿陳設都很漂亮"
ポンポンチョウ,4,餐點滿特別的，套餐組合很多種，甜點都好吃，很適和朋友聚會
Shun Ching,5,菜品好吃、特別
王睿謙,4,位於公館附近的巷子內，餐點還不錯，就是貴了點，份量有點少。店內裝潢很有俄羅斯味道。除了餐點外，還有販售俄羅斯的特產，像是伏特加、俄羅斯娃娃、醃黃瓜等等，用餐之餘，還能買些伴手禮。
C C,4,"餐點是一般的西式風味, 雖不是太令人驚艷, 但是口味也還算可口...餐廳整體裝潢和氣氛溫馨異國風...也不會太吵...但是空調有點悶不夠涼爽(可以請店家提供電風扇)  ！整體來說是個適合跟同事或朋友談天聚餐的地方! 有機會會再去!"
鍾承煜,5,"羅宋湯令人記憶深刻
醃豬油的口感非常獨特
絕對值得再去一次"
廖郁雯,3,價格偏高，蘋果冰淇淋布林餅很棒，主餐沙皇烤肉還好...
Robin Lan,4,份量過少 但是好吃有特色 特別喜歡他的蘋果酒 店家自製 外面買不到~ 學校俄文系老師推薦~
Winnie Lu,4,推薦套餐組合，可以一次享有餐前酒、沙拉、主菜、甜點，整體CP值大約是3.5顆星，因為是獨特少見的俄羅斯料理，因此加至四顆星。
Jui서령,4,聚會的好場所 餐點和環境都還不錯 但本人是亞洲胃 前菜甜菜根那道不是很愛
林鈺玲,5,餐點很優質 很適合台灣人的口味 甜點優格餅大推👍
Akira Lee,5,甜點很特別 朋友聚餐適合約這家
Lee Daniel,4,來這裡吃過很多次了，推薦酸奶餅，羅宋湯也挺好喝的
Siang Yun Shih,4,"食物很有特色，沙拉跟羅宋湯非常棒~
主菜上來時僅有肉，薯泥，生菜等，原本還擔心不夠飽，但吃完後意外非常有飽足感xd"
林聖哲,5,"好吃 很道地
不過口味沒有很合"
中西攝影李大鏡,4,有特色服務帥哥親切！
王大邦,5,美味的烤肉 羅宋湯 和沙拉
柯空,5,喜歡吃異國料理的人值得嘗試看看
IG快門製造所,5,特別的餐館，優格甜餅好吃。
SATOU,5,很道地 很正統
Tingsen Ko,4,上菜有點慢
陌生人,5,食物道地、好吃，特別喜歡黑糖酸奶，外加老闆娘人很好
劉信呈,5,城堡裡面住著公主以及許多道地的俄羅斯美食
Alan Huang,4,食物很有特色，只是我們去的時候（星期天中午）似乎冷氣不太涼，整間餐廳微熱（雖然已開電風扇）...
Kenny影像日記,1,"想被當盤子可以去，當天跟朋友一入座菜單送上來都是套餐選擇，有分普通和高價兩種，菜單上也沒註明消費方式。

我和朋友都是沒吃過俄羅斯菜的人想說先點個套餐試試看，味道合胃口再加點。於是點餐時店員告知，假日皆採套餐用餐方式，每人低消為一套，我們表示那應該在菜單上註明消費方式，否則消費者很困擾。 …"
t1990322,4,"主菜還沒吃完，甜點和飲料就都上桌；上菜的時候可能還是要細心點。（服務生中文理解部分亦要加強）

料理部分，只能說被施了魔法。"
張簡亦杰,4,有調整過的俄羅斯菜，很符合台灣人的口味。
LIU Diaoyutai,5,食物好吃，還有不同的俄羅斯啤酒，伏特加，俄羅斯紅酒品質也很棒。不忙的時侯，老闆會介紹一下俄羅斯紅酒。
Albert Hsieh,5,"甜菜根湯很好喝
俄羅斯烤肉跟平常吃的不太一樣"
張啟衛,4,吃不太習慣
黃敬浤,3,價位在公館一代算中庸不貴，菜色還算不錯但沒有太出色，氣氛環境適合聚餐，廁所是免治馬桶讚讚！
楊寶金楊寶金,4,餐館老闆是俄羅斯人， 餐點是道地俄羅斯風味 ， 平日餐點369元 有主菜·湯·沙拉甜點含飲料 實在是便宜又好吃， 又不收小費， 建議車可停到台大停車場，（ 由新生南路口入），（一小時40元 ） 餐廳巷內停車費用每小時80元。
fky lee,5,服務人員態度熟情很好！食品有質數！
邱彥行,5,東西好吃！
邱繼鋒,1,原本點餐就已有賣完了，所以限制選擇，但確發生了點餐後半小時，前菜已經吃兩道才來告知沒餐點，浪費客人的等待時間， 食慾大減！
麗元,4,"很道地的俄羅斯菜
坦白說吃得不太習慣
但是店內裝潢與氣氛很棒
服務也很好
也很適合聚餐聊天

前菜嫩鴨肉好好吃
布林餅蘋果冰淇淋也超級好吃
紅茶很棒 (旁邊的果醬被我直接吃掉

主菜沙皇烤肉有點吃不懂
主菜旁邊都會配一球馬鈴薯泥
沙拉跟湯都是甜菜根，也吃不太習慣
吐司口感偏硬、粉粉的

本來很期待蘋果香檳、莓果飲但是都沒有了

套餐399 全餐599 也可單點"
Ivan Sun,5,很喜歡，會常去
bear Chen,5,適合聊天的異國情調，下次還想去
Ching Hsin,4,三道式的套餐，羅宋湯料多味美，甜點也很可口，唯主菜的量少了一點，如果能夠附麵包就更好了
徐金伶,4,CP值算中等，食量大的會吃不飽😂😂😂
Jing Haung,5,道地好吃，價格公道
Gary Wu,5,"很特別且值得嘗試的俄羅斯料理，布林餅、沙拉、羅宋湯...等，都是台灣較少機會吃到的俄式美食，雖然台灣的烤肉串很有名，不過也可以吃看看俄式的烤肉串是什麼風味。

Мне очень нравится русская кухня. Здесь можно есть настоящую русскую кухню, очень хорошо и вкусно!"
鄭閎,5,喜歡重口味的可以考慮(味道很分明)，建議套餐即可。
Ching-Hung Hsieh,5,食物很特別，也很好吃，真的很傳統的俄羅斯風味。裝潢也很美！ 推薦。
戴瑋志,3,有一個店員很熱情，一開始會覺得滿溫馨的，像是很活潑很快樂的感覺，但是如果你也跟著他多聊幾句他會變得太多話，有時候講出來的話會讓人有點不舒服的，如果收斂一點會更好。食物很普通，不知道為什麼每道菜吃起來都差不多，可能是經過差不多的調味跟烹煮方式吧，雞肉豬肉牛肉到最後吃起來都很像，有特色是真的啦，第一次吃到甜菜根做的沙拉，但真的很普通，所以CP值的話可以說是一般般吧，就是花多少錢吃到怎麼樣的食物這樣。店內有一些特色服飾可以戴來拍照，也是滿特別的一點。總歸來說，如果想要嘗鮮可以試試看 …
胡惠珠,3,餐點主餐沒幾樣，但算是相當美味，尤其將甜菜根做為開味小菜，精過調味毫無土澀味，是很討喜而美麗的小食。小點心布林餅沾著酸奶吃，一口驚豔的美味，一定要點一份嚐嚐，只給三星，是因為菜色太少，有時還缺品項，而且份量嫌少了些，吃不太飽。
倩倩,5,好吃!好吃!對他們的甜點念念不忘 話說主餐也不錯但就是名字太難記得了！ 很值得推薦大家去吃
Тай Тай,2,"Пару дней назад посетила ресторан русской кухни в Тайбэе под названием Русский Терем. Сама живу достаточно далеко от столицы. После двух месяцев проживания на Тайване, я очень соскучилась по русской кухне, поэтому я и мой молодой …"
Leader Turn,4,主食甜點好吃，但份量少，吃不飽
孫裕棠,1,東西沒多好吃，等了一個小時後只吃到前菜，然後就突然跑過來說我們點的主餐沒了
Ann Chen,4,異國氣氛濃厚，就像置身在國外餐廳，餐點好吃有特色，特別喜歡甜點 湯品 沙拉~服務生也相當親切♡♡♡
taipei muscle,5,是俄羅斯老闆所開的俄羅斯餐廳。我雖沒去過莫斯科，但我相信它的俄羅斯菜在臺北市應可說是最道地的了。 …
魯夫結論哥,1,其實是朋友生日來吃這家店的，這家店其實開滿久的，店內裝潢是不錯，很有不同的味道，但一送菜上來，份量非常少，那時吃套餐，大概($300多)，一開始的羅宋湯，裡面有一塊酸奶，喝起來詭異詭異的，而且香料味又很重，沙拉的部分也是紅紅的一片，吃起來普普通通，再來就是主餐，傻眼，幾塊肉而已，再加上一塊馬鈴薯，完全吃不飽，看來我真的不太適合這種風格的餐廳，份量非常少，不又太好吃，各位如果要嘗試是可以來吃看看拉，但我應該就吃這一次而已。
豬豬豬,5,"吃過好幾次都好吃，羅宋湯很美味，前菜沙拉也是，甜點超愛優格餅，茶也夠濃夠好喝。
主菜偏鹹，但是，每一道都是會讓人把盤子吃乾抹淨的，豪豪吃。"
施尼克,4,不錯吃
張育捷,5,很有趣的餐廳，非常道地，還有頭飾可戴! 值得一嚐的料理!
Tien-Jen Hsieh,3,道地又有特色的俄羅斯菜
Jennifer Wang,5,份量剛剛好，燉豬肉很香很軟
全婆俠,5,很不錯的餐廳，蘋果香檳要點
張家瑜,1,事先電話預訂好7點，準時到現場卻等了30分鐘還沒有位子，店家也任何表示都沒有，非常令人遺憾
Alicia Zhan,4,主餐份量少，4號偏酸不合口味，7號像台式燉肉，莎拉和羅宋湯口味佳
張花媽,5,沙皇烤肉軟爛入口即化，甜菜根沙拉清脆爽口，布林餅蘋果冰淇淋爽口有層次，黑麥汁不似德國黑麥汁也不是黑的很特別，黑麥麵包不硬無味很特別
白瑾瑜,4,很特別的餐廳，很多外國服務生，不知道是不是打工換宿。餐點很美味，幾乎吃不到雷，皇家套餐是$799還$699，經典套餐$499還$599的樣子，個人感覺很划算。
台北ぽよ余,5,道地俄羅斯料理，沒有體驗過的蠻推薦來試試看，沙皇烤肉特別好吃
Chang Enzo,5,特別的俄羅斯料理，口味很特別，推薦大家去嘗試
cloud,3,套餐豐富。主餐略普通
Chelsey Wang,5,味道有一點鹹，但蠻好吃的，而且很有特色！
Hatawa Lee,5,"我的愛店...已押著好友N訪多次
也許我有俄國魂吧, 覺得每樣東西都絕好吃！
Love Russian <3
雖然擴店後漲價, 份量也變少...沒有以前吃到很撐的感覺～但口味上還是給大拇哥 :)

2016/10/01更新：平日晚間又N訪，一樣點沙皇烤肉，醬汁一樣好吃但肉卻變得柴⋯咬到嘴巴裡都乾乾的，食物感覺也溫溫的。希望只是例外而不是退步⋯"
Vi N,4,"有特色。食物因人而異，東歐食物並非所有人都能接受，個人相當喜歡。
可惜菜色不多，多年來都是一樣的。"
林禹棠,4,平價又好吃 沒吃過俄羅斯料理的人可以來吃吃看 hehe
Vergil White,5,體驗不同風味的美味餐點
陳柏瑞,5,口味不錯，很特別的異國料理。湯，沙拉，前菜，甜點都很精緻。主食魚餅好吃，其他肉類也不錯。用餐環境氣氛不錯。缺點則是上菜的速度較慢，以及主食份量較少。
黃信穎,4,"餐點都很有特色
甜點的鬆餅很好吃
不過份量稍少"
chia chia,5,布林餅必吃，適合朋友們聚餐的地方
iHappyTime Andy,2,"特別的味道
主菜上桌速度若可以再順暢一些 更棒！"
Jing Su,5,甜菜根沙拉好吃，羅宋湯的肉入口即化，比福斯特羅甘肉軟嫩醬料特別，餐廳佈置特別。
Julia Lin,4,菜色非常道地但小孩吃不習慣
倫敦樹,4,蘋果烤雞好吃，份量很少。
Allen Chang,3,用餐環境不錯，套餐399，有沙拉/湯/主菜/甜點/飲料，但味道很普通，份量小，使用不少醃漬蔬菜。
Noah Lezi,5,餐點好吃，餐廳裝潢擺設也很有歐洲小館子的氣氛。Очень хорошо!
Paulinchen Lee,4,在台灣特色的異國料理已經很少了，當然不要硬和自己在外國吃的口味，已經很不錯。有機會還是會繼續支持。服務人員很好，餐點也不賴。
Joy Nien,5,好吃，道地，又價格合理，我們是單點，建議一定要點(黑麥)麵包來沾主餐的醬料，好吃也增加飽足感!  道地的俄式羅宋湯就是加酸奶，沙拉是甜菜根沙拉+油醋醬吧，味道很簡單，品嚐食物原味。列入口袋名單!
Jason Chou,5,我還蠻能接受這口味
孫如文,5,沙拉和甜點都滿有特色的，牛肉和雞肉料理也很好吃，和一般西餐口味不同！
Xin,4,特別的料理，都是台灣一般沒吃過的味道，服務非常好，店員女孩們很可愛，不吃牛肉還有特別的甜菜湯可選擇，裝潢很漂亮非常多裝飾品可以觀賞～
Charlene Chiu,5,非常好吃，特別的體驗
Coco Amai,3,台灣少見的俄式料理 其實味道普通（吃了常拉肚子）但相當有特色 推薦布林餅和奶茶
MM XX,2,餐廳很悶熱，上菜～非～常～慢！餐點份量很少，套餐一份$399，CP值很低，用的食材也是便宜的食材，總之不推薦！
blue Fan,5,甜點很好吃，羅宋湯好喝
黃清峰,3,食物特別還不賴但冷氣不夠強
Carpe Diem,4,餐飲美味 服務親切 Nikita的中文才學2年 太優秀了
劉秋彤,4,俄羅斯家鄉菜非常好吃！
Tashi Shen,4,麵包跟鴨胸很好吃
楊晴,2,"餐廳很好，是很正宗的俄羅斯料理。
而這次的體驗我確認到自己不喜歡俄羅斯的口味~

優格餅好吃(ฅ´ω`ฅ)"
李清安,3,道地俄國菜
Avery,3,蠻特別的但吃不太習慣
Shannon Huang,5,異國風料理好吃
Thanatos Zhu,5,道地的氛圍，餐點極富異國風味，價位意外的有善，沙皇烤肉、西伯利亞的秘密極推
唐文一,5,餐點好吃氣氛好
赫蓮薧錫,5,"推俄羅斯酸奶
酸奶搭配肉桂粉好吃又解飽腹感"
陳昱霖,3,"1.環境安靜氣氛佳，情侶約會嚐鮮可以考慮
2.若以食材和份量看，價格頗高，吃特色口味為主，男生大概吃不飽(基本套餐)"
C. C. Teng,5,獨特的俄羅斯風味餐廳，價格合理 ，值得到此一嚐。
qugi lin,5,餐點很道地，布林餅特別很好吃！奶茶好喝，不過覺得份量稍微少了點，環境很舒服，常看到美麗及帥氣的俄羅斯人，有機會會再來吃，也會推薦朋友來吃。
Christina Sung,3,奶茶和乳酪餅很好吃，主餐份量較小。 洗手間只有一件，要排很久。
王so,5,從沙拉 湯 主菜 到甜點飲料每道都很特別，很有異國風情，有值回票價！外國服務生很努力巡桌，主動發現我們這桌還有ㄧ份甜點沒上，匆匆跑去拿來還ㄧ直道歉（我們沒有等很久啦），努力講中文的樣子很可愛。坐蠻久的也不趕人。會再介紹朋友去聚餐。
王繼華,4,菜色特殊，份量稍小，但仍值得推薦
Allie Wu,4,餐點好吃，甜點布林餅很特別，主餐份量精緻偏少
淑慧,5,食物好吃，羅宋湯超讚
Wang Paul,5,很有特色，很少吃到俄羅斯料理，甜菜根沙拉清爽美味，主餐也各有獨特之處
Mollie Huang,5,"外國人店員人很好但聽不太懂中文英文也好像不太通？！
料理整體而言還不錯 雖然在學區附近價位算頗高但當作是體驗一下不同國家的食物
推薦羅宋湯 奶酪餅 亞美尼亞烤雞"
Wei-Lin Hung,5,老闆是俄羅斯人，餐點非常道地好吃，極富特色，以臺北俄羅斯餐廳來說價格算便宜，記得去之前定位，尤其週末客人較多。
林紋如,4,好特別餐廳好多俄羅斯娃娃
Vivi Hu,5,帶家人去吃覺得滿意
林美華,3,品味異國風味好地方！尤其俄羅斯黑麥汁很讓我回味無窮！
楊小明,3,優點是很少能吃到俄國菜。缺點是很普通
Nate Lo,4,"套餐性價比還ok
算是一次特別的異國料理體驗"
陳宜嫺,5,清爽、不錯、CP值高！
成興桃,5,道地的俄羅斯料理，美味口感特殊，且價位不高。尤其羅宋湯更是給人回想又回到了莫斯科。平常習慣異國料理的朋友，或許你習慣了意大利麵，泰國料理，德國豬腳，日本垃麵和豬排定食，美式餐飲，但我特別推薦給你，試試這家俄羅斯餐廳，真的很不錯。
dolly loh,5,很自在，沒壓迫感，菜色特別，老闆老闆娘很親切，還有俄羅斯商品可買，讚
楊舒淵,5,食物好吃，套餐份量適中，服務態度親切。我有去過俄國，這裡的環境蠻有當地傳統餐廳的舒適氣氛。
Mu Yu-Tang.,4,"俄羅斯奶茶味道蠻好的
甜菜跟沙拉第一次嘗試蠻特別的還不錯"
方方,5,前菜醃豬油很特別，餐還不錯奶茶很好喝
Mag Li,5,食物很道地，甜菜根處理的美味，適合約會聚餐
kilo po,5,非常好的體驗，容易讓人忘記身在何處。紅茶很特別，忍不住想多帶一包回去。感謝店家的寬容與派對邀約，下次一定會再去。
花花,5,非常好吃，本來以為俄羅斯食物會吃不習慣，但真的很好吃！會想再光顧的餐廳
Haowei Chang,4,算是滿有特色的店，服務與氣氛等尚可。
YuTing Wibke,3,價位偏高，俄羅斯料理很特別，但不是我的菜。甜點比主餐好吃。
Liang-Kai Chu,3,略貴 但可以吃到少見的異國風情。有一些酒類。人不多 蠻適合多人聚餐的
黃Frank,5,俄羅斯飲食有特色，交通方便，環境良好，好友聚會、團體用餐均合適，服務態度親切，價格適中。
yi lee,4,很有異國情調的料理，有特色喔~
Su-Yun Huang,4,美味，不貴。
路過中天的謝安,4,很有特色的俄國家常菜，好吃但是份量有點少！
KuanWei Lee,5,"推薦沙皇烤肉套餐。前菜是甜菜根, 酸黃瓜和蔬菜，很開胃; 湯是羅宋湯，湯的料給的滿多，有一塊不小的牛肉塊，可能是因為蔬菜去燉的關係湯，湯滿清甜的; 主菜的梅花豬肉搭配俄式酸奶醬和酸黃瓜，滿好吃的。俄國奶茶的奶味很濃又順口，之後還會來用餐。"
oo liu,1,"餐廳的溫度高達近30度，拜託店家把冷氣溫度調低一點，店家表示這已經是冷氣的最低溫度了，無法調低，導致用餐時非常不適
拜託店家黑麥汁加冰塊，店家也無法提供冰塊。最後上的甜點冰淇淋已融化成水。感覺在此用餐非常痛苦。"
蔡承翰,4,食物很特別但上菜速度偏慢服務需加強
阿光小眉毛,5,好幾度光臨的店家，蘋果冰淇淋布林餅真是人間美味！
Lotus Tang,5,食物美味，服務親切，空調稍微有點熱
Pan enen,4,菜色口味具特色，看個人接受度。很喜歡湯與入口及化的牛肉，炒飯普通，甜點很特別。有點價位。外國店員有點有趣。
helen chen,2,甜菜根是俄羅斯典型菜色，店家最近沒有甜菜根可以進貨，但是卻沒說明，吃的沙拉只是普通的馬鈴薯沙拉，羅宋湯裡也沒有甜菜根，收的價錢卻是一樣的貴。跟店家反應了也只是說聲不好意思。做生意不老實啊！
