author_name,rating,text
Liz Ou,5,店員蔡小姐很親切又不會給人有壓力，專業又有耐心一一回答我的問題進而幫我找到完美的解決方法，行程規劃交給他好放心，大推
Regina Pang,5,"旅遊諮詢回覆迅速且專業，價格亦合理；

門市的業務江佩容小姐服務親切有禮，也不會亂推銷行程，讓客人不會有壓力

值得推薦的可樂旅遊門市！"
Huang hsun-ting,5,大力讚賞蔡小姐的服務，服務熱心處處細心為客人著想，很幸運有蔡小姐的服務，下次還是要找她規劃行程，金架讚啦
耿筱曾,5,11/18飛美國舊金山，12/1回台灣，長榮華航機票都有特惠
邱煒晴,5,蔡小姐超棒的！按照客人需求規劃，也不會讓人感覺有壓力，服務親切又細心，值得推薦！
陳健民,5,雖然不大，但服務親切而且迅速。
水野道子,5,感謝貴公司江小姐專業&熱情推薦龜山島之旅，讓家人有難忘旅程
時將,5,"業務江佩容小姐對客戶服務好、細心
快來找她訂行程👍"
曹書婷,5,江小姐服務熱心親切，會依客戶需求介紹相關行程
陳彩藍,5,門市人員服務很親切又專業，下次還會再來喔
LI AI,4,服務親切，做事仔细，經驗豐富。
Kate,5,江小姐服務好，親切熱心
郭秉芝,5,門市接待人員很親切，待辦事項迅速。
ting,1,"第一次參加可樂旅遊的東京團體行，五天四夜早去午回，團費快四萬，其實不便宜！結果住的飯店有一間有霉味，一定要開著窗戶味道才比較淡，其他飯店也是舊舊的，整個行程只有含3個餐，其它都是自理餐，更誇張的是有一天導遊說今天時間不夠，所以台場只停留30分鐘～台場欸⋯30分鐘是要逛三小？🤬
如果時間不夠不會刪掉免稅行程嗎？根本沒什麼人想去免稅行程⋯
總之整體感覺很不好，不會再選擇可樂旅遊了！"
Elsa Lee,2,剛申請的護照外面上面被寫了一個N 不能寫在紙上一定要寫在護照上嗎⋯⋯？
Emma Wu,1,要去刷卡付款時 家人說要分期付款 幫忙承辦的先生很有禮貌  可是不知為何一旁的另一位女員工 要一直在一旁碎碎念 說全額或分期有差嗎 還不是一樣都要付 而且也不是看著我們說 邊用手邊的事 邊碎念 而且碎唸了不只一句 我不知道她是怎麼了 我們行程都確定了只是去刷卡 也沒問其他問題 更不是給她服務的 就只說要分期然後等待刷卡動作的時間 為何要被這麼不屑的碎念啊？
倪瑤軒,5,江小姐服務很棒/謝謝您/要出國—定要找她喔^ω^
James Hsia (Ezworker),5,只是來諮詢泰國簽證，沒買產品，服務人員很熱心解答。
予舍,5,莊凱智先生說明旅程仔細且服務親切 已是再回購可樂旅遊行程
陳婷婷,1,小姐服務態度超差的，辦個台胞證像求她一樣，超不爽的。🤬🤬🤬🤬🤬🤬
ChingHua Wu,1,"參加可樂克羅艾西亞之旅，門市詢問和行程表鄭R概稱入住十六湖內飯店。是以報名。
未料抵達卻稱未訂到湖區內飯店而改住十六湖拉車數十分私人飯店。
徒增次日參觀美麗十六湖拉車，入園已9~10點奔趕萬分，期待的美景全走馬看花，半跑半追匆忙拍照跑完16:20就催趕搭船出十六湖
真是失望扼腕生氣甚。
也超遺憾失望反應鄭業務員竟延拖12日無回應詢之稱""公司大處理要很久!""，又強稱住十六湖內飯店和十六湖外面也算是十六湖""區""...
又稱他只是一介小業務員能力有限， …"
TSAI YILUN,5,去門市詢問行程，服務的人員林姿妤小姐很詳細的解說，也不厭其煩地回答我們的問題，讓我們很期待接下來的旅遊～
呂小魚,5,沒有遇過這麼好的服務！真的超級棒！服務我的是一位江小姐，態度親切，專業！大推！
kung sun,5,業代服務親切，講解詳細，令人印象良好。
Frank Hsu,5,代辦護照方便，價格合理有效率，服務態度佳😀
Chin Mei Chen,5,門市人員林姿妤解說的都很清楚，即使一點小問題也解釋得很清楚，讓人很放心！
Joyce Chio,5,業務人員莊先生服務親切耐心介紹行程。下次一定會找可樂報名！good
李欣怡,5,非常感謝 信義安和門市業務鄭名孝 的幽默又風趣的專業介紹 讓我們公司的員工旅遊非常滿意 開心
S. L. Tsao,1,"參加“紐約購物趣” 行說明會, 總公司現場客服人員竟然皆不知道有說明會議. 當天導遊更是很不專業, 一直在講 “紐約就這樣... 就這樣” 既無專業也無心.
當次紐約行的導遊一直自己走自己的, 隊伍拉幾個街口長, 團友走丟了, 打電話給導遊也一直未開漫遊, 事後也謊稱有開機並無來電、回台灣又謊稱當時在對團友解說行程所以沒有接電話, 自打嘴吧.  可樂旅遊事後也不追究, 一切皆傲慢, 或許是該分點 ""信義安和"" 可樂旅遊的部門主管問題, 但是真的態度傲慢！千萬不要選這分行！ …"
陳草莓,5,服務超級好👍👍記得找佩容❤️
Mei Yang,5,推推～業務王珮人 服務非常親切，詳細介紹每一個行程，且會按照需求推薦適合的行程，出國旅遊首選
李昭吟,5,"服務員王珮人
服務很好，詢問問題後給的內容都很詳細
問完都想跟他購票了👍"
黃孟吟,5,門市人員姿妤服務態度好，非常推薦👍👍👍
邱金英,5,江佩容服務很棒，人又美。
劉世賢,5,"謝謝林姿妤小姐的親切服務。
相信我們的韓國釜山鎮海賞櫻之旅，一定超圓滿~"
孫櫻芬,5,謝謝江佩蓉小姐的細心協助及提醒，讓我們每次的旅遊都能玩得盡興及留下最好的回憶!當一排到假期就想到趕快找可樂江小姐!
Chen怡臻,5,第一次到安和路門市，非常感謝業務的協助幫忙，可樂旅遊棒棒
林襄琦,5,解說詳細，很有耐心(⁎⁍̴̛ᴗ⁍̴̛⁎)
Lantis Chang,5,佩容姐姐人很親切，服務很棒喔！
吳政育,3,"非常不好的回憶，服務小姐服務到一半就直接服務別的客人，完全沒有跟我們告知一聲。

當天立即得到商家回應，所以更改評分。"
hunter fanjan,5,業務林姿妤小姐服務很周到也很熱心，推一個。
夏天,5,在這次旅遊找了“可樂”遇到還不錯門市服務人員“林洧伶”小姐，是位漂亮小女生，謝謝她很有耐心幫我找了我要的行程還幫我放大字列印，真的很謝謝她!!我推薦大家可以找她幫忙～難得遇到這麼熱心～有耐心的人～推～
Yun Yun,5,"這次遇到的門市人員 江佩容小姐, 熱心介紹各種行程, 很會為客人著想~~非常棒!!!"
游筱筠,5,"詢問行程問題
就非常熱心回答~
非常棒~~~~"
翁小玉,5,佩容小姐服務超好，每年都要來找她麻煩！人美心好服務佳！
Sally Cheng,5,"謝謝👍👍👍江小姐親切又詳細的說明行程
讓我有個愉快的旅程
下次旅程 ㄧ定會再麻煩江小姐❤️"
呂增蘋,5,門市位置優越．現場乾淨整潔．服務品質非常好．說明內容清楚易懂．亞雯大姐超親切
Lilien Chuang,5,門市 莊先生服務優質又親切~讚
Yayi Yang,5,門市業務莊先生服務周到細心， 能夠依照我們的需求給予建議行程，出國前也會貼心提醒注意事項，感謝莊先生的幫忙~~
洛洛,5,江小姐服務周到，非常專業
Ninon Tsai,5,王先生和鄭先生都很親切很有耐心說明，不會給人壓力。推!
Kevin浩,5,信義安和門市，鄭先生和江小姐熱血服務，非常好
Keira Yen,5,江小姐很專業積極，謝謝她讓我們每次都有美好的旅行。😊
Kuo Phoebe,5,江小姐服務很優質。
林姿伶,5,門市林姿妤小姐的服務相當優，對顧客很有耐心且親切回答，下次會再光臨
李詠琪,5,江小姐服務周到，親切
CHI CHI,1,專員凌晨日期都搞不清楚 要去東京旅遊 詢問後 介紹也消極 專員可能想下班了 或是業績到達了不缺業績了
tzu-pei Lin,5,業務林姿妤服務周到很貼心 有任何問題都能積極協助處理 讓人很放心!
陳龍君,5,客服莊先生服務熱忱、親切
용,5,門市業務服務親切熱情。下次還要再找可樂
陳昱臻,5,"可樂旅遊 -呂亞雯 積極認真 服務親切⋯
下次旅遊我們還會再找她。"
小明王,5,服務認真！謝謝門市人員不遺餘力的介紹行程讓我有個愉快的出國假期
Vivian Wo,5,江佩容服務好也很專業！不用上網找來找去真好又方便！
Kitty Ko,5,佩容服務很讚！人很nice
Ro man,5,服務非好！謝謝莊先生
May Chen,5,林姿妤小姐服務很有耐心，如果有問題推薦大家找她
李阿僑,5,莊先生親切、行程介紹清楚
徐肇伸,5,服務情切很周到～
L aycan,5,門市林姿妤小姐服務親切，又很有耐心的介紹行程，真的很棒。
ruby lai (娟娟),5,門市專員很熱情又很專業，很有耐心解說，要出國一定要找可樂啦
Roger Lee,5,林小姐，服務很親切喔，大家以後可以多找她
彭小萍,5,服務人員人很熱情～
潘義鈞,5,門市林小姐服務態度很好且細心，提供實惠的旅程，下次還會再來
Irene Yang,5,服務很好，員工都非常有耐心，旅遊經驗非常愉快。
黃捷,5,門市小姐服務親切，又很有耐心的介紹行程，真的很棒。
Sakura Kim,5,莊先生非常熱心，服務一流，推薦！
李德治,4,交通方便 服務不錯 導遊很好
Ping,5,鄭先生很親切，服務熱心快速，非常謝謝他
hsin hsu,5,人員服務很好、親切
grace ko,5,江佩容小姐親切，服務熱誠，賓至如歸，感謝提供服務！
chia-hui Liang,5,服務人員很親切也很熱心～～超讚的！
Hai Hua Wang,5,謝謝莊先生親切的服務👍
Jason M,5,服務很好！很細心！推薦業務鄭名孝！
debra Doong,5,服務專業，態度誠懇
AIS,5,業務王佩人 待客親切 有求必應 很為我著想
Lee Andy,3,服務親切
shihfeng chang,5,門市林姿妤小姐服務優良親切，歡迎來找他~
Angela,5,江小姐服務棒棒噠~
劉沛昤,5,介紹歐洲旅遊可以來詢問，行程規劃不錯！
Wang Jay,5,業務先生的服務很好，回答問題很完整
Grace Wang,5,江佩容小姐服務親切讚
圓頭阿文,5,可樂林姿妤小姐，服務比熊濕好太多了⋯⋯
Ong R,5,江小姐服務非常好
游怡得,5,很推薦這家旅行社
游文琴,5,11/18至可樂信義安和，姿妤小姐服務很好
Grace Huang,5,鄭先生熱情服務，足為旅遊工作者楷模!
Gloria Chi,5,鄭名孝先生服務態度甚佳效率高
Jessie,5,"莊先生服務態度👍👍👍
行程推薦的👍
大家可以來可樂旅遊信義安和店哦"
H TSENG,5,鄭先生服務很好有熱忱～
tequila jason,4,除了不好停車，其他都還不錯
嚕嚕,5,江小姐服務很棒！！謝謝！非常期待我的旅程
Christine Chen,5,可樂旅遊 呂亞雯 服務超讚的啦！推薦給大家！
Evelyn Chiang,5,江小姐服務很優💪🏻💪🏻
蘇菲雅,5,門市人員服務認真，本人很滿意，特別謝謝鄭先生，謝謝
蔣志虹,5,江小姐 服務客氣親切，效率佳
徐貴楊,5,服務員林姿妤能詳細解說，服務不錯！
kimi kuo,5,在這裡報名奧捷行程，報名後都有簡訊通知後續的安排，不錯
李國偉（My God Li）,5,鄭先生超有耐心也很用心推薦
ien66 W,5,林姿妤小姐服務非常好，值得推薦
WeW Chi,5,服務人員 鄭名孝親切專業👍
YC L,5,門市林姿妤小姐服務親切，棒棒=)
江承儒,5,業務小姐很細心且有耐心
RuRu Lai,5,服務人員態度很好，講解很詳細
彭spring,5,服務非常好，很棒，超推薦！！
資訊,5,業務王佩人 服務很好 感謝他的介紹
Celine HUNG,5,服務員林姿妤待客親切，服務佳!
傑利,5,旅遊規劃 專員鄭先生服務不錯 可以找他唷
廖芝儀,5,江佩蓉服務讚！
Hsin-Chi Liu,5,安和門市的鄭先生服務非常的貼心與週到。謝謝幫忙嚕。
黃佳菁,5,江小姐服務不錯👍🏻
許美惠,5,莊先生粉親切👍
Mei Lee,5,鄭先生服務非常好，推薦此門市！
品閣學苑,5,業務王佩人很親切 介紹行程很仔細
羅珮琳,5,鄭名孝先生服務👍👍
王丹綺,5,姿妤服務很好
張佳琪,5,林姿妤~服務良好.有耐心
ANDY CHEN,5,服務很好，親切很滿意。
Eddie Tan,5,林小姐服務親切專業，讚！
江佩蓮,5,信義安和門巿業務服務親切..讚...
洪美珍,5,謝謝信義安和店莊智凱&林姿妤，祝愉快。
z LI,5,江小姐服務非常好！
Judy chen,5,服務人員王珮人很讚。
Jasmine Lee,5,服務細心，介紹的很棒喔～
林先生,5,姿妤服務好
李瑋瑋,5,"信義安和門市的鄭答應服務的非常好
想去旅遊歡迎來找他"
Chiachia Hsing,5,姿妤好棒棒，謝謝幫忙
Carol Hsieh,5,莊先生很親切，說明很詳細。
Alice LEE,5,路線安排理想，服務親切。
盧玉,5,王珮人服務很親切誠懇很棒
王時俊,5,林姿妤小姐服務佳，讚！
Yi-Bin Chen,5,林姿妤小姐服務很好，讚！
ehua chou,5,安和門市林姿妤小姐服務超好，讚👍
晴兒,5,"服務速度快👍
人員客氣有禮"
陳玟諭,5,服務的姊姊非常熱情，讚👍
胡芳芳,5,很期待的行程，交給專業的旅行社
蔡佳佳,5,鄭先生服務很好~很親切!!
倪嘉政,5,親切的服務，貼切的分享，細心的照顧
黃金屋,5,林姿妤，服務親切，態度和藹可親，工作態度認真
Cathy Xie,5,門市人員都很親切，服務很專業，很推薦
You Chi Fang,1,態度敷衍 不專業 可以去找別家了
cola Chien,5,江小姐服務很不錯喔！
阿佑,5,小姐服務態度很親切喔！
唐淑貞,5,莊先生：good!
張家寧,5,"服務人員解說行程很詳細
服務很好"
自在逍遙,5,門市先生服務很好！
sonya lee,5,江佩容小姐的服務週到親切😊😊
洪軒軒,5,江小姐服務的還不錯棒棒
Jennifer Hsu,5,"鄭先生服務非常好,熱心"
蔡文智,5,太專業了，很細心！
Gun Red,5,門市人員林姿妤，服務良好值得推薦
張鈞霆,5,服務很好！
Hsin Lin Tsou,5,服務非常不錯，很貼心
linda,5,姿妤的服務超好的～
廖宏斌,5,王業務員服務親切介紹很詳細
sue-shan Lu,5,姿妤小姐服務不錯~~
Lisa Chen,5,江小姐服務態度很棒！
Ya Chun Huang,5,鄭先生服務很好👍🏻
蕭佑珊,5,莊先生服務好！
Tina Kuo,5,"門市離家近,服務方便!"
Hsiesh Johnny,5,林小姐，服務超親切！
許凱雄,5,江佩容服務超讚！
MSI TW,5,王珮人先生服務很用心
Stacey Chen,5,姿妤服務很棒～推推～
kaeru huang,5,專員林姿妤專業 服務 親切。
janet chang,5,王珮人先生服務非常好
Sheng-Ming Hung,5,江小姐服務態度超好
Andy Andy,5,林洧伶服務態度很好
瑋瑋,5,江小姐服務超親切!!!!態度佳又超級專業!!!!下次出國一定會再找江小姐的!!!!!
JL Kuo,5,推薦可樂旅遊安和店👍
steven su,5,江小姐服務很好
autumn chang,5,服務人員耐心講解，服務熱誠
林淑卿,5,莊先生 態度親切 很棒
王vicky,5,姿妤服務很好
Ichun Hsieh,5,服務很好，很有效率噢！！！
張君瑋,5,服務人員親切，服務非常好
Chekov Tai,5,江小姐 熱心服務!
POCHUN P,5,江小姐服務的很好👍👍👍
游耀東,5,"很好,很推薦!"
林益正,5,服務好，效率高
Paul Wang,5,莊先生服務佳
林欣怡,5,"服務很棒哦！
耐心講解"
Yi Hua Luo,5,姿妤服務很好～～
劉培生,5,業務鄭先生服務好!
Nico Yen,5,林小姐Azi服務很棒！！
周梅子,5,姿妤 服務很好 ～
施見智,5,很棒很親切
Jenny Lee,5,非常棒的旅行社！第一首選！
戴蕾,5,服務親切，細心體貼
夏瑜汝,5,服務人員態度很好👍
Jason Wu,5,講解詳細，待客熱誠
