author_name,rating,text
徐家揚,5,真是太好吃了，不吃畢生可惜
Paulina Chen,5,非常划算。東西好吃，口味稍重，偏奶類跟酸，不過嘗試起來是開心的。喜歡前菜跟甜點，酸奶加了黑糖可以試試，還不錯。主餐還好，沒特別經驗。點了雪菲小點心來嚐嚐，有點甜，如果搭配咖啡會非常適合。整體用餐環境很溫馨，還有小雜貨可以看看，是個很特別的地方
Miriam Chen,4,俄羅斯人開的俄羅斯餐廳，用套餐方式，讓人一次能滿足對俄羅斯美食的好奇...平價cp值高，沙皇套餐..推推😋
CW C,3,裝潢富有俄國風情，加上是台灣少見的俄羅斯料理且不收服務費，400塊的套餐價格還能接受。但份量不算多，男生可能吃不飽。前菜是甜菜根沙拉，甜菜根塊混著洋蔥與酸黃瓜碎，吃起來酸鹹開胃，沒有甜菜根特有的土味，但口感意外的偏軟。飲料選了黑麥發酵飲料，喝起來就跟加點的黑麥麵包味道一樣，只能說很有趣…。主餐是沙皇烤肉，肉塊裹著香料醬汁，不太像烤肉反而像燉肉，肉質軟爛但偏柴，無記憶點，反而是配菜酸黃瓜比較有印象，直截了當的酸味，解膩。甜點是我比較喜歡的一道，選了布林餅配蘋果和冰淇淋，布林餅吃 …
Tsai Chia-Lun,5,裝潢和調味很特別，服務和價位很棒
蔡承臻,5,"點了一份399套餐（平日雞豬特價369）
不收服務費但服務很棒~
套餐有沙拉、湯、主菜、甜點和飲料
沙拉和湯都是紅紅的甜菜根，沙拉稍微酸酸的，拌著不知道是什麼油，還蠻開胃的。羅宋湯是道地的俄羅斯做法，不是改良後番茄湯，裡頭料很多，每一口都吃得到蔬菜，還有一兩塊牛肉，很有誠意。 …"
Chris Chiu,5,一間被俄羅斯友人推薦的俄羅斯餐廳，俄羅斯老闆人也很好，對於女生原本以為餐點會吃不飽，其實是吃得飽的。室內裝潢與餐具也都充滿俄羅斯的感覺。
Vivian Huang,3,"一個套餐399
包含甜菜沙拉、羅宋湯、主菜、甜點、飲料
最喜歡湯品，很有層次感。
主菜點的是沙皇烤肉(梅花豬肉)，偏軟嫩。"
張雅雯,5,"店內氣氛很好，和很久沒見面的朋友約在這裡聚餐，大家都很開心🥳
食物很特別，因為我們都是喜歡新鮮事物的人，每道菜都充滿驚喜，尤其是599元的套餐推推
不過女生吃399的套餐比較剛好～
選擇障礙問店員的時候，店員也很耐心地一一介紹，最後也選到喜歡且適合的主菜👍
不過可能因爲我們人多，所以上菜比較慢，可能要吃早一點的時段，大家才不會等到肚子很餓～
甜點的話優格餅非常推薦❤️
飲料有菜單上沒看到的隱藏款，很特別！
奶茶有薑汁味，熱的很好喝，蘋果香檳也很好喝"
陶文玄,5,餐點美味，有異國風情，服務親切
青蓉,4,"399套餐物超所值，沒去過俄羅斯不知道是否正統，一個點4號燉雞感覺像法國菜(好吃)，一個點6號烤牛肉(史達林愛吃，但牛腱子要時間燉煮，很硬)。前菜，沙拉，甜點和飲料都有異國風味，很特殊(3和4甜點有法國crepe味道，奶茶像極港式絲襪奶茶。

2020.10.02 中午用餐，連續假期外場只有一位男生服務，很辛苦，想必廚房也是一位，我們等了一個小時才用到主菜，下次會非假日去避開。"
Benson Lin,4,"很有異國風味，雖然我不懂俄羅斯的菜應該是什麼口味，不過餐點確實很獨特，有別于平常一班吃到的口味，老闆娘也很熱心跟我們分享一些俄羅斯的風俗民情，也介紹我們一種叫做沙棘果的果實，聽說營養價值極高，但在俄羅斯卻是隨處可得，路邊就可以採到的一種平價果實。
餐點部分口味非常有異國風味，價格有兩種套餐可以選$399&$599，個人是覺得偏貴，拉低了它的CP值。

It’s very exotic. Although I don’t know what the taste of …"
Gina Liou,4,"餐點有特色且好吃，399元的套餐不算太貴～值得一試
不過真的要等很久，從點餐到全部上完餐大約1個半小時左右"
Hsu Derek,5,很有特色的俄羅斯餐廳 牛肋條跟烤豬肉都好吃 蘋果香檳好喝 黑麥汁就比較不對我胃口
張雅惠,5,"餐點很有特色，覺得湯品口味稍微偏重，但甜點部分棒極了!
地下室有販售很多俄羅斯特色產品，可以逛逛"
Michael Yang,4,裝潢佈置有異國風情，史達林私房牛肉硬塊有嚼勁，越嚼越香，強人硬漢牛肉乾…………; 那麼，強人普丁大帝的私房菜又是哪一道呢？想嚐嚐的說     🇷🇺🇷🇺🇷🇺🇷🇺🇷🇺🇷🇺🇷🇺🇷🇺🇷🇺，戰鬥民族，fighting !!!      上次和兒子來初體驗一次，今天又獨自打的過來，因為前幾天的大地假期又把俄羅斯和西伯利亞大鐵路給聽了一次，第五，六遍了
Aasta Lee,3,前菜沙拉、湯跟甜品還不錯~
Yi-Hua Wu,5,"滿好吃的俄羅斯料理
不過這邊上菜速度不快
大概總共花兩小時吃完
請預留足夠的時間享受"
史嘉蕾,4,非常有特色的一個餐廳，餐點便宜，裝潢典雅精緻有特色
Kang-Yen Lee,4,黑麥麵包十分推薦！！！超級香的，甜菜根牛肉湯也超級好喝！餐前酒推薦點伏特加，凍飲過後十分順口，唯一美中不足是奶茶喝起來像是即溶的，雖然比起市售許多牌子好喝…
Anita Lo,3,"甜菜根、紅蘿蔔、酸黃瓜為主的沙拉吃不太習慣😆
羅宋湯的味道比較重@@
主餐10蘋果燉雞全部都是雞翅哦。（menu看不清楚）
主餐4的牛肉比7牛勒條有嚼勁，個人比較喜歡4的牛肉。
甜點：優格塔第一口覺得蠻好吃的，塔熱優格涼，可是塔有點油耗味、布林捲餅裡頭包的香草冰淇淋蠻甜的🤢"
蘇瑞華,5,好吃好逛，過節紀念日日吃異國料理很棒。老闆娘很熱情。
光光,4,"好像只有399的套餐跟沙皇套餐
沙拉是根莖類加油醋
羅宋湯是番茄牛肉湯 吃的到小塊牛肉
雖然說是烤肉但是外層包裹了很多醬料所以吃不太出來肉的原味 個人不是很愛
中間的馬鈴薯泥吃起來有加蛋白粉的味道
配菜還有酸黃瓜 小黃瓜 油炒的甜椒跟幾片生菜
甜點的酸奶加黑糖好吃
不過整體而言我可能不是那麼喜歡俄羅斯菜吧"
Chris Yuan,4,俄羅斯菜不是走精緻路線的，菜色以燉煮類為主，感覺較為家常但味道不錯。俄羅斯人愛酸，所以從主餐、甜點到飲料都有具有酸味的選項可選擇。除了用餐外，在此還能買到許多來自多個國家低於市價的進口貨品，例如伏特加酒就是個很好的選項。
Mio米歐,5,"因緣際會下來到俄羅斯城堡用餐，進門右前方的角落位置是老闆及員工的專屬桌，員工休息時還看到老闆幫他拿飲料，覺得很溫暖
上菜速度剛剛好，通常都是等到一道吃完才上下一道，適合有充足時間想邊聊邊吃的客人
本身沒有吃過俄式料理所以道不道地不是很清楚，所以都是抱著嘗試的心情，有顏色飽滿的紫紅色甜菜根沙拉、加了酸奶的羅宋湯（很合我的胃口）、俄羅斯香腸搭配黑麥麵包、主餐的俄羅斯魚餅配上馬鈴薯泥，其實吃到主餐就已經很飽了，但是最後的甜點優格餅讓我再飽都要把他們吃完"
Donald Donald,1,"上菜太慢
一頓飯吃了兩小時"
章昌吳,5,餐點蠻有特色，開胃菜，主菜，甜點，飲料都好吃。美中不足是，人多時上菜的速度慢。
黃雲飛,5,從俄羅斯旅遊回來，到此用餐，這裡的每道料理「真實、不虛偽」 ，非常「地道」的俄國菜👍👍
UT Z,4,很有特色的俄羅斯菜，主餐、甜點很好吃！
MingHsiu Tang,5,"很有特色
雖然偏貴（399）但還算值得"
Sherie Lin,5,"台北少見的俄羅斯料理，裝潢有特色。服務親切。
Definitely worth a try! Good service, delectable food and exotic decorations."
Vicky Kuo,5,"服務親切，空間寬敞安靜，很適合朋友相聚聊天。
$399的餐點，有前菜、羅宋湯、飲料、主菜與甜點。
主菜這次點了第一項的烤肉，肉很嫩，蘸上醬汁完美，還附上很大球的薯泥。
甜點店了蘋果冰淇淋煎餅？超級美味！讓人回味再三。
餐點的份量都十分剛好，吃完剛好吃飽，很特別的俄羅斯菜。"
無影片挑戰1000訂閱,5,真的很好吃 俄羅斯老闆很親切
柯美如,5,"慕名而來的餐廳，
一點都不會令人失望，
服務員除了一位台灣正妹外，
其餘都是北方正妹，
服務週到還沒收服務費～
重點是餐點很好吃！
最後的冰淇淋煎餅令人驚艷！"
Eyleen Chan,5,"普通套餐有369/399之分(主食肉類不同)，也可以選擇單點。個人覺得套餐比較划算。
前菜🍴甜菜根沙拉
湯品🍴羅宋湯
主菜🍴沙皇烤肉(豬)&亞美尼亞奶酪燉雞
甜點🍴乳酪餅&布林餅(香蕉+巧克力)
飲料🍴俄羅斯黑麥汁&俄國皇家紅茶
價格不算便宜，但與食物的分量成正比。
食物味道略清淡(個人飲食偏重口味)
主菜方面:肉就普普通通，馬鈴薯是亮點
整餐下來就讓我欣賞的是湯品和乳酪餅。"
yeon min,5,"餐點美味
用餐環境很舒適
不過餐點份量不多 女生吃完套餐飽足感是剛剛好
但對於食量大 或是男生
絕對不飽
然後  服務生只有一位可愛的俄羅斯男生
所以他滿忙的 上餐速度就體諒一下囉
整體是很滿意的"
Hsin-Yi Huang,4,除了甜菜根沙拉外，主菜跟甜點都好吃，主菜的醬汁很美味，可以整盤清空
鄭永鈞,5,值得來喲！不會很貴，又可以吃到俄羅斯平民美食。那俄羅斯羅宋湯跟布林冰～真是平民美味。
Mint Wu,5,什麼都好吃、道道驚豔、口口滿足，從前菜到主菜，從鹹食到甜點飲料都難以挑惕，讓我對俄羅斯料理開始感興趣了！豐富的套餐組合以這價格覺得很划算~（還不用服務費） 絕對會再回來吃吃吃吃吃
WENDY CHEN,5,"CP值滿高的餐廳
晚餐時間的套餐很超值
羅宋湯和沙拉份量及口味都很驚艷
主餐口味濃郁
但最推的是甜點
冰淇淋蘋果布林餅蠻值得一吃的
值得二訪的餐廳"
劉恕翰,5,"料理很特別！
非常好吃！
價位中等！
值得！"
Joanne Huang,5,很特別的店，有滿滿的俄羅斯氣氛，坐在裡面用餐相當愜意舒適。今天主餐選的是沙皇烤肉和史達林烤牛肉，肉質軟，搭配的馬鈴薯泥細緻又入味，很棒。非常喜歡布林餅，尤其是巧克力+香蕉的口味，跟幾年前來吃的記憶相同，一樣好吃：）
Yuan Ngo,4,399套餐 不用加一 甜點忘了拍 我是點蘋果冰淇淋馬林餅（感覺就是可麗餅）但好吃 沙拉是甜菜根蘿蔔還有酸黃瓜 主餐是4號餐喬什麼烤牛肉的 肉稍澀 但味道不錯 馬鈴薯泥也好吃 整體異國風濃濃 大概一兩年來吃一次即可🤪
Wayne Hsu,5,"前菜清爽順口，
黑麥麵包的味道一定要試試～
羅宋湯值得專程為了它去吃！！
沙皇烤肉調味很棒，
俄羅斯奶茶第一口有點衝擊的，但香料調的很有特色很好喝。"
Ron Lee,2,"菜色另當別論，見仁見智。
不過服務非常不到位，廚房也負荷不了，餐廳內人坐一半不到，上菜就已經非常脫節，吃完要一個多鐘頭，你很閒，沒事幹，再來考慮"
1483,4,"優點:
1.店內環境優美 很有異國風味 外場服務生也是一位歐美女生
2.可以以399或599(不外加服務費)品嘗道地俄羅斯料理 以台北來說滿不錯

缺點:
1.因為套餐 上菜盤數多 所以剛好熱門用餐時段 一位外場有時候偶有忙不過來的感覺
2.有些桌上沒放水 跟杯子 我的桌上有一瓶剩1/3的水瓶 但沒杯子 只好等香檳杯喝完拿來裝水....
3.布林餅滿特別 但可能剛好不對我胃 冰淇淋吃完 剩一點餅皮 純吃餅皮有點沒那麼好吃..."
Yen Ling Lin,4,第一次吃俄羅斯料理，甜菜根沙拉好吃，羅宋湯好喝，可惜的是想吃的主餐沒有的點
長宏孟柔,4,店員很有個性XDD 如果不吃牛可以額外詢問，會提供豬肉泡菜湯
Sherri Cheng,5,來過兩次了，真的很特別的餐廳，口味很不錯（份量雖然有點少🤣🤣），很喜歡布林餅
邱麗芸,4,"羅宋湯道地好喝，甜菜根沙拉也不錯，和之前在俄羅斯吃的有相似的風味。
店內有一位莫斯科來的服務生女孩，可惜態度較冷淡（但可能就是說俄羅斯人的性格）
套餐吃完還有點餓，cp值普通，但若是為了嚐鮮俄羅斯料理，這家還不錯"
yi-li WANG,4,"坐落於台大正門對面KFC後面巷子。

內部擺設富有豐富的俄羅斯文化氣息！
店員是位會中文口音特殊有點西方帥哥！和一位親切可愛的女店員。
位置大約三十個左右，燈光昏黃但很有味道，餐點是俄羅斯風格的沙皇料理。
有雞豬牛主食，和特色點心，是一個聚會的好地方。
附有兒童座椅和衛生間。"
劉佳怡,4,沙拉甜菜做的，可能有人不習慣。其他口味尚可，因為沒去過俄羅斯，所以不知道道地嗎？但價格合理，無服務費。店內很多外國人也許不錯吧！
蕭力行,5,價格399元在北市來說真的不貴，分量剛剛好不會過飽也不會餓到，味道很特別好吃。
Uhura Chen,4,"很不錯👍
喜歡酸奶，或甜品的人都可以試試看"
林玉彰,5,位於台大對面羅斯福路3段333巷的俄羅斯城堡，專門販售道地的俄式美食，從湯品/前菜/主餐都有；其甜點薄餅外皮Q彈，特別推薦 - 布林餅+蘋果冰淇淋十分爽口解膩。
Yanlai Hong,4,好好吃 一份套餐剛好可以吃飽
123 123,5,滿不錯吃的一家異國風味店，價位加上一成服務費的話，約莫440元上下，不算便宜，卻口味新穎，口口留香。我們五位熟女，每位各自點了自己想要的，都吃得盤底朝天，而且，還當下與此店家預約下回再聚餐的日子，讓服務人員笑得合不攏嘴。。哈哈哈，促進經濟嘛！
張博宇,4,體驗俄羅斯菜是不錯的地方 有套餐可以有基本選擇 或是單點其他菜色 不少洋人在店內消費 也有部分是台灣人
Yuzong Lin,4,跟想像中的俄羅斯菜有落差、但好吃，環境舒適、服務不錯、價格還可以
Gem Chen,5,點心東西蠻好吃 口味很特別  還有海塩巧克力也很好吃   服務生也很可愛  還有異國服飾提供拍照
Ken Chao,4,非常純粹的俄羅斯菜體驗，菜單上的各種餐點都很美味，非常值得來一試，外國服務生的中文都說的很好
阿柚仔,5,很便宜的異國料理店！值得來試試看
Vivien Lin,5,"Cp值高 主餐雖然感覺份量不多 但整個套餐吃完也是很飽 甜點份量夠
整體口味獨特好吃
套餐有三百多跟五百多的選擇 沒有服務費"
陳柔穎小哈,1,"店員很雷…都已經先預留電話了…時間到了還跟我們說要再等20分鐘
餐點很少，假日貴鬆鬆。有客人在店裡玩遊戲超還嗨，覺得沒有必要在這消費$399的套餐，"
祥熙廖,5,環境美氣氛佳 服務好 料理味道特別又好吃 重點是又不貴 不止五星了
布呱呱,5,"氣氛老派復古非常適合約會。
餐點很有特色，每一道都好吃，但一直猜不到主菜的調料，覺得非常神秘啊！
甜點是主體，願意為了甜點再訪一百次！"
COCO O_o,5,"除了吃飯外
地下一樓還有俄羅斯商店"
Ariel Chou,5,沒想到這麼好吃😋今天點的是沙皇套餐，蠻超值的喔！不需要白飯的話，很適合這套餐～
Tracy Wang,5,好吃的異國料理 很喜歡羅宋湯 主餐也很不錯 優格餅好吃 會再回訪
CHIAHSUAN JUAN,3,"食物跟餐廳環境很特別，可是沒去過俄羅斯不知道道地否？
除了前菜的甜菜根，因為個人口味問題，同行友人都不敢吃以外，餐點（尤其冰淇淋捲）都算不錯！"
蔡寬人,4,味道很特別，不過份量較少
Caleb Huang,2,餐廳上菜真的太慢，好處是不吵、翻桌率低，可以朋友慢慢聚餐，但食物份量有點少吃不飽！而且店員中文英文都不太好很難溝通，訂位就一直聽錯，送餐也一直送錯...
JaoJao,5,特別的料理，量偏少但很好吃<3
鄭伊廷,4,"非常道地有特色的俄羅斯料理
服務生也是俄羅斯人但中文很好
很熱心的分享一些俄羅斯的文化"
Charles W,4,羅宋湯 好喝，甜點 冰淇淋可麗 也很棒，但主餐 沙拉 飲料 都還算普通，可能是我個人不習慣較平實的口感。環境跟服務態度都很不錯，但是用餐當天 因為滿座，服務人員上菜送錯桌，反應後，也很快補足。
Jane Hsieh,4,喜歡～～ 只是空調不夠涼
Andrew Tandio,5,推薦沙皇烤肉! 很適合亞洲人口味，蠻像印尼的巴東牛肉 (rendang)，俄羅斯菜蠻重口味，很意外! 今天的甜點選布林餅，也很好吃
Nobuluis0594 Pan,5,"亮點在甜點，比主菜還出色。
招牌布林餅（內陷是蘋果和香草冰淇淋）
俄羅斯酸奶（配黑糖）
前菜甜菜根沙拉也不錯，
綜合醃黃瓜與番茄的酸甜口感十分特別。
而俄羅斯皇家紅茶搭配的果醬和黑冰糖，
喝起來沒有澀味。

套餐價格平實，很值得再回訪 💖💖💖💖"
Bina chan,5,"滿滿的甜菜根莎拉
酸甜甜的羅宋湯
是愛甜的人最愛
喜愛甜的人可以來這甜蜜一下呦"
Wendy Lin,2,"食物好吃，但是，這裡的員工的英文中文都不好。連基本的點餐都有問題。
員工訓練完全不到位，連基本「低消」是什麼意思都不知道@@
餐點上超級久，令人崩潰的久。
我不認為我會再來。"
Jenny Chen,4,"藏身巷弄裏的舒適餐廳。食物十分接近我在俄國自遊行時所吃到的口味,尤其最愛下午茶的俄式奶茶+冰淇淋/蘋果薄餅,以及黑糖酸奶都十分道地。整體環境很東歐,也兼賣許多俄羅斯的食品和紀念產品。和台北一般店家相比,各項價格都十分平實,很難得哦!"
Tsai Hellen,4,在公館待這麼多年，第一次走進俄羅斯城堡，那沙拉意外的好吃，微酸的甜菜根，還有主餐也很驚艷，第一次吃俄羅斯料理完全沒有失望，還有甜點超好吃，重點一個套餐價格不貴，又可以吃得超飽超撐。
Tsung-Hao J. Liu,4,手工黑麥汁味道很特別，跟傳統黑麥汁味道不同。上菜節奏比較緩慢，慢食。
簡文通,3,菜色不錯，但出菜稍慢而且有點亂。
楊恩,4,聽說是道地的俄羅斯食物（沒去過俄羅斯也不知道什麼算道地），但蠻符合台灣人口味。CP質還算可以。
WL Chell,4,"有點貴 一餐約400~
但可以吃到非常獨特的斯拉夫風味
喜歡點心^^酸奶口味好吃！"
Stephen Lou,3,中午與公司同僚在此用餐！
吳植繁,5,我對新事物的接受度很高，我覺得好吃又清爽。
Mark Cheng,5,1號餐沙皇烤肉，口味特別，份量十足，非常推薦～
Joy Lee,4,好吃，尤其愛前菜跟羅宋湯，氣氛也輕鬆，惟套餐一份以我個人食量不太有飽足感~(^ ^b)~
陳殿宇,5,"美味、平價、酒水也超讚
我愛俄羅斯啊啊啊啊啊啊啊"
Bruce Liu,5,價格平實，餐點口味相當獨特，不論是餐前沙拉或湯品甚至甜點，應該都是在台灣不容易品嚐到的風味。另外餐廳內提供不少俄羅斯服飾供顧客穿戴拍照，除了享受美味之外更增添不少樂趣。
MH Chen,3,俄羅斯菜餚的口感，我吃不習慣
俊杰簡,5,很有異國風味的餐廳
chialing chang,5,捷運出口走路6分鐘。套餐有399和599兩種，CP 值很高。老闆娘很親切說明。羅宋湯好喝，飲料自家發酵好喝，很有特色，黑麥麵包好吃。素食者來也能享用餐點。巧遇餐廳下午茶時間辦攝影大師分享會，有甜點飲料才300（中午用餐可減100），很開心能度過美麗時光
liao廖eric垚昱,3,"餐廳地點離捷運方便，服務態度佳。
不清楚俄羅斯料理特色，但菜單組合簡單易選，蠻新鮮的氛圍。"
林信維,5,肉質嫩，味道豐富
Yang Tinghsuan楊庭瑄,4,"好用心的料理
和朋友共點了三份餐
黃瓜的酸度 片的方式 都不同
搭配的菜葉不同 醬料也是各有特色
黑麥汁是老闆自己釀的 甜點推薦布林餅喔
絕對讓人想念起俄羅斯的美好"
Jia-shin Chen,5,非常具有特色的俄羅斯菜餚，地下室還有俄羅斯商品可以採購喔
Meg S,4,$399 套餐且不限時，是聚餐好選擇，但只有一間廁所是大缺點
陳彥瑾,5,超級好吃超級特別裝潢得非常有異國風情
蘇美瑾,4,可惜沒有商業午餐，不過套餐的食物很好吃，有沙拉、主餐、湯、甜點跟飲料，也不加服務費。另外午茶下午3：00到5：00。
陳偉立,5,羅宋湯非常好喝  有牛肉湯的味道
簡彥成,4,"點的是369元的套餐，不需加一成。
甜菜根沙拉、牛肉大塊紮實的羅宋湯、西伯利亞豬肉排、甜點餅包蘋果片加冰淇淋、俄國紅茶。
整體算有特色且味道不錯。"
Yenhsuen Li,5,"1. 空間很夠，適合多人聚餐
2. 羅宋湯好喝，牛肉給得超大塊又燉得很軟嫩～
3. 甜點推薦優格餅和蘋果布林餅！
4. 整體而言399套餐CP值很高，吃得很滿足，沒有加收服務費
5. 只收現金無法刷卡"
陳仕津,5,可以比較隨意用餐，慢慢吃，不要太急～
kuo chenyou,2,菜色不差，但是體驗不佳，服務待加強
Yuwen Chin,4,很特別的餐廳！
hsin fang,5,四個人點了兩份399、兩份599套餐，份量剛好，相當好吃又道地，最喜歡羅宋湯和優格餅。
陳詩婷,5,"氣氛食物都很不錯
但大食量者可能吃不飽"
woofer Lin,5,餐點與服務不錯，份量中等
Lai Julia,4,服務人員態度親切，餐點味道特別。
B Tsai,4,以前有商業午餐，現在已經沒有了！$399套餐有湯、沙拉、飲料、甜點，主餐偏鹹，甜點還不錯
Miranda Tsai,4,餐點和裝潢都很有特色，服務佳
賴政融,5,史達林烤肉好吃
楊少俠,5,家人吃的很開心
Phi Delta,5,我很喜歡這間餐廳，老闆跟老闆娘都很不錯，老闆是莫斯科人，菜餚很好吃，但是不吃牛肉，或是吃不太油及不喜歡酸黃瓜、馬鈴薯泥的人，不太建議，但如果是想品嚐道地的俄羅斯美食的人，非常推薦這家餐廳
劉貞治,5,東西好吃服務親切很值得
gemma inmuseo,5,食物健康又美味，可以感受到店家的用心。很適合和朋友聚會聊天！！
金澤柱,4,老闆親切，餐點不錯！
蔡妤芳,4,"第一次嘗試俄羅斯料理！菜色用心製作，但食材重複性高（可能俄羅斯蔬菜不豐富！？），主餐肉量略為不足！甜點很棒，奶茶風味特殊。
適合嚐鮮的餐廳！"
林宜璇,4,"俄羅斯菜意外的好吃耶!!
白色的那盤叫""醃豬油"", 超級好吃!!!口齒留香~"
聖淨之風,4,牛肉湯很好喝
岸間晴乃,3,部份餐點算可以，只是紅茶口感有點微妙。
Hannah Chang,5,很道地的俄國菜 讓我懷念起以前在俄國的日子~
曾德隆,1,"上菜慢，態度差
乳酪餅非常好吃"
Mili,5,非常好吃，服務也好！！！
silas tsai,4,食物有異國特色，肉質軟嫩，份量不算多，價格微高但值得一試。
senka Alfred,4,多年前吃過，這次服務的年輕俄羅斯小哥服務得很好，有問題都會認真回答，少見的俄羅斯餐廳，餐點還不錯，喜歡奶茶
Barbie Lai,3,主餐的量現在少的可憐跟以前差太多，肉質也變差，以前有個蒔蘿沙拉很好吃現在也沒有了...湯跟甜菜根沙拉好吃，飯後甜點推薦可麗餅包蘋果
Jacqueline,4,價位分為399跟599兩種。好吃、份量也夠。甜點的布林餅冰淇淋尤其推薦。
Mark Chiang,4,難得有俄國菜
Tony Ko,5,異國氣氛濃厚，甜菜根沙拉很道地
吳晢瑋,3,俄羅斯菜口味看個人，環境清潔但有點悶熱，上菜較慢
Jay Tseng,5,沙皇烤肉讚啦～
Zunkas Lee,5,本次點的是399的餐點，個人覺得很有特色，也物有所值。甜菜根、小黃瓜與蔬菜搭配的沙拉非常爽口。羅宋湯熬煮出洋蔥的甜味，搭配蕃茄適度的酸味與一塊軟嫩的牛肉，是可以從胃裡面溫暖起來的味道。主餐比福斯特羅甘是以牛肉絲佐奶酪醬燉煮，下面放上馬鈴薯泥，搭配蕃茄、小黃瓜切片等蔬菜，底部的醬汁味道不會太重，與其他食材搭配的剛剛好，整體味道濃厚卻不膩。俄羅斯皇家紅茶的特色，在於加入果醬品茗，果醬本身單純品嚐味道也不錯。俄羅斯酸奶加一點糖，酸酸甜甜的點心，作為餐點的結束是不錯的選擇。
Sophie Chang,4,"菜色有趣新鮮
特色料理
服務人員態度很和善很可愛
份量偏小"
張歐貝,3,還可以，體驗異國料理
Fan A,5,少見的異國料理，甜菜根沙拉清爽可口
pencil50102,5,"有399和599不同價位的set
主菜選擇挺多樣的"
Nick Ho,4,"裝潢氣氛很棒，很多俄國裝飾品與電視節目，兩位俄國人經營。
餐點中等品質，消費599沙皇全餐份量少，適合吃氣氛、拍照！"
TANNY Tsai,1,等上菜等一個小時
Linda,5,"食物很多特別， 套餐399可以吃很飽,選項也多"
陳麗萍,4,甜菜料理及羅宋湯很特別
HOW Mr.,5,料理很有特色，甜點尤其好吃。
蔡依霖,5,地下室的雜貨舖滿酷的
小雨,4,"很適合朋友聚會吃飯的餐廳，店家提供的套餐也很合乎價位，店員會講一點中文，不過菜單內容物都有說明還是自己看好了。
沙拉很特別，裡面有洋蔥如果不喜歡的話要記得挑起來給別人吃。"
Joyce Chen,5,老闆娘熱情分享傳統點心。有其他地方少見的料理。
