author_name,rating,text
Liu Cecilia,5,讀書買書在這裏都是很愉快的經驗。
楊浤淵,5,價格合理
高瑋謙,5,"是一間有書有雜誌有CD還有影片的茉莉店，比起台大店只賣書，影音館只賣影音相比，師大店賣的書與CD影音更像是精挑細選過的。
這是最接近一開始所認識的茉莉書店，也許經營的成本高一些，但仍希望能以這樣的形式繼續經營下去，畢竟複合式的商店型態在近年來比較貼近市場。"
徐守政,5,雖然是二手店，但是感覺逛起來還蠻舒適的。
葉立斌（Being Who）,5,現在仍是我賣書的首選，只是收購價能再高一點會更好啊!
崔光中,5,這裡距師大約三分路程，二手書籍，影音產品豐富，燈光柔和，很適宜待一個下午或晚上，很愜意地尋寶。
Kai-Yen Hsu,5,藏書多元豐富，氣氛良好，可以在此處找到一些不錯的二手書。惟因在地下室，透氣仍偶而稍感不適。
Fred Lin,4,方便，親切，書多
doreen Chen,5,環境舒服、價格也還可以。
Eve Lin,5,書籍商品更新快，每次光臨都會有驚喜，店內設有化妝室，便利許多
ZZ,5,可以待上一整天都沒問題❤️
王英世,5,安靜
楊惠民,4,來這找書，有挖寶的感覺
Goldaruma Lin,5,"環境整潔、分類明確也有廁所，在這邊選書很享受
價格上因二手書會期待價格，但這邊價格似乎沒有多便宜，但有一區是特別便宜的或許可以挖到寶"
sumi liquid,4,"連鎖二手書店，種類多書況良好，保存的幾乎和新書一樣，但畢竟是二手書覺得還有降價的空間。店內環境非常好。
曾經買到有做筆記跟劃線的書，價格是原價的8折、9折，跟一般書店比沒有比較便宜，同本書網路書店賣的新書還比較便宜。
優點只剩販售絕版書、冷門書，挑選書可以慢慢看，先確定內容再決定是否要買。
因為網路很方便大部分書都買的到，不會特地跑實體店面，只有經過時會進去晃晃。"
侯十方,5,便宜又有很多書
陳美英,5,很棒的環境！
林澤洋,5,書超便宜，環境乾淨，店員親切
Joan Tao,4,一個有氣質的二手書店，不完全是二手書，也有過季未開封的新品，早幾年是買語文學習的書籍，近兩年則是手工藝與廚藝食譜常去看看，書的流動速度有時挺快的，我有過沒當機立斷，幾天後錯失良機的心痛經驗。 再補充一下 我前兩天 去逛時 有幾本手工藝的 書 覺得不錯 想 別急著決定 再看看隔壁的書架後再說， 20分鐘不到，再回頭… 已經 被後腳的 愛書人 包去結帳了
蔡東尼,4,非常專業的二手書店。
安安,5,地下室，但是空氣不會很糟糕
Chih-Chung Liang,5,總是可以挑到一兩本想帶回去的書以及cd。
Kate Wu,5,有舒適的買書環境，而且你會找到你要的書，也會有挖寶的喜悅。
Isabelle Chang,5,店員非常親切
lex hsu,5,有一點難找，騎車晃過兩三次才看到，步行比較好發現。位置在地下室，但空氣沒有很悶，自己是來賣二手書，店家很阿撒力，不能賣的書也能請他們幫忙處理，很棒。
許惠萍,4,會不會太遠了。
