author_name,rating,text
Foenix Acala,3,"雖然以前沒來這邊吃過，但如果是去年的我，還滿喜歡這樣的便當店。

.看起來還是以排骨為主，所以基準2分起算。-1
.便當分內外盒，份量滿足夠的，價格算平均中位，可以接受。+1
.雞腿本身炸的還不錯，不會太乾。但是麵衣比較厚，導致吃起來口感不是那麼好。0"
Lin Pierre,4,老店學生最愛之一，雖說價錢中等，但是炸豬排和炸雞腿肉酸菜麵，令人百吃不厭。
nicki hsieh,3,價位平價中偏高，雞排飯雞排算蠻大的，如果在公館商圈想吃便當可以列入選擇。
Marcus Yang,3,雞腿真的蠻大的，但是排骨太薄了，配菜還算可以，有辣蘿蔔還不錯，湯有一個丸子。
Teresa Chou,5,平價好吃的便當店，最喜歡吃他的雞腿飯，排骨飯也很棒喔，份量很多可以兩個人一起分享喔
Mao-Chang Sun,4,長久以來，特色之一是主配菜一定有麻婆豆腐，還會配一碗有加小白菜的骨頭清湯。但多年前湯已變成大雜燴的自助式湯，麻婆豆腐也常會消失一陣。感覺又是一家古早味及特色逐漸消退的老店。
Chiang,5,"從國中就開始吃的好吃雞腿飯！
飯多菜多 雞腿超好吃，份量十足，菜色保持著同樣的經典菜色，麻婆豆腐、青菜、蘿蔔乾～"
易群,4,這家是老店，點了雞腿飯，雞腿特大，也很好吃，值得推薦!
Summer,4,"公館商圈中好吃的便當店
喜歡雞腿飯（麯）陽春麵條
雖然麵皮很厚有點油
但很好吃😋"
JADE,4,以台北的價格他的排骨飯110元加上排骨很大片算是物美價廉，吃了二十幾年了
Anna Tien,4,"110, 附湯飯超多。屬於醃得很入味的排骨，環境乾淨有飲水機跟洗手間。"
張舜傑,5,價格實惠，份量飽足，上菜快速，內用附湯跟開水，快速用餐或外帶便當都很推薦
靈魂黃,3,"漲價好幾次了 現在有點貴
不過炸雞腿味道沒什麼變  蠻好吃的
便當菜色一般般
3.5"
蔣先生,2,一個雞腿飯120 排骨110 油都沒瀝乾 等付錢後才告知二樓還要自己拿 樓梯又小又不好走 有被騙的感覺
王書明,5,在台灣大學對面，屬公館商圈，店面看來不起眼，卻便宜實惠，真的是附近學生與居民的好朋友好鄰居好老闆。排骨大塊又不油膩，配菜選擇不多但爽口，這才是屬於庶民的美食啊！
K. John Lu,3,傳承外省口味的炸排骨，跟華南排骨、 東一排骨口味相近，麵條湯頭有古早陽春麵的滋味，特別推薦酸菜排骨麵。
Polo Jc,4,雞腿飯好吃，免費的黃瓜豆腐雞湯也好喝
windkidll Chen,4,"排骨飯、雞腿飯都還不錯
配菜幾乎沒什麼變化
價位在100-120間
公館便當店裡 不錯的選擇"
Dickey Chen,5,"優點：
1.上餐速度快
2.內用位置多(二樓也有座位)
3.提供湯品(但湯品只有一樓有，坐二樓的要到一樓裝)
4.雖然招牌寫排骨大王，但雞排飯($100)的CP值遠大於排骨飯($110)
5.有廁所

缺點：
1.地板滑膩，走路時要特別小心"
喵影子,2,"菜色味道普普就算了，畢竟便當店嘛還能要求什麼。
服務態度也算了，幾乎每個人的臉色臭得要命也算了，畢竟便當店嘛也不用要求太多。
可是飯變難吃了，那個會讓我吃三大碗的飯沒了，這個我不能忍！"
蔡作君,1,一份120的排骨飯，配菜竟然是三色蔬菜跟辣蘿蔔…
James Qu,2,偏油，而且今天吃到一半阿姨就想來收走我的餐點...用餐體驗很差，給2顆星是因為他雞排蠻大塊的
Hepburn Katie,2,飯黏在一起，不好吃，配菜也冷的。炸雞腿也不好吃，做得很隨便。
照亮,5,他們家的排骨飯的炸排骨超級大塊的，我個人覺得超級好吃！吃起來肉挺多汁也有醃入味！配菜稍微普通了點，也整體稍微吃起來油了點！雖然以學區附近的價格偏貴了點，但是真的推薦排骨可值得一吃！
L ZW,3,"這家店的特點是：
肉多
味精多"
Conner Huang,5,"排骨大塊又厚，香酥好吃，配菜跟飯的量也很多
而且配菜出乎意料的好吃"
Kevin,4,"雞排好好吃又大
那些說很油的怎不去吃健身餐
不油又要靠北難吃
哭啊"
張天瀚,5,能讓我吃了幾10年應該不會太差
Steven N.,5,"超大的便當
要當心吃不完
不過肉真的很大塊"
PoSen Wang,3,炸排骨看起來顏色有點深，不過吃起來滿軟的也不會有焦味，配上附上的小黃瓜滿搭的；酸菜麵不是重口味的類型，吃起來算比較清爽，但價格真的有點高。
soso Wu,3,份量足 可是雞排太油了整體來看便宜又大碗 若是雞排不要太油會更好
Hsueh丞佑,5,"個人認為臺北最好吃的雞腿，炸雞腿的麵衣酥脆，肉質鮮嫩，常常專程來一飽口福。
真的值得親自品嚐！
配菜部分對我來說以一般便當店，已經調理的在水準之上了，而且食材也新鮮。
雖然$120元的雞腿便當不算便宜，但是臺北市只要做工精細、用料紮實的便當店這價格合理。
一二樓都有座位，就算帶小孩來也能吃的舒適。"
David,5,包包忘了帶😂謝謝老闆幫我收好
pop chang,3,好久沒來吃，漲價了，人變少了，太油，配菜不行。
Yun Ze Lu,4,"排骨飯-110元
味道不錯，肉也很厚實，配菜的豆腐很好吃，炒青菜微焦。
在看完電影的時間約莫2點左右踏進店內，店中有股不是很好聞的氣味，一顆星扣在這裡，以學區附近的價格來看是偏高了點。"
Jennifer T,4,平價，好吃的古早味炸排骨，雞腿麵飯～
Kuan Lin,5,"價格偏中高  但好吃
少見的台式炸排骨雞腿便當店"
Jerry Yang,4,出餐速度快，餐點也好吃
Joy Chen,2,"還記得第一次來大福利排骨大王，那是幾年前的一個午餐，點了雞腿飯XD，這次當然要試試排骨大王的排骨飯。

店面依然是台式風格的小店，炎熱的夏天一進到店裡，啊～涼！一進店裡就是櫃台跟廚房去，不能說是現點現做，但多數的菜都是從半戶外開放式廚房來的。

招牌排骨飯一上桌，好台式的排骨飯，排骨飯看起來普普通通，配菜看起來也還好。排骨是熱的，味道普通沒什麼特別，倒是排骨外面一層的麵衣一直黏著白飯，味道也是普通，不過排骨不會太硬。。配菜味道一般，都是涼的，口味上也是台式的味道，還可以。

總結一下，這不是我喜歡的排骨飯，但不是難吃的不喜歡，就～反正不是我的菜XD。"
林聖祐,4,雞腿飯及排骨飯都炸得酥脆、份量飽足！
Alfred Huang,4,炸雞腿100分！配菜跟米飯普通，但每次來都是為了夢幻雞排
Foxcy Chen,4,排骨飯好吃，從以前吃到現在，價格也漸漸漲了，現在排骨飯110
kelly,3,今天吃外帶的雞腿便當，看起來很大份量，但雞腿粉太厚，偏油膩，值得讚賞的是米飯，口感跟味道非常好
Evon Hung,4,我來這邊101次！就是愛榨菜雞腿麵$130！一定要把醋和胡椒加好加滿！非常的美味！如果店員可以不要臉臭，互相吵架，就完美了！
大頭海水愛好者,4,炸雞腿好吃份量十足，可惜內用環境不太乾淨，仍然願意給四顆星
Anne Hsieh,4,炸雞排跟排骨的水準都很高 附湯也很棒有用很多雞骨頭下去熬 缺點就是白飯濕濕黏黏不太優
鄭庭劼,5,炸雞腿飯超香 很好吃
WatchMakers Taipei十點九分鐘錶,5,沒話說的棒排骨，幾十年品質都沒變
吳志中,4,真材實料（尤其雞腿餐），cp值超高，吃便當或快餐的好選擇
Berway Liao,4,雞排超大，生意超好
ulb B,3,服務感覺沒有太好，排骨是蠻大塊的 味道還行
Angel Tseng,5,就是好吃欸，味道6年前跟現在都一樣好吃，沒有吃過比這邊好吃的排骨，配菜還好，就是配角，主角比較重要
HsienCheng Liu,4,排骨飯、雞腿飯都很好吃，排骨、雞腿都炸的酥脆、多汁，菜色搭配得宜，飯量可以吃很飽，冷氣空調很涼爽，清潔及環境需要加強。
林淑卿,5,炸雞腿超好吃的，皮酥、肉多汁
林岱岱,4,滿特別的排骨便當店，居然除了排骨飯跟雞腿飯之外，還有排骨麵。一個便當要價110元，真的不便宜，肉滿大塊的，是裹粉後下去炸，可以吃得到酥脆的外皮，有點古早味的感覺，菜不多，高麗菜好吃，麻婆豆腐沒有很入味，飯量很多，我覺得算是份量多可以吃飽的便當店，相對我自己的食量來說，吃不完有點可惜，所以我覺得結論來說 普普。
Claire Lin,4,排骨大塊、好吃，但一份要110確實不便宜...是吃回憶的店
Andy Huang,4,年輕的回憶，從小吃到大，不變的口味，就是稍貴了點
廖耿達,2,吃的主菜偏油，價格偏貴，菜色普通
rita wu,5,最愛的公館美食之一，建議在店內享用排骨的口感最棒👍，外酥內彈！
小肥宅,4,"賣排骨飯、雞腿飯便當
特色在於炸雞腿非常大一個，吃起來非常的爽

今天點雞腿麵
不過炸雞腿是一樣的，價格也一樣都 110
雞腿份量非常大，外皮炸得非常酥脆也不黏膩，吃起來爽感十足
只是就蠻油的，味道稍微比較重一點點
裡面雞肉很嫩且多汁然後醃得不錯
飯的話會有幾道配菜：高麗菜、三色蔬菜、麻婆豆腐
配菜的話就中規中矩，不精緻，有點油，但也不難吃
麻婆豆腐弄得也還不錯，比一些自助餐的還好吃了XD
麵吃起來還好，就是肉臊油蔥湯，麵有點軟
建議還是點飯，畢竟雞腿還是配飯吃比較爽"
Jason Huang,4,"排骨很大，
便宜美味，
雞腿也好吃，
算公館這邊想便宜吃飽的首選。"
K.J. Chen,4,這個便當份量超多，肉炸得酥脆，相當有飽足感。
Fish Wu,5,隱身在下小巷中的美食，吃得超飽的便當店，也可內用
Julie Wang,3,配菜有點太廉價，炸排骨跟以前味道有點變了，可飽食就是。
高龍福,4,"排骨飯好吃,一般簡餐餐廳"
林亞亞,5,"大份便宜又好吃😋
從10多年前到現在味道都沒變
非常推薦👍👍"
健仔,3,最常外帶雞排便當，口味、口感、外觀都算不錯，便當的米飯QQ的好吃，是常常買的便當店！
梁興龍,5,排骨飯好吃，熱湯也夠好喝
余祐陞,5,不算便宜，畢竟在公館商圈，但份量很大
林發達,5,份量十足！米飯很Q彈，常常光顧！
YUOTO LIU,2,"價格110-120,cp低,炸的也不優。"
Ike Chang,3,先炸排骨還不錯，110元稍貴
游博翔,3,大塊炸排骨，飯份量多，可以吃很飽，炸排骨稍嫌油膩。
許哲銘,3,單調炸排骨70不便宜，表現比大多數的便當店好，麵衣酥脆，肉醃的入味，微有肉汁但稍嫌老。
林子茗,2,我認為白飯煮好是便當店的基本
曾偉蓬,4,餐點種類不多，但都很好吃，炸雞腿很酥，配菜分量也夠，是個吃便當的好所在
順增陳,5,吃了十幾年了，依舊不變的好味道
蔣小蝶,4,價位合理，雞腿麵排骨飯份量大
設計懂之懂之,3,喜歡他的炸雞腿有醃過，但配菜很普通又一成不變很可惜，價位略高於平常的便當店，可以再加油一點
Yu Fang,4,主菜很大塊，飯和配菜一般般
vivi,4,雞腿好吃，配菜普通
Yuki C,5,雞排飯比排骨面還好吃😍 便宜又好吃
L漫遊者,5,餐點中的雞腿，大的讓你想起，雞腿原本應有的體積。
TinAn C,3,"110的排骨飯 真D貴 但還不錯吃 如果賣80我就給五顆
偏偏賣110
不敢去惹"
shanlu yu,3,炸雞腿的麵衣，實在是裹太濃、太厚，虛大了許多僞尺寸。雖然肉醃得還蠻夠味。
yumiaoling,4,從小吃到大，三十年的味道都沒有變.....唯獨價格快翻倍了
阿叔李,4,從小吃到大 吃的是回憶 價格真的貴了點……
FRANKIE wei,5,雞腿超大只，皮酥，但好像二代接手後，味道稍微的不一樣
Zenith Armani,4,排骨及雞腿炸的不錯，以價格來說算大份量，配菜及醬油麵湯如果能再用心點就更好了
HJ Hsu,5,學生吃到現在。都很棒。
Jimmy Hsu,5,"單論雞腿飯的話，算便當界前三名，雞腿便當的雞腿又厚又大支，皮酥脆又入味，內部肉汁軟嫩。
配菜就是固定版本高麗菜、豆腐、甜不辣。"
Ariel CH,4,"炸排骨好吃。
醃過的肉香以及皮炸的酥脆。
感覺滿足。"
Penny Chen,4,"公館/台大商圈老店
雞腿及排骨都很好吃"
楊Paul,3,價格不便宜110，但份量大，炸物還不錯吃！
張宜泰,1,魚沒炸熟，老闆娘帶頭態度差，公館地雷店
Lin Jack,2,東西是好吃，但發現非常不衛生，裝肉的塑膠盒大概重來都沒洗過，外面的污垢嚇死人
天兵好,4,排骨飯最好吃！
Daydream白日夢,4,"排骨飯110
味道可接受，尾端大塊的地方容易跟飯黏在一起，再脆一點就完美，湯自己裝，配飯也算不錯
份量的話，雖然菜很簡單，但不算太少，平均男生應該吃飽剛好
還沒吃過的可以試試看"
吳明哲,5,雞排，豬排，雞腿飯外酥內嫩，份量足
崇玲者,3,"雞腿炸的酥脆多汁
配菜比較抱歉不愛
一定要馬上吃才好
炸物冷掉影響口感
若問還有沒有下次
老店總是要給支持"
周佑滄,4,排骨大塊，便當配菜豐富多樣，可以一吃再吃的本土料理。
Evans Ou,3,"學生時期的回憶
菜色依舊 味道依舊 裝潢依舊 態度依舊 唯一變的 就是銅板價 變高單價"
米非,4,"110.01
排骨飯跟雞排飯都不錯"
草莓芯,2,看起來很厲害，吃了後飯超黏，排骨也很普通，不推......
Philip Han,4,公館老字號排骨飯，排骨有醃過，麵衣是偏甜的味道，排骨飯110元，單價稍高。久久還是會想吃。
Chang-ming Lin,3,點了一碗排骨麵，排骨有醃過，炸得不錯，但湯麵的湯沒什麼味道。
連小奈,3,味道還可以，炸豬排的粉有點甜甜的，肉不會很薄，但用很大的碗裝少少的麵跟湯，感覺很“稀微”，而且麵煮的黏在一塊，硬硬的，這樣要價110，量和價不對等，跟20年前差很多，不會特別想再來吃。
李永仁,4,滿好吃的，110元，價格比一般店高。
享樂生活Kenji,4,排骨外酥內嫩，歷久彌新的好味道
宋子敬,5,目前，還沒吃過比大福利更好吃的炸排骨及炸雞腿，這樣你就知道厲害了！
Yuzong Lin,3,口味還可以，菜有點少
Melody Hu,4,"排骨便當$110
覺得有點小貴，但份量大 排骨炸的酥脆
只是份量對於小鳥胃的人真的是太多了
很適合男生或食量大的人去吃"
板橋李準基QQ,4,"吃粗飽
但是真心認為 CP 不高"
明捷,4,好吃，偏小貴
Steven Chou,4,店裏的雞腿飯好吃! 雞腿炸的酥脆、肉質嫩、油脂適中、鹹中帶甜。該店配菜不差，環境尚稱整潔，台大公館商圈附近能與之匹敵的炸雞腿飯應該不多。
陳伯烱,5,排骨味道很優
H PC,4,公館的內用便當店，價格中等
Ian Chuang,4,炸排骨不錯，白飯不優。
raiden huang,4,從小吃到大的美味，陪伴無數辛辛學子的求學時光的美味。
yupin chou,5,好吃的年少回憶
李美華,4,個人覺得雞腿比排骨好吃！實在是皮脆肉嫩汁多
黄莉婷,2,飯太硬，配菜越來越難吃，
傅傳興,4,有冷氣，環境明亮。
Joanna Wei,4,主菜不錯，配菜就一般般
海波浪,4,雞排便當！米飯超香，雞排超大片，100元！好吃不貴^_^
胡幀閎,1,做便當要花15分鐘以上 我點雞腿排骨便當 卻給我兩個魚排便當 價錢還是算雞腿排骨飯的錢 不會再去了
KS執行長,5,雞腿飯很推
張嘉陽,5,太好吃的雞腿飯
王鼎,2,老店但味道已經變質不敵當年，現在感覺稍微貴了一點點，每次想吃的時候，吃完總是失望
史嘉蕾,3,生意很好，100出頭一個的排骨便當，排骨很大一片
Bruce Shyu,5,招牌雞腿飯必點！
arthur chen,4,推薦雞腿飯，鮮嫩多汁、外皮酥脆，還有自助式湯品也不錯的。
王威達,1,炸排骨油沒常常換  導致排骨味盡失  已經不再是以前的那間排骨大王了  失望  列入黑名單
KELLY YEN,3,吃粗飽的，不僅有飯還有麵，選擇比一般便當店多。
蘇天翊,5,這是我吃過臺北市最好吃的便當店～
徐Sky,3,"老字號便當店
吃膩了飯也有陽春麵可以搭配（因為配菜萬年不變）
適合肉控
雞腿雞排排骨都算不錯
但價位真的越來越高了"
沖田总悟,3,跟朋友一起買，價格110偏貴，不過因為是台北所以還好，鱈魚不厚菜量大概五種但偏少，下次吃吃看招牌排骨飯
James Yi,4,吃粗飽、吃回憶！
Alice Lin,1,"有點瞎的配菜
罐頭土豆麵筋
醃蘿蔔乾
酸菜
蘿蔔絲
價格不親民
配菜也不用心的感覺"
Fly Fly,2,被人插隊就算了，來了十分鐘，後面的人比我還先拿到菜。根本不在乎服務品質。
nhow,4,皆100以上的便當，我覺得偏貴5-10元，內用有免費的湯，好喝，但是3樣菜色，時常不是我喜歡吃的。
JoJo Wang,1,"我住在316巷從小吃到大，今天108/06/24 16:00左右去買一個排骨便當，不知道是不是因為中午空班主要炸排骨的人不在的原因，排骨一大片切成六小片，有三片跟橡皮筋一樣根本咬不斷，根本像死肉還有油耗味。
我看著那個幫我做便當的小姐，看了排骨沒熟又丟回鍋裡炸，結果回家打開吃，心裡幹意滿到吐出來，超級難吃，老店固然有老顧客撐著生意，但你們也不用這麼隨便吧，中午空班去買你們便當的人就活該準備等著吃跟橡皮筋一樣的排骨嗎?幫我做便當的小姐，你不會就退下，叫老闆來炸。"
莊琮凱,3,味道還好，但總覺得跟20年前的味道有所差別
Tequila Lai,5,傳統好滋味 CP值又高
阿峯阿峯,4,主菜的肉類沒問題，配菜和飯不行
鄭心玫,2,排骨不錯吃，可惜太老的菜沒挑出來，配菜又炒很爛，米心感覺沒有透，飯吃起來不夠熟
Wang amy,3,雞排飯很好吃
Leo Feng,5,我最喜歡的排骨超好吃的
Wei,4,"雞腿飯很好吃
排骨飯中上
缺點是飯煮的濕濕黏黏的"
Peter Chu,5,從小吃到大的好味道。。雞腿太棒了。
bradshaw wu,4,最喜歡吃的是排骨便當，飯粒粒分明美味可口，便當量都很大份，但真的愈來愈貴了。
Kai Hsu,4,美味份量多，熱湯隨你喝
Steven Yang,4,店面大，整齊乾淨，公館商圈吃飯的好去處
馬到成功,2,國中吃到現在，變了，肉變薄了。
國全趙,4,大碗滿意之學生美食
Kenny,3,"還算常吃,排骨還可以,但品質不太穩定
配菜萬年不變...也是時好時壞
另外價錢愈來愈貴了"
Raymond Huang,3,排骨主菜絕對是愛台式口味的店，其它配菜就不盛出色。
Phoebe Kanahei,3,尖峰時間來會吃到沒有炸熟、濕濕黏黏的排骨😂，建議離峰時間來比較不會雷。
Liuyiho Liu,4,便宜大碗，吃了20年，口味不變
Terry Hsu,5,從小吃到大的餐廳，以前還是在路旁的一個小違建鐵皮屋
MENG-CHANG SU,4,吃粗飽的，份量超大且味道不差。但除了主菜都是油炸物之外配菜也毫不清淡。胖子跟腸胃不好的人慎之
簡建忠,5,外帶回家 米飯依然好吃  ！ 花東米就是不一樣 ！
Lin Eric,3,不難吃，但偏貴，份量小一點，價格便宜20元在公館比較有競爭力。
林承恩,3,"價格昂貴
雞腿看起來大支，其實都是裹粉
不推"
Hsu Frank,2,大部份的評價都很正確，我如果不是一個人的話，下次應該是不會再來了。
victor Tseng,3,價格做為一個便當，有點貴，但相較於公館的價格，算是平價。食物普通，但份量夠，食量大的人，會滿足這個排骨或雞腿便當。
Ting Ting,1,"20190620,中午11:30,我在大福利買了2個便當帶走，結果有個中年男人，帶著頭巾，對著我的一個蓋好的便當打噴嚏，但是另一個便當未蓋住，雖然沒噴到，但還是令我覺得噁心至極，你沒戴口罩就算了，沒人教你打噴嚏要頭朝旁邊，或是用手遮住嗎？虧你還是開便當店的，連這種基本衛生的道理都不懂，噁心死了，各位要吃老板噴嚏便當的，請斟酌。"
洋樂,4,雞排飯好吃份量很大
鍾曉雲,4,老字號的快餐店，排骨跟雞腿都是招牌。
Nana,3,每次去都點雞排飯，肉汁噴發
Steve Hsieh,5,公館名店，食材、湯頭份量在水準之上，平價美食。
zodiac,1,這輩子吃過最油最難吃的排骨飯就是這ㄧ家，現在ㄧ想起還餘悸猶存，價格更讓我終生難忘
S.Q Wang,4,雞腿酸菜麵確實好吃，值得一試，價格再親民一些會更棒。
張樹成,4,肉大片，味道不變，
CHT SOC,5,分量足夠，飯熱熱的很好吃，配菜也不錯，CP值很高，讚。
企鵝王,3,"一百元的雞排便當
配菜偏鹹
雞排炸的酥脆肉不柴
可以吃粗飽"
艾斯,4,從小吃到大的老店 好吃欸
Tony K,4,雞腿好吃，附湯料多實在。
kevin sun,5,雞腿便當份量大雞腿也大支.炸過的雞腿油滲入白飯中香味四溢..我覺得現場吃沒有便當來的好吃.
突破盲腸,1,"門口店員態度不夠親切!!
找錢也不會說謝謝!
收桌男生動作魯莽!走道上碰撞!
尤其女生要提高警覺!!!
我哪管你有意還是無意!  (老婆親身經歷)"
Ann Chen,2,菜還可以 排骨超鹹 😟
Jenny Yu,3,"2019.4 goo友的評論都蠻確實的，我就不多說了，但我點的雞排還蠻香蠻好吃的。
歸類在一次性的店。"
Gs Sun,4,排骨飯、雞腿飯主菜不錯，但配菜不怎樣，尤其是豆腐沒有味道
SU SU,3,排骨多汁但炸得不均勻，配菜很鹹，中午排隊人多。服務態度普通。
Jimmy Tseng,4,學生族群的好餐廳 大份量價格合理
szuszu Lee,4,雞排飯很好吃
吳宗翰,2,"沒什麼人的時段還能忘單讓人等超過20分鐘…
雖然也不是第一次吃了，但我今天剛好很餓…"
yuwga Chen,3,用餐環境尚可，服務態度普通。飯偏軟，配菜較一般便當店差，排骨味道還算可以。110的價格偏高。
美連,4,吃飯的好去處
Amber Li,3,排骨好吃，但價格偏高～
KiKi Liu,3,"2018/08/13（一）13:53
❖ 雞腿飯（$120）雞腿不是現炸的，不熱，外皮不是很酥脆，感覺有點油，肉有點乾，沒有肉汁。白飯煮的太過軟爛，配菜也不太OK。
❖ 排骨酸菜麵（$120）酸菜沒有期待中的酸鹹脆，湯裡也沒什麼酸菜的味道，較多的是油蔥味。個人覺得麵煮的過軟，不是我愛的口感。排骨蠻大塊，厚度約0.5cm，有先醃製再裹薄粉油炸，外皮酥脆，排骨肉軟嫰不乾柴。"
Terry Chang,4,雞排100元 讚啦
朱淑晏,2,配菜好鹹，飯量也偏少，排骨含油量很多，炸得不夠酥。整間店都是油耗味。不會想要再去吃。
蘇柏丞,4,肉醃的有入味，口感好，可是吃完好渴
Wink Josh,5,排骨，雞排好吃份量大，白米飯感覺像是糯米混白米煮的，很香
family kao,2,配菜於熱天時有餿味！
黃維明,3,每人口味不同排骨飯有人說好吃 我覺得還好
Brad Chen,1,點了個雞腿飯，小妹便當都快裝好了，結果老闆突然叫小妹拿之前做錯單包好的給我，炸雞腿的皮早被水氣悶到爛掉，服務態度不敢恭維，品質跟價錢也跟以前不一樣了，不會再去吃
薄雪草,1,"排骨飯的白飯有3分之1是硬硬的,米根本沒煮透,賣了四十年飯的品質有問題!!店家竟然沒發現!!打電話去反應!!老闆就酷酷的說拿來換!!好像我們都助他隔壁~完全不會說聲""抱歉!!
配菜就是永遠一樣~~排骨老樣子濕濕的ˇ不夠爽脆!!
這麼久的老店~售價也不便宜~110元一個排骨~服務品管也該注意吧!!"
Michael Wang,5,便宜又好吃的學生美食，飯多排骨又大塊，吃得飽，好滿足。
林家榮,5,在地公館人都喜歡的一家店
章曉豪,1,跟以前差好多，排骨飯的排骨又老又乾，湯也沒味道，跟以前差好多，不好吃，好失望。
John Wu,3,非常大盤適合學生
王瑪姬,5,年輕的時候來吃，現在帶高一的兒子來吃，懷念的好滋味。
Tony Cheng,4,排骨飯好吃
James Chou,1,"三十年前大學時期就常來吃…
下午時段雞腿先炸好擱置好一陣子，客人點餐後將雞腿再回鍋熱一下端給你我他吃，但是吃起來有油耗味及感覺不是很衛生新鮮~
記得以前不會啊…"
Rommel Liu,4,適合學生與上班族的用餐場所，便宜、份量足、出餐快速，即使過了中午用餐時間，它仍敞開店門撫慰你的胃。不過近來餐點水準有點下滑，稍微讓老顧客失望。
Lorentz Lin,1,"吃完
可能太油還是不乾淨
肚子超痛"
chien lun kao,4,我比較偏愛大福利的炸雞腿，醃製過醬油的雞腿外表香酥有嚼勁，好吃！！現在120的雞腿飯好吃的已經不多了⋯因為我是肉肉族所以對我來說配菜一直都不是重點！
劉小惠,5,好吃，但真的好貴...
艾登,1,20年前高中時期第一次吃到，真的超級好吃，但現在奇差無比，價格貴就算了，配菜永遠不變的難吃麻婆豆腐，炒高麗菜菜也沒挑，ㄧ小搓菜黑爛的一堆，嚴重懷疑根本沒有洗過，這樣的品質不值得他的賣價 ，更不用說到那令人不敢恭維的販售態度了⋯
wei,2,才6點湯就涼的 菜也涼了飯也涼的 白飯還有怪味只有肉還溫暖的！變差了
Kuang-chih Lu,4,排骨比其他店家大，份量也稍多。多年來不變的菜色一定會有豆腐。價格也漲價了，雞腿120元，排骨110元，各漲了10元。
Mr. Long,5,排骨便當好吃又超飽
Sky Wang,5,"肉炸的很好吃、份量也很大
重點湯是熱的且有料"
