author_name,rating,text
Hsieh Ricky,5,氛圍很好，咖啡有水準，服務親切
kiplin K,4,氣氛好，熔岩蛋糕 good!
藍鑫,4,這家咖啡館的拿鐵口感順口不澀
Tobias,5,愛爾蘭咖啡真的好喝 店裡氣氛也不錯 但是有點太冷了
Rusche Chu,5,空間小氣氛佳
Wen-Cheng Wang,5,氣氛好，適合喝咖啡配書
Joelleho Joelleho@gmail.com.tw,5,"喜歡很久了
有個性的濃縮咖啡 /雙溫暖"
Richard C,5,感謝RUFOUS建立了台灣咖啡標準，最喜歡熱巧克力
Penelope Yu,5,愛黑咖啡必來
張雄濤,4,氣氛佳，老闆手藝不錯
Chia Yu Huang,5,很好的氣氛也適合自己用電腦，不過人有點太多
張沛齊,4,"蠻有質感的咖啡廳
在這邊談論一些事情感覺比較舒服"
EJ Chen,4,氣氛很好，咖啡不錯！適合聊天。
Austin Yang,5,老式咖啡館的典雅氣息 藝妓咖啡口感相當獨到
Vito H,5,冰滴藝伎
casper wu,4,環境很好...可惜大家太安靜了...都在上網
Hua Cheng,5,"一杯咖啡
一段讓靈魂沉靜的時間"
Wesley Wu,5,愛爾蘭咖啡，難得的好滋味
Tim Tim,5,店員很親切，環境舒適
didi huang,4,好喝的咖啡，但是人潮眾多，座位有點擠。
Cheng Chi,5,冰滴咖啡超級無敵好喝
JH W,4,好喝，拿鐵很優
Yi-Shou Chang,5,咖啡還不錯 週末店內不限時是優勢
傅春梅,4,咖啡好喝，環境文青
Rech Tseng,5,店面佈設專業 咖啡香醇口感渾厚
BANG-HWA SHIEH,5,舒適放鬆的環境，有深度的咖啡
Poisson Hsu,5,舒適的空間，高水準的咖啡
李德臻,5,咖啡原味讚，服務親切
朱嘻嘻（saabfans）,5,目前在台北喝過最佳的咖啡廳
Mic Chang,5,咖啡水準高，氣氛佳
YC Yeh,5,豆子品質不錯，店內氣氛佳
江以仁,5,咖啡歷險記，來看看！
Man Hsu,5,好喜歡喝這家的咖啡～
黃阿統,5,常常沒客滿沒位置應該是唯一的缺點
Joanne Lee,5,價位 餐點 整體氣氛都蠻優秀的
Rufus Ruan,4,好喝的咖啡，環境典雅。
Sophia Lin,5,咖啡好喝，氣氛很好 ~
Sun,4,可以凌晨趕報告的好夥伴
Chi Fen Lo,5,咖啡非常的獨特，進門咖啡飄香
summer chen,4,常常客滿，飲品種類很多
Ren Ren,5,各類咖啡水準極高！
Yi-Te Chiang,5,單品很讚！
高半芹,4,氣氛很舒適!!~
Wanrung Lin,4,氣氛佳、豆子品牌好
Huang Chih Wei,5,很義式
葉筑筑,5,甜點太好吃了
張小均（張小均）,4,可以在疲憊的台北躲起來的地方
郭健芳,4,很讓人放鬆的環境～
kalaok Pan,4,冰滴名不虛傳~ 甘醇順口
Zila Me,5,美式過份的好喝！推推推
司馬喬治,4,名店要排隊
方Stanley,5,咖啡好！氣氛好！服務好！☕
陳瑩書,4,甜點蛋糕不錯
Chiping Lee,4,黑漆漆的店，有個性的店。
