author_name,rating,text
Courtney Shih (溫室),5,"《#工作咖啡廳圖鑑》P. 49﻿
科技大樓站/ Rufous﻿ Coffee Roasters
ーーーーーーーーーーーーーーー﻿
🧡( ◡̈)/日安我是溫室
更完整介紹在Instagram
👉 @bonjour.onshitsu ﻿
ーーーーーーーーーーーーーーー﻿

#適宜工作指數 ：💻💻💻💻💻﻿
-低消一杯飲品﻿
-不限時/ 有Wi-Fi ﻿
-插座數量多，使用費20$﻿
-門口區域光線較明亮﻿
﻿
離台大後門不遠的Rufous Coffee …"
黛比,4,"Big 7 Travel 將 RUFOUS COFFEE 評為全亞洲第 16 名，並形容 RUFOUS COFFEE 店內木質的裝潢，讓人好像來到 1960 年代餐廳的感覺。
台北有名的咖啡店，不限時真的很棒，但店內空間小，今天客人聊天很大聲很吵，無法專心看書，環境品質有點受影響，但咖啡真的很好喝！"
徐國棟,5,店內氛圍好，不會太吵鬧，店家的拿鐵咖啡有甜感，奶泡跟咖啡很合，順道來看看世界50大的咖啡店，消費跟一般咖啡店差不多
周育如,5,生意很好的店，本想點燕麥豆奶拿鐵，已經沒了改成椰子奶拿鐵，椰香明顯帶有一點微鹽味，喝起來挺清爽不錯喝，朋友的摩卡巧克力香濃也挺不錯，甜點 焦糖冰淇淋蘋果派令人驚艷，下方蘋果派的蘋果及塔皮都好吃，微熱蘋果香甜，朋友分食也都讚許，下次去要再點～
周俐俐,5,"🌺捷運科技大樓站出口3分鐘的手沖咖啡專門店，一入內有秒回歐洲的feel,裝潢歐式小品氣氛，濃濃咖啡香氣，今天點的肉桂蘋果派佐香草冰淇淋，熱熱的蘋果派搭配冰淇淋，真是人間享受！"
簡安,5,冰摩卡很好喝，店員很細心親切，咖啡館的氛圍讓人放鬆。是會想要再訪的地方。
Lynn Ting,4,"📍RUFOUS COFFEE
🚇科技大樓站步行5分鐘

🍎焦糖肉桂蘋果派$220
☕️熱美式$155

終於來到大名鼎鼎的RUFOUS一店了✨點了美式跟期待已久的蘋果派，蘋果派不大、上面是香草冰淇淋、下層有蘋果跟派底撒上焦糖醬、周圍還有餅乾碎！整體不會很甜但很好吃（不過$220偏貴⋯CP值不高

咖啡的選項真的超級無敵多，手沖也好幾種，完全目不暇幾！美式很好喝，媽媽也十分滿意她的手沖☕️畢竟也是台灣唯三入選全球50大咖啡廳🏆 …"
地方八八（Wise Cheng）,5,"藝伎冰滴 Cold Drip Geisha $300
使用水洗巴拿馬翡翠莊園藍標藝妓，咖啡喝到口中的時候，像水果般的甜。
咖啡在喝下去後總會有一個味道從喉嚨回甘，藍標的回甘很持久很清晰，就像吃甘草欖，一杯擁有良好回甘的咖啡會讓香氣在口中停留的更久，尾韻更加綿長。 …"
阿奏你不合喔,5,"剛剛才發現     喝了這麼多次竟然還沒給評論
目前喝了幾十家店裡最喜歡的義式咖啡
沒有之一
很推薦點1+1
奶泡咖啡融合得很棒
口感滑順濃稠
上次試了薩爾瓦多的單品1+1   印象深刻
不過之後再來兩三次都說沒有豆子
店員說下禮拜會有
不要騙我喔XDD

不過人總是很多   我都會喝完趕快走人
希望大家都能喝到這麼棒的咖啡"
Ying Ting Huang,5,可外帶也可內用（內用不限時因此不知道會等多久）咖啡分淺焙、中焙、深焙；拿鐵還不錯，整體來說店家頗有氣氛、昏昏暗暗的、店員人還蠻好。不錯！附近也好停車～
AVIS KUO,5,咖啡超好喝，除了咖啡外，肉桂焦糖蘋果塔也是好吃到爆，肉桂味和香草冰淇淋，和蘋果內餡真的很有層次
Rita Chen,5,"好幾年前就因爲愛喝咖啡到處尋覓好咖啡
這回因爲大縱走路線在附近
結束後特地來這在品嚐拿鐵☕️
味道依舊好喝
不愧是列在亞洲50名榜上的咖啡廳"
Pan,3,"今天點了
摩卡巧克力咖啡🔥180💰
➕斑點卡布奇諾🔥165💰
➕焦糖肉桂蘋果派🍎220💰
咖啡☕️甜點、服務、店員、店內氛圍整體都很棒👍🏻

⚠️唯獨店內有一組3位女性客人聊天聲音極大
破壞了整間餐廳的格調，也影響到其他客人
（同行朋友及我個人都覺得非常吵鬧💢💢💢）
誠心希望店家能夠適度勸阻，保持空間平和健康。

咖啡🌟🌟🌟🌟
甜點🌟🌟🌟🌟🌟
服務🌟🌟🌟🌟
氛圍🌟（當時段過於喧鬧吵雜）

以上屬個人感受，提供參考。謝謝！"
Sandy Yang,4,"蘋果派好吃，蘋果派熱熱的搭配上香草冰淇淋讚讚
榛果拿鐵順口，但喝不太出榛果味
不限時，有插座要加20元
下午人多吵雜，不適合辦公讀書"
Mina HY Hsieh,5,雖然排隊等有點久，但整體感覺很不錯👍
Wan-Ling Tseng (ioloi),4,裝潢溫馨的咖啡小店，走過可以很順路的彎進來喝杯咖啡！低消是一杯飲料
Paul,5,"風格優雅、氣氛放鬆的咖啡廳，適合發呆或跟朋友家人閒聊，吧台座位桌面很寬，今天喝的是斑點卡布其諾，跟常見的拉花相反是鮮奶為底然後圖形是咖啡，蠻特別的，也好喝！
here is a relaxing coffee shop. nice place for chatting with friends. dotted cappuccino is very special!"
Cindy Chen,4,"聽說台北米其林級咖啡 入門滿室咖啡香 令人陶醉
服務員詳細解說手沖咖啡之不同 可惜人聲有點多 無法有寧靜品嚐之感
餐廳別緻 內部想表現東西太多 所以感覺稍嫌雜亂"
YT T,5,非常棒的咖啡店，每次來幾乎都喝三杯咖啡，真想把所有的咖啡品嚐一遍💕
Linda,5,咖啡專門店，客人絡繹不絕。甜點每種都很好吃，服務也很周到。店內光線微暗適合一人沉靜品嚐咖啡甜點，工作看書的好地方
Jerry Liu,5,"焦糖肉桂蘋果派可以～～
咖啡很順好喝
店裡不會太吵，且沒限時"
曼,4,"適合放鬆的咖啡店

今天喝熱的愛爾蘭咖啡
上面的奶油與下面的咖啡一起喝，濃濃的奶香味與淡淡的咖啡與酒香，好喝
後面冷一點酒味就明顯出來又是不同的風味

朋友喝熱卡布，重點的奶泡很綿密細緻，美賣"
林聖才,3,"鬧區裡小品咖啡所在，
椅子小且硬不適合久坐，腰痛啊！"
I'm Hope!,5,手沖咖啡很有水準，店內光線較為昏暗，比較不適合在店內的座位看書。適合真的放鬆心情聊天
Bryan Chang,4,此次試House blend，有點出乎意料，最期待的Espresso偏酸，苦味也重，拿鐵與卡布則均有達標準，而冰滴歐蕾反倒是個驚喜，平衡極佳，很棒的一杯！
chiu Chiu,4,喝了一次手沖單品超讚的 環境也不錯 不過有幾個椅子有點污漬
ChingHan Liu,4,生意興隆的店，常常客滿，古典的裝潢，氛圍營造的不錯，但是因為生意太好，常常進不去，美中不足
程皓天,5,都世界排名前幾得店了，還有啥疑問。
Dora,5,"軟法鬆軟美味，吃完無負擔。
環境舒適，很適合來看書、看劇，坐著休息！"
潘怡君,5,"二訪，
甜點好吃,
兩次都吃肉桂蘋果,
第二次覺得有點甜但真材實料,
ㄧ次卡布一次康寶藍，
下次要去喝單品，
店內音樂也好聽"
LingYing TSENG,5,"有古老咖啡館的懷舊氣氛~~~
儘管是懷舊氛圍，室內卻躟人覺得很乾淨!!
手沖很不錯!
檸檬蛋糕也好好食"
月旦評,5,"《RUFOUS COFFEE ROASTERS》復興創始店位在復興南路二段近和平東路，旁邊就是[國立台北教育大學]，從捷運文湖線的科技大樓站走過來約5分鐘路程，開車的話可停在附近[台北大安運動中心]附設停車場(位於辛亥路三段)。

RUFOUS(形容詞)英文意思是指紅褐色的顏色，店家認為咖啡豆最佳烘焙的色澤是[紅褐色]，店內紅褐色原木設計風格，充滿文化經典與歲月淬鍊的氛圍，與店名的《RUFOUS 》互相輝映。基本上《RUFOUS COFFEE …"
Rain Fish,5,"店內氣氛好，不過人多所以座位之間空隙較小
咖啡好喝，沒有失望"
Eric Pan,5,"點了一杯Rufous特調 150元，中焙，入口滑順，body飽滿，不苦不澀，經典好喝

生意很好，滿座但是不吵，有文學氣息的咖啡廳，有人靜靜看書，滑手機電腦，三五好友聊天，氣氛很好"
UO L,5,"手沖很好喝 風味很喜歡
甜點熔岩巧克力真的好好吃
會流下來搭配香草冰淇淋很搭
很舒服自在的地方"
王暉翔,5,外觀相當有懷舊風格的獨特設計，開門迎來的是阿拉比卡咖啡豆香氣及一台烘豆機點綴些人文氣息，不論坐單人吧檯區或是多人座的座位區，大家都能靜靜的品著咖啡香嚐個甜鹹點搭配手上一本書，偷偷的帶走時間當個城市旅人很剛好。在台北也是相當有名氣，座落在復興南路上緊鄰國立臺北教育大學，提升不少書香人文氣息，加上撲鼻而來的拿鐵香氣，濃郁順口的咖啡加上綿密細緻的奶泡，配上有檸檬皮點綴，微酸微甜的檸檬蛋糕，加上咖啡師的親切服務，也榮獲國外旅遊網站Big 7 …
tammy CHENG,5,評選為亞洲前50名的咖啡店，星期天下午，還是要排隊😅店面不算太大！但服務態度很好，氣氛也很好，barista都很專業👍🏻吧台內還有水冲咖啡的機器，第一次見到，除了咖啡以外，軟法總匯三明治好吃😋聽說「熔岩巧克力」也很棒🤩下次有機會一定要試試。
Stephanie Wang,1,"買外帶冰巧克力結果拿到巧克力都沒裝滿，而且喝起來還酸酸的有咖啡味，我跟朋友ㄧ起買的他的巧克力顏色是深的味道也很正常喝起來甜甜的，跟店員反應後她們態度不是很好，看起來很不想幫忙重做一杯所以就沒有多說什麼了，以後再也不會來了。

自己有錯還不願承認，ㄧ直說是ㄧ起泡的不可能不ㄧ樣，但是顏色很明顯不一樣，店員自己後來也發現也沒有想要重做的意思！重點是態度很差！

Terrible service & coffee!
We came to order iced chocolate …"
許瑋婷,5,曾在別處喝到Rufous烘的肯亞，蘆筍、糖烤栗子、焦糖的風味非常飽滿圓潤非常喜歡，好久沒喝到這麼好喝的肯亞了
Shi-Yi Jin,5,長輩愛冰滴咖啡，鮮奶茶（不加糖）也很讚，香
Gigi (Gigi no more rules),5,漂浮奶油冰滴不是冰淇淋喔。是咖啡上面漂奶油，奶油絲滑細緻，搭配冰滴咖啡香融合在一起喝我以為我回到前世凡爾賽玫瑰的公主的時空😝
YH Kao,4,位子不是那麼多，但咖啡香醇，蘋果派也好吃
Mankiw Lee,5,手沖咖啡有水準，店內氣氛舒適（湊到三人以上坐桌子），Espresso + 卡布的組合很棒！
簡五昌,4,氣氛不錯 榛果拿鐵好喝 甜度剛剛好
Koes Lee,5,"朝聖
老派風咖啡
聽說是台北最好喝的咖啡之一
甜點跟三明治也都不錯

看到其他評論說玻璃一塵不染，仔細看真的是如此，很大片的落地窗光潔明亮"
Ingrid Chou,5,咖啡無可挑剔的好喝，蘋果派也讚讚。
Nica,1,"路過想外帶一杯冰巧克力，結果一杯的量才這樣（如圖）我都還沒喝就長這樣😞覺得有點貴餒
然後裡面空間有點小，感覺服務生也有點不耐煩、態度不是很好"
劉佑,5,服務人員很熱心說明店內活動，同時很願意讓客人知道現在沖煮的忙碌狀況，即使我是外帶客人也享有店內桌邊服務的好溫度。
Daniel Ho,1,一個人不能坐二人座，太刻薄，很不easy.
Face Young,5,態度好 氣氛好 咖啡很好喝
Hsu Derek,4,環境氣氛服務都還不錯 可惜熔岩蛋糕烤得不夠久導致裡面的麵糊偏多 吃起來有點不舒服 建議再多烤一下 檸檬磅蛋糕跟冰淇淋還不錯 咖啡還不錯
Jessie Chang,2,"根據Big 7 Travel 推薦全台北市第二名的咖啡館故前往朝聖，平日下午幾乎滿座。但結果頗令人失望，先是水杯有一股臭抹布味，似乎是生意太好沒時間用清潔劑只用清水沖過故留下異味。想喝藝妓冰滴可能也是因為生意太好所以售罄。點了兩支手沖奇爾薩米和堤波波卡喝起來口感都是偏澀，介紹中說明的各種風味在腦海中只有成串問號。
建議店家如果生意太好請多加人手，我相信還有更多朝聖者即將到來，且莫讓了虛名。"
S. T.,2,"今天再度來到最近受到好評的Rufous Coffee Roaster（亞洲最棒的50家咖啡廳-台灣入選三家也是唯一沒有世界比賽冠軍師的老咖啡店，第16名)，下午約一點半到時已是滿滿客人，個人偏愛的的耶加雪菲水洗也沒貨了🥴，巴拿馬翡翠莊園藝妓也沒了，可能好評後慕名來的人太多了吧，可以點的水洗淺焙的手沖咖啡很少，只好點還算熟悉的伊索比亞哈圖梅村水洗 G1,瓜地馬拉 弗賴哈內斯聖喬治莊園 …"
黃郁芬2,5,很喜歡1+1 ，乾淨又濃醇的口感 🥰
Inhand Huang,5,很棒的咖啡與甜點，淺培肯亞咖啡豆，果香微酸層次很豐富，配上檸檬蛋糕的甜蜜香氣，簡直互相輝映，太搭了！工作者忙碌的認真、認真的忙碌，還有在小小空間中四處飄逸的香氣，看得出也品得出這家咖啡館的堅持與專業，很棒的第一次邂逅。
Evie W,4,"氛圍很不錯，燈光的設計比較像威士忌酒吧。座位舒適，吧台一人位的間隔也夠寬敞。

咖啡選擇多，口味偏重也苦，比較不是我偏好的型態。

洗手間很乾淨。"
HUH HUH,5,".: RUFOUS COFFEE :.
.
〔 熔岩巧克力 〕
〔 冰滴咖啡 〕
〔 哥倫比亞 克勞迪亞 〕
〔 焦糖肉桂蘋果派 〕
〔 馬拉威 瑰夏 〕
〔 蜂蜜肉桂拿鐵 〕
.
FOOD ☕️🥃🍫🍰
POV 🎞📺🥰
SERVICE ☺️☺️
RATE ⭐️⭐️⭐️〰️〰️
PRICE 150-400NT$
.
#huhtaipei #咖啡 #台北咖啡 #台北 #台北美食 #coffee #café #taipei #taipeifood #foodie #taiwan #🇹🇼"
Wu Ker Shing,5,冰滴咖啡非常好喝，不是順口的那種，是有很多味道衝擊的感覺，類似環境在台北咖啡廳很少見，有點復古華麗、溫暖的氛圍，迷幻樂加分
Xuan Yu,5,這是台灣最強的咖啡店，也有好多咖啡豆可以選擇，店員也會細心解說，內用的咖啡及飲品就更不用說了，非常好喝，單品手沖的味道細緻，每種豆子的風味也很明確層次豐富，這間是我最喜歡的咖啡店了！
Ophelia,5,"環境安靜溫暖舒適
店員人很耐斯
人也不會很多
咖啡真的很好喝
但我點法式巧克力
不過也是很好喝"
riley chen,5,"冰滴咖啡好喝!推推
深色木頭裝潢超有質感!
店員正!"
余宣,5,氣氛環境都很舒適，咖啡甜點表現極佳，店員細心解說菜單態度溫和從容，店家自烘焙豆子水準極高，風味層次分明豐富非常好喝。👍👍
ching2 ching2,4,"卡布150

點一款基本的卡布，義式調配豆與奶的結合，比例完全剛剛好，順口，奶與豆子誰也不搶誰風采。
很適合安靜的用筆電或看書時喝的順口品項，順順的也不會驚艷或難喝到到打擾自己工作，完美配角！

人意外的有點多，不是個適合一個人安靜悠哉地看書的地方。雖無時間限制但看到很多人在等，本人會有壓力。

好喝度☀️☀️☀️☀️
再訪度☀️☀️🌤"
王柏文,5,專業的咖啡廳，不論是手沖或是拿鐵，都很值得推薦！
游淑惠,1,請店員幫忙介紹咖啡，講一種就跑去做其他事情，介紹的很不用心，點一杯焦糖拿鐵，口味普通，價格180元，結帳時要185元，不太懂多出五元是服務費？沒有任何服務這五元真敢收
Ann Yeh,5,"磅蛋糕普通，但主要是來喝咖啡所以蛋糕不是重點。
男友點了冰滴他說非常好喝。
我個人是點了榛果拿鐵，蠻讓人驚艷的，外面店家的榛果拿鐵都非常死甜，但Rufous的 你真的可以喝到微苦的榛果味，每一口都很順！我非常喜歡。"
蔡蔡,3,點巧克力但是他沒裝滿...又很貴
Chara Lin,5,讓人驚艷的拿鐵！有機會一定會再來！
cinca tseng,5,"咖啡非常棒，雙杯組合可以一次嚐到兩種味道，適合選擇障礙人。點了濃縮冰淇淋和卡布奇諾都很棒。總匯三明治吃起來精緻，檸檬蛋糕表現的也十分亮眼，蛋糕吃起來很不會乾乾的，糖霜和檸檬的酸度也調和的很適中，大推。
下次絕對會再回顧"
Queener Lin,2,外送冰咖啡！冰咖啡1杯170元！並不便宜！雖然不錯喝！量真的少！好空虛！感覺不到170元的價位！
Tim Lu,5,SOE1+1真的很讚👍
陳亭妤,5,甜點蘋果派跟巧克力都好吃
T K,5,咖啡選擇多，氣氛好，很多客人都是久坐用電腦，內用不限時但是使用插座要收20塊
陳恬斐,5,"雖然空間不大但是環境乾淨
如果時間不趕可以細細感受整體的擺飾
店員介紹詳細"
yufen huang,5,康寶藍令人驚艷 ，專業的烘豆技術 ，寧靜的氣氛 ，印象深刻 。還帶了一包調和咖啡豆回家 ，真的是好喝 。讓我對單品手沖咖啡改觀 。
"cheng, hao peng",5,手沖咖啡真的好喝，喝完有種回甘的餘韻，店裡裝潢很咖啡，對於咖啡愛好者都可以來嘗試看看
陳建偉,5,質量很高的一家咖啡店👍🏼👍🏼👍🏼
William Chung,3,濃濃的咖啡因，重度咖啡人天堂
Ray Lin,5,環境跟氣氛讓人放鬆，咖啡特色鮮明不流於市井口感
C.J. H,5,"手沖不錯，卡布比較普通，檸檬蛋糕好吃
洗手間很大又乾淨多給一顆星"
Chun Go,4,短萃取濃縮和維也納咖啡水準都很好。
Terrence Lee,5,十足的咖啡因，一百分的好精神，一千分的神奇風味。
Jamie chiu,4,"二訪
咖啡門外漢只能區分喜不喜歡
無法喝出咖啡有多厲害😅
服務滿親切的，環境也乾淨

🔹蘭姆冰淇淋拿鐵 $220﻿﻿
酒味夠重，覺得超值好喝

🔹冰淇淋拿鐵 $190﻿
2位朋友都讚不絕口，剛上桌就喝了快一半😂

🔹軟式法國乳酪麵包 $120﻿
麵包鬆軟好入口
﻿
週末午後
候位30分鐘以上~"
Tommy,4,熱拿鐵，咖啡味濃郁，一直能感受到濃縮咖啡的味蕾衝擊，但不苦不酸，鮮奶的甜味也有，平衡上還不錯，一杯165元，可以來朝聖一下！
CiCi Han,5,喜歡我們的距離剛剛好。
Frank Chen,5,店內裝潢沉穩讓人不自覺就靜下心來，咖啡非常好喝，檸檬蛋糕再酸一點會更好。
蘇蘇,5,自烘焙的豆子有多種選擇每一種都很好喝，內用的咖啡與甜點也很棒，店員態度都很好，是台北最喜歡的咖啡店了 👍
Penguin Tsai,5,"氣氛很棒的咖啡廳
手沖咖啡香氣很夠
可以坐一整個下午"
Ray Hu,5,不虧是北市知名咖啡，覺得很不錯，雖然人多需等待，但是值得
Michelle Hsieh,4,值得推薦的咖啡店，很專業的義式咖啡！
郝佳怡,3,手沖咖啡好喝，但人來人往，有點吵，店內人也多，雖然沒有限制時間，但若要安靜看書打電腦比較不適合。有免費wifi。
hung yumi,5,Rufous coffee 整體裝潢是帶點懷舊風格的暖色調。今天點了一杯手沖咖啡和一份熔岩巧克力。手沖的香氣非常迷人，我點的這杯是偏酸的；熔岩巧克力真的是大愛，旁邊配上一球綴著莓果醬的冰淇淋，無論是單吃一切巧克力就流出的熔岩巧克力，還是在蛋糕仍溫溫的時候搭配著冰淇淋一起服用，或者再加一點莓果醬，最後趁著嘴裡仍有甜點餘味飲一口咖啡，哪一種排列組合，都能讓人幸福的瞇上眼睛。
Albert Yen,5,均價大約200的咖啡，豆子都是小楊自己烘的，品質高店裡裝潢也很文青適合三兩好友聊天品咖啡的好地方
Sophia Chen,5,"希望營業時間可以提前到中午之前
拯救早上需要好咖啡的群眾😂"
Jason Chen,4,一家自己烘焙豆子的咖啡店，已經有兩家店了，位子不算多燈光較為昏暗，有老咖啡廳的味道，店裡面最推薦的是單品手沖咖啡、香氣濃郁，水準不差，甜點只有兩三種，但是品質都不錯，喜歡品嚐單品咖啡的選擇之一
Sunny Chen,4,"RUFOUS Blend是在《Coffee Review》評鑑上高達91分，品嚐後果然滑順入口，甘甜味十足。另點的翡翠莊園的Geisha表現可圈可點。再加上ㄧ塊檸檬磅蛋糕，簡約愜意的就這樣快樂的過一下午。店家氛圍舒心，整理的很乾淨，很適合非假日在此混ㄧ天。
此家屬手沖水洗豆較多，喜日曬豆風味可能需另尋店家。"
周廷穎,5,整體風格很像歐洲的咖啡廳，暗暗的燈光與吧檯座位，環境舒適、伴隨陣陣咖啡香，店員也非常溫暖親切！
Yu-Kun Kuo,5,非常出色的濃縮咖啡，店內整齊清潔，氣氛優雅閒適，適合跟朋友聊天也適合就來喝杯咖啡。
Liora Lien,4,咖啡和輕食都好，沒有限時，適合和朋友相約一起聊天度過悠閒的午後時光。
Carol,5,甜點好吃
陳佳瑩,5,環境好，店家服務非常貼心，重點是咖啡好喝！
黃滄佑,4,Rufous調和美式順口偏酸，適合我這門外漢飲用，熔岩巧克力蛋糕組合，好吃，非常好吃，店面的陳設坐椅佈置舒適度就比較普通了，台北的店租實在太貴，或許換個二樓平價店面更能獲得更好的發揮。
Year 年 chang,4,感覺很溫暖的小咖啡館，長長的吧檯如壽司店的坂前，觀賞咖啡師的技藝<挑豆-稱重-研磨-沖>，點了兩杯手沖（薩爾瓦多、歌斯大黎加），配上檸檬蛋糕-香草ice cream蘋果派與總匯三明治。
Dexter Chen,5,"店內裝潢懷舊，氛圍舒適。
服務人員耐心說明菜單品項。
咖啡飲品不老派，個性分明。"
crazytra,5,"氣氛舒服、裝潢雅緻
咖啡非常好喝，店員服務態度很好、積極溫柔。"
梁富鈞,5,咖啡不錯喝，只是員工動作很慢，要有美國時間慢慢品嚐
Edward Yu,5,聽聞Rufous咖啡是台北數一數二好喝的咖啡店，經過路過一定不能錯過。週日十二點三十分抵達店門口，雖然店門已開，店員客氣地表示咖啡店要一點才開始營業，並將門外的椅子消毒後請我們稍待。十二點五十分開始有其他客人在門口等待，店員便請大家入座等待。我們點了藝妓冰滴咖啡，Rufous調和咖啡，義式冰淇淋咖啡巧克力口味與一塊檸檬蛋糕，先品嚐藝妓冰滴咖啡，除了該有的濃郁果香和微酸味外，還有一抹熟悉的香氣。尋思片刻，不就是 IPA …
李德,5,"咖啡沒啥可挑剔的！口味很多～
店內人員親切服務態度也棒！"
Ethan Huang,5,"老闆的 手沖單品 層次豐富有如葡萄酒…
藝妓冰滴…無人出其右。
搭配軟法&檸檬派 百吃不膩"
Paul 楊 (阿森),5,"終於忍超過十天了，👍👍👍
微微果酸、滑順好喝，有淡雅花香、香草的味道！
放涼之後有發酵的豆鼓味，有點像耶加雪菲！"
許文瑟,4,氛圍。咖啡。點心~美好……
郭昀儒,5,好喝沒話說
Jerry Hsu,5,咖啡真的不錯，可以試試冰滴藝伎、哥斯大黎加、耶加雪菲...等
hsiang jen Chuang,4,蘋果派好吃，咖啡也不錯，優點是不限時，缺點也是不限時
ERIC 6,4,"空間不大，外觀也不顯眼，進入餐廳彷佛進入另一個世界，躲避了復興南路的吵雜。
點了由五種豆子混合的特選咖啡，味道一般，店內大部分客人是享用冰拿鐵和冰淇淋咖啡，單品也許非強項，需要另外找時間拜訪試試冰拿鐵。"
Wennie Hu,3,咖啡普通，甜點普通，不太理解有名的原因⋯⋯
Bryan Lin,4,2016/10 氣氛輕鬆，咖啡口味還不錯，可以坐上一下午
Shou Sylvia,5,"沒想到有生之年我的木舌也能品嚐得出像香水那樣有前中後味的咖啡！

一入口繽紛的果酸、果香，然後迅速褪去，轉為木質的感受（據說是堅果風味），再過一會轉為回甘！這也難怪會得獎了。真是有點不敢相信，然後我就這樣一直品，一下就把這杯喝完了，天啊。平常是不喝黑咖啡的覺得苦，都喝拿鐵。一直到當晚過兩三小時後嘴裡都還是甘甜的，這是什麼魔法？

有買沖泡包回去，但自己才沒那麼厲害沖不出那味道。下次要再來喝別款。

在學校附近有點學術藝文味，算是一家小店，空間小位置較少，想來的要抓人不多的時間。"
HohLing Chen,5,咖啡好～環境好。
elainesui Kuo,3,咖啡好喝，肉桂蘋果派好吃~yummy~
A-Kwon Fang,5,"比起其他兩家在店面和建築上都特地設計編排、台灣唯三入選2019前亞洲前五十名的這家就像是尋常的經典小咖啡廳，除了燈光溫晦、吧台上有許多特色小物外，一切都像是走入了一家街口的老咖啡廳一般有股熟悉感，而正逢台大後門、這裡也是台大學生恰愛聚集之處。

不管是拉花或是奶泡的綿密都有著別於其他咖啡廳的細緻和巧思感，尤其是看到拉花造型和顏色都是經典卻帶著深刻時，就覺得這家店誠意滿滿；插座只有吧檯座位區有且要酌收費用，而除了室內座位外也有室外被花圃和鐵欄杆圍著的座位，挺有置身歐洲的感覺。"
Luna Yui,4,飲料不錯，冷氣很強，舒適慵懶的咖啡館。
Hsin-Mei Su,5,冰滴系列總是不會讓人失望，太推了，這次點的是維也納。干邑酒康寶藍也是我的愛呀！
Mi Wang,5,下午客滿時段會覺得擁擠，但不會吵雜，咖啡品質佳
Caesar Tan,4,用虹吸式煮法， 但店裡好冷啊～～～～
