author_name,rating,text
Vittoria C,2,"打電話預定 晚上6:40
服務生說那幫你預定7:00
6:50提早到餐廳門外 就是這種場景
上前詢問只說先排隊登記
服務生當時還在喊6:00取餐的客人
制度不妥 動線也沒安排
防疫期間在家用餐的意義完全沒有
所有人聚在餐廳外面等同於群聚
現在規定戶外只能十人
請問貴公司有符合規定嗎
那打電話預定的意義在哪
是不是越早定 就可以先取餐
如果要趁疫情期間賺錢 不是拿客人的生命做賭注"
MingHo Wu,5,"馬辣開到 半夜四點
最近吃遍了 各家 馬辣 新馬辣
在湊 10點 可以 第二人免費

這家公館馬辣 居然不是提供菜單
用畫的 是要客人 自助吧一樣
拿著餐盤 去夾 海鮮跟青菜之類
餐盤只有一個 感覺不太夠用

還有提供生啤酒
冰塊 居然變成一灘水
可能 喝啤酒的人 比較少
我最近也在戒酒  /. \

安格斯黑牛 跟 頂級牛梅花
真的好吃  可以涮一下就吃了
五分熟 即可

哈根達斯的冰淇淋
有一櫃 溫度調太低
凍到太硬了 不好挖
巧克力口味還是比較好吃

服務員 服務很親切  認真
有常巡邏 幫忙替換空盤子

位子是沙發的座椅
非常舒適 桌面很大"
Shawn Feng,3,"【外帶半價之亂】

原意應是鼓勵民眾待在家，自取外帶避免群聚。結果卻因半價、多給肉太夯，一堆人根本訂不到變成現場排隊。這張照片拍攝於11:20左右，排到爆。

只給三顆星是因為流程沒控管好，再加上到了現場才知「只能從四人份」買，二人的要先打電話預約。

這還不包括你有沒有那個命打的進去，只要查詢一下FB就發現幾乎全台各店都打不進去。現場還說，如果要二人最快一點半才能拿。 …"
Joseph Chang,2,點了麻辣湯外帶結果內容全錯，變成蔬菜精力湯，刀削麵變蒸煮麵。手機對結果單全錯，是發生什麼事lol，這樣是不是一次兩組客人受害，真的是一石二鳥。疫情期間共體時艱，還是留兩顆星好了⋯⋯
Joanne Wang,5,好吃的麻辣鍋 疫情期間推出的外帶五折專案不但超級優惠  而且因為訂了很多份還幫忙拿到車上  服務不打折很讚  不過預訂電話超難打進去😃
Allen Tsai,4,冬天有季節限定的草莓吃到飽，公館店空間比較擠，取菜的時候要等一下，飲料種類比較少，價格也比較低，整體來說還是很不錯
Daniel Luan,1,如果真的要用特價打廣告，就不要怕人家買，門市電話完全打不通。 買到了回家發現少食材.....
Bella Tseng,4,防疫期間只能外帶，但外帶套餐的份量好少，4人份的湯/肉/青菜和其他火鍋料加起其實只夠2人吃，防疫期間只能這樣了
judy,2,防疫套餐（6人，4人），火鍋料每盒都一樣，青菜袋也都一樣，；且量少，對不起馬辣的品牌
YURO,4,"價格合理有很多的選擇
CP值很高
冰淇淋多樣化
菜色豐富
有咖哩飯
只能現金付款（小小缺點）
座位普通，顛峰時間需要排隊等待"
Kenny Jean,1,"防疫期間的外帶爛的可以, 食材爛, 包裝爛, 完全配不上頂級兩字"
貓頭鷹Fiona,5,"大年初一遊自來水博物館。
一旁馬辣店內價格單一價，國小兒童半價，不限肉品吃到飽。

草莓、天使紅蝦、螃蟹、和牛、牛舌無限供應，哈根打斯16種口味滿桶任選，一旁還有莫凡比兩冰櫃。我站在菜料冰箱前看10秒，服務人員立刻問需要什麼，我說想拿紅蝦正好沒了，一分鐘又立刻端滿盤紅蝦出來。

草莓大家滿盤滿盤拿，幾次經過冰箱，還有草莓在盤內等大家夾，不只草莓，蓮霧、葡萄、哈密瓜、棗子都是漂亮的水果。 …"
陳聖文,1,"打電話訂購外帶都打不進去，到現場排隊半小時
電話都沒響過，不知貴公司電話是否壞掉
買完回家東西還少東少西的打電話也打不通
外帶麻辣鍋的豆腐沒有一塊是好的都很碎不知怎麼吃"
李卓軒,2,前兩天去買了外帶防疫套餐，漏給滷三寶，傷心
方美芳,4,食材豐富多樣化，服務到位，唯一的缺點是座位太過擁擠。
Wan-Yu Yang,1,本來要打電話訂防疫套餐，結果打了四十通根本打不進去......
花併澤,5,"環境乾淨，有收一成服務費用
店員態度很好，上菜速度也很快!!
酸菜白肉鍋跟羊肉意外搭
比較特別是其他食材都要自取不用畫單~
覺得這家鮮蚵味道很讚
哈根達斯有兩款調酒冰味道不太好吃><(其他都很不錯)"
陳芷晴,1,"吃過最糟糕的馬辣，絕對不會想再訪!!
店內還人五星送海鮮，但讓人無法違背良心這麼做

3/13 中午1:30用餐
環境狹小髒亂，食材很少且不新鮮，座位動線都讓人極為狹窄不舒服，店員端個東西都會撞到客人

廁間地板滿是垃圾排泄物，直到用餐時間結束也不見有人清理，且全店男女客人店員混用兩間廁所，光是排廁所就很久

自助食材櫃的食材補充很慢且量很少，一兩桌客人就會全部取完，蔬菜類只有寥寥幾株，海鮮類食材上都還有厚厚的未解凍冰塊，一煮就碎吃起來粉粉的很不新鮮 …"
Jasmine Tsai,5,肉好吃不韌不卡牙、尤其推薦牛舌，很Q彈！海鮮蔬果品項也很豐富、補充速度快，桌邊服務也很迅速、態度良好，推薦👍🏻
許哲瑋,1,"電話有夠難打
建議老闆取消電話這樣就不用浪費錢繳月租費"
Chaffee Park,5,"剛好遇到草莓季
平日沒什麼人吃的算開心的"
史蒂芬,4,選擇多樣 不過服務態度可以再更好一些
WEI-CHE CHEN,4,辦過一次導生聚，好吃😋
Yijin Kou,4,"東西不錯吃～腸子非常入味！
但空間有點小，然後人很多！"
香拿鐵,4,"醉雞的肉還滿香嫩的，湯頭偏清淡

麻辣的味道還不錯，對於我不怎麼吃辣的就很辣

食材部份大腸跟白蝦真的很可以

大腸入口即化，白蝦好似有用酒泡過吃起來清甜

冰淇淋是哈根達斯進來一定要先吃個五六球

先吃冰 在吃熱，胃比較不會不舒服不容易拉肚子

順便可以等湯滾食材煮透在開動～

手工丸子跟魚餃我也覺得很不錯：）

三五好友一起來吃我覺得很可以(⁎⁍̴̛ᴗ⁍̴̛⁎)"
Charles Cheng,4,"肉質都有一定水準，點肉送餐也快，海鮮類的都不錯吃，尤其鮮蝦、小卷、魚片都很新鮮好吃，啤酒不錯，不像有的店水水的沒味道。
冰淇淋口味超多選擇，但實在太冰太硬很難挖，越難挖，客人開冰櫃在上方挖的時間越長，越有衛生疑慮。
廁所很小，小便斗是用拉簾布幕圍起來，但公館寸土寸金可能也不得已。
整體來說，東西好吃，服務不錯，這也反應在價格上。"
Champion Lin,4,"以吃到飽麻辣火鍋來說算正常，但是食材和肉品不會是頂級的，講究的話就去單點式的吧
公館店唯一不足的地方就是位子擁擠
另外麻辣湯底好像只有麻？"
a0982388226,2,公館店應該是我吃過所有馬辣店最爛的，蛤蜊蝦子又小而且很久才補一次，海鮮都比其他家馬辣爛，給兩顆星是員工服務還不錯
湘玟,3,多年前去過忠孝店，感覺很ok，第一次來公館店，體驗不佳，首先動線極差，自取區全部擠在房子最後小小的區間，人全塞在狹隘的走道區，取食後要從同一走道返回，人與人彼此浪費碰來碰去，又浪費時間又擠得極不舒服，湯頭味道可以，吃得合口味，較之於小蒙牛還是後者勝出許多，冰淇淋區髒汙，服務生沒有經常檢查維持整潔，還有，網路上說壽星有和牛與天使紅蝦全程供應，只要訂位告知有壽星即可，來了才說天使紅蝦已不再提供，只有和牛，既然如此為何電話訂位時不說明呢？我可以選擇不要來啊！只剩和牛結果怎樣呢？七人 …
RT Y,1,"這家馬辣真的也是我吃過感受最差的，
環境不整潔，座位很小很擠，無時無刻都要小心旁邊桌的人
靠牆的客人要起來承裝食物，走道的人要小心讓位
自助區沒有規劃動線拿物品十分臨亂，全部的人擠在同一區
廁所也髒到不可思議
還有一間廁所壞掉
後台環境不整潔也沒有要遮蔽的意思⋯
加價有牛舌以及和牛等
圖片是我們點第二次牛舌，花一樣的錢倒不如去西門吃，空間大東西多，又乾淨。
打卡五星送東西我只想給負評

但每位店員服務態度都很好，有需求（加湯等等）也馬上過來處理，但這動線這麽臨亂店員們也要很小心
這根本就是危險的工作場所。"
王至文,1,"以700元來說，牛肉品質合格，海鮮(小卷、蝦、小花枝、蚵仔、蛤蜊、魚片、干貝等)合格。
缺點：
環境空間非常擁擠，基本上走道只能一個人走。
送肉盤速度非常慢(當天假日下午1:30)而且數量不準確，一次只能點六盤，點六盤卻只來四到五盤。
環境衛生不大好。
似乎有一位服務人員中文不太好，聽不懂客人的要求。
優點：
用餐時間兩小時，非常充裕。
哈根達斯冰淇淋種類超多。
如果你食量不大而且愛吃冰淇淋，可以考慮去。食量大愛吃肉不建議去吃。建議看看其他評價。"
G-Hung Lin,3,"從國中一路吃到現在要大學畢業，本來的話會給四顆星
高中慶功宴也是辦在這
可是附近出了更優質的辛殿
抱歉了馬辣
.
另外馬辣跟附近的新馬辣，馬辣>>>>>>>新馬辣
新馬辣的海鮮爛到不行"
Rita Hung,4,位置稍擠，服務不錯，菜色選擇多樣，麻辣湯頭偏麻，就是一個吵雜的火鍋店，同學聚會好場所
Zoe Chiang,2,"要求提前結帳卻只能付現，不能刷卡非常不方便。
剛好身上現金不夠只能去便利商店領錢，問能不能等我們要離開時再結帳，結果是不行，所以只好用餐到一半先跑出去領錢回來結帳😓
強烈建議老闆使用多元支付或刷卡機。"
noaround town,1,員工帶入寵物，並以此雙手直接拿取顧客使用的鍋碗瓢盤，也以此雙手拿取食材，讓人覺得食品安全衛生非常堪慮。
Antonio Jeng,4,第一次前往，單人需加價100元，午餐費用一共710元（單人），食材品質都可以，唯一在蟹類，我選用對切的三點蟹，入鍋川燙後，腥味噗鼻是一大敗筆，爾後所有食材都附着一股腥味，在此建議取用蟹類朋友們，他們因為將螃蟹對切，沒將蟹類無法食用部份清除（類似肺部）當你煮食這些部份腥臭都會進入高湯裡。除此之外，我對甜點方面非常滿意，服務員也對我非常親切，是我再多給顆星的原因。
I Have a Dream,5,主打麻辣湯頭為主的火鍋吃到飽品牌，有多種鍋底跟肉類能選擇，建議點鴛鴦鍋（兩種湯底）！麻辣鍋底麻而不辣很適合煮肉，再搭配一個花雕或其他的用來煮海鮮或菜！用點的肉類中花雕雞跟牛舌.黑牛都不錯吃，自取區有特別的食材「雞佛」可以拿，建議煮麻辣湯底吃的時候會噴汁要小心！想吃飯也有黑牛咖哩飯可以吃，甜點較弱但冰淇淋有超多口味的哈根達斯可以吃！冷飲區有奶茶跟煮好的珍珠可以自調珍珠奶茶！當月壽星生日有送頂級牛肉或海鮮！草莓季節還會有草莓！
林樺,5,"中午後去吃，人很多但很幸運不用候位很久，吃到飽性質，兩人約$1400左右（加收一成服務費），食材新鮮種類也算多，醬料基本都有，飲料部分令我印象深刻奶茶旁有有珍珠可以自己加入，真的很自助，甜點櫃從奶酪,羊羹,還有一大盤草莓（大部分偏酸，有些甜）旁邊有煉乳可以加真的是滿足草莓控，動線夾食材排隊會在出入口有些小擁擠，基本上還不錯~"
林育穎,1,"要求客人離開位置要戴口罩
結果自己外場服務人員口罩不帶 口罩不帶好
請加強防疫措施"
Yuhan Hsu,1,"一顆星給服務人員，服務優良。
缺點是座位狹小，動線不佳，大家拿東西都擠在一起。冰淇淋好難挖。
衛生堪率，醬料區附近就有看到蟑螂，坐在座位時，對面朋友頭髮爬上一隻蟑螂，我趕快幫他撥掉。後來去拿甜點回來，蟑螂從天而降到我手臂上（還好那天穿長袖）非常驚嚇但蟑螂也不見蹤影，只想快點離開就沒現場跟服務人員說。
東西算好吃，但這樣的環境建議選擇別分店馬辣。"
うりゃりゃちぇーん,4,麻辣湯頭跟其他馬辣分店相比好像偏麻一點比較不辣，加價購的松阪豬肉跟牛舌吃起來很順口好吃。澳洲和牛可能還是體態太過健康...吃起來就還好。
路痴烏拉媽,3,"麻辣湯底.與其他馬辣味道不同，太麻
了，麻到變苦，個人不愛
動線設計也不優  撞到人是常態
看到自助區.大傻眼，
辦家家酒的概念…"
林宥潔,5,"服務很好
特別是俞姓服務員
看到顧客冰淇淋挖不起來會主動過來幫忙挖
太感動惹🥺"
單寧,5,每次想吃麻辣火鍋就會想馬辣，鴛鴦鍋必點麻辣鍋跟花雕雞鍋，好吃😋
薰慧,3,今天禮拜六人多，可惜東西補的不快，而且即使後面沒人（都是空桌子），還是準時趕人，所以建議胃口大的人不要人多的時候去，會吃不飽喔！
Yi Jhen Lu,3,美味好吃，服務態度又好，扣星是因為沒有草莓了，12點進場，1點半就沒有草莓了，有詢問說不會再補了，根本沒有吃到飽的草莓😣😭
陳儀祥,3,坐位有點靠太貼了！要以安全著想，空間要隔開些。店內應該是每幾公尺，擺設滅火器。
呂瑞翔,1,"吃到後面、準備要吃水果了、沒草莓了！
跑去看前面是不是有數量限定！
不、它明明就是吃到飽。
現在才中午那晚上的呢？
騙人⋯⋯
重點、重點、重點
我一顆都沒吃到、生氣😤"
Doreen Lin _koc,2,"跟其他馬辣分店比較起來、有待加強！
座位狹小、動線不良、補食材速度不快、麻辣湯頭一般般！需在調整一下！"
林煒強,2,一直來問要不要加點肉，然後又不上，沒關係你就繼續皮
Lynn Wei,4,"下午時段很適合用餐,人不多,不用搶東西,午晚餐一起解決!"
游昌霖,1,"如果你正打算訂位
真的建議你先看過這評論再決定

自大學到出社會 至少半年會與家人或好友來吃一次馬辣
但以下這大幅下降品質的狀況 實在令人為管理者擔憂

1.出發用餐前去電確認是否有草莓 工讀生回答有
結果根本沒有 問現場其他服務生 居然回答我「因為產地雨季 已經連續三天沒有草莓」
那為何我打電話去的時候回答我有？為何朋友昨天去吃復興店的有？

2.最早吃馬辣時 當時的麻辣鍋都是師父手炒 味道很香
但近幾次去發現味精越來越重 也失去以前的香氣 …"
May Chiu,1,"吃完回家後整天整晚 口乾舌燥無比.............. 超級無敵難受!!! (我們全家四人都如此

於用餐前天訂位訊問有無草莓 你們回答有
訂位當天我們晚上6點吃 下午4點再次打電話詢問 你們也說有草莓
我們晚上6點抵達時 根本就沒有草莓 只回答我們供應商供貨不足....
那為何我們向你們確認兩次 都跟我們說有提供草莓......... 當下我們感受非常非常糟糕 不舒服 有種被騙來 (也許你們說 我們可以當下離開不要吃 我當下是真的很想走人 但因為帶兩位長輩來用餐 …"
陳子舒,3,"我很好奇，是不是馬辣體系的，五個人就會安排併桌，明明有六個人的位置卻不給坐

一家五口二次都是這樣安排

連新馬辣也是"
S YO,4,"除了很多人夾菜不戴口罩
以及五位成人坐在四人位很擁擠
（但店家説可以坐六人，感覺只能坐四位成人兩位小小孩）
還有抹茶哈根達斯那個冰櫃不知道是不是溫度問題
冰特別硬、特別難挖
然後這次去水果沒有前幾次去看起來漂亮
棗子切完放太久，邊邊都變不新鮮了
飲料旁提供的珍珠也放好幾個小時了
吃起來真的～母湯

除了以上，其他都很好"
徐琪琪,3,近兩次去用餐覺得湯頭變了，變得比較麻而非原先的麻辣均衡，詢問店家後得知去年11月起他們的湯底有所改變，但我個人還是較喜歡原本的湯底，現在的太麻了，還需另外加白湯；另外外場服務人員不太會注意較裡面的桌次顧客，舉手好久都沒人理我😩要自己走出去找服務人員；還有兩位背著手在準備區裝忙。告知湯底不要豆腐，麻煩鴨血多一點，結果送來的鍋底是什麼都沒有……呃呃呃……
Zushian Chen,2,上次吃有5顆心 這次吃是完全不可以 麻辣湯頭只有無敵麻感卻沒有什麼辣.....甜點除了奶酪也就是普普....兩顆心的原因是至少還有Haagen-dazs是正常水準，好吃。
曾鈺祥,4,要起身去夾菜跟火鍋料還有海鮮，弄得很像平價吃到飽，不過能一直吃蝦還是很不錯啦，冰淇淋有莫凡彼薄荷巧克力就是讚。
林偉平,3,馬辣的第一間店，口味以及供食仍有一定品質，但以現在的標準來看，裝潢以及內部座位配置真的太擁擠了，若非特殊狀況其實不會到公館店。
Tzu W,2,今天天冷臨時想吃鍋類，想說才下午4:40還不是用餐時間應該不太需要排隊所以決定去用餐。詢問門口登記人員，服務人員告知都有訂位，要6:00後才有位子，並說提前有位子會打電話通知。登記後就去附近逛街。至6:20都未接到電話，返回詢問說要等6:30的預約客人是否有取消才能知道有沒有位子。但是看登記本上我們後面的電話都有劃掉，問服務人員是都沒打電話嗎？感覺回覆支支吾吾，總之6:30的客人有到，我們也莫名其妙有位子了。本來以為就這樣。點餐後大概半小時第一輪的肉在我們詢問後的10分鐘才上 …
真霓,5,"肉質不錯👍🏽大推Prime牛梅花🥩
食材豐富  CP很高
可惜湯頭煮到後面有苦味"
田天,5,好吃的鍋物吃到飽，料非常豐富可以滿足大家的胃口。
Fang ju Yeh,4,"店員都很親切，服務的態度能感覺到熱誠跟主動性。
餐點多樣，冰淇淋多不好挖，要用盡生命的那種使力。
唯獨希望餐盤的乾淨度能再加強些。"
Huang Paul,5,超好喝的花雕雞湯，最愛牛肚！營業到4點可以讓晚班的人也能盡興！
葉人鳳,5,服務好，食物Cp值高，停車方便，飲料有最愛的珍珠奶茶😊
楊炸彈,1,食材補的很慢，螃蟹吃到酸的..不然就是粉粉的口感..蝦子也是吃起來不怎麼新鮮！會給5顆星的都是為了一顆扇貝...
Hanlin Liu,5,萬年好吃，最近食材也升級了，還有我愛吃的雞佛，依然推~
陳庭宣,3,"服務生的服務好，湯頭口味也不錯，但飲料
（冷飲）選擇較少，冰淇淋更是硬梆梆，挖的時候手都會抖的地步😂"
許正杰,5,"超級好吃，我都不知道吃幾次了
我家廚房"
erial liang,5,"考量順路臨時來吃公館店，並沒有做預約，但負責B1桌的蔡小姐貼心通融一個需要預約的規則，感動

在此幫忙她打氣，希望主管予以鼓勵"
宋靜淵,5,超過許多家麻辣鍋，馬辣的湯頭真的是最好的
黃奕陞,5,東西很新鮮很好吃 但動線跟空間比較狹窄 位子也偏小
陳沛瑜,3,菜色補的稍慢，像是蘑菇、茭白筍等蔬菜進貨量不足後來就沒補，讓人失望
Shih Ray,1,叫個外送 吃到頭髮 跟 鐵刷碎屑 已送水果日報
李歐Leo,3,有點退步蝦都支離破碎了，附近桌瓦斯味很重，蒼蠅跟蚊子也很多要注意一下，用餐起來不是很愉快
Joseph Tseng,3,"使用的是瓦斯爐。動線偏窄座位偏小。
美味。生意很好、餐具清潔可能不能要求太高太細。服務算好，上肉速度夠快"
詹宗憲,5,肉的品質都有在顧，每次來都點鴛鴦鍋，吃完常常滿頭汗，好舒服~
楊傑麟,1,肉等了15分鐘以上沒來，後來又再點了6樣來2樣(有提醒點餐的剛剛有點過，請幫我確認)，之後又都沒上，忙歸忙，這服務還要收服務費不行，看了一堆五星，原來是五星評論送東西。。。
Loretta Lin,2,"若是喜歡吃讓人服務的麻辣鍋店的話，公館店的馬辣就不適合。

自助去排隊夾食材需要排超久，動線不理想，走道窄，座位也很小。

服務人員態度不錯給一顆星，草莓不優但看在有煉乳的份上給一顆星。"
林柏榕,1,"集點卡兩張時間差兩小時
為何不能用
好不容易集滿
連通融一下都沒有
4點白白讓費掉
4點這次沒用就到期😡😡"
Ryan Chung,1,"一年前吃的時候非常喜歡這家店。
一年後的 2021/2/8, 12:00 與友人一起吃，遇到的服務生態度很差、每輪上肉六盤只上五盤、加湯還故意拿很高燙到我朋友的手。買最貴的套餐換來最爛的服務品質，再也不會光顧了。"
陳彥睿,5,讚喔！送北海道大帆立貝一個
Arale Chang,5,地點好，吃完後還可以逛逛公館商圈
徐子婷,5,小朋友超愛吃的，每次都把螃蟹清空，讚讚
李C.S,4,"一個月少說食用兩次，
遺憾是蝦類鮮度不足。"
William chen,1,標榜草莓吃到飽，但每次去草莓都空的沒得夾；點肉盤時，出的跟點的完全都不一樣。
胥紫晴,5,和牛嫩又鮮美 五星打卡送帆立貝
吳品萱,5,東西好吃豐富，適合朋友聚餐。
宋鈺雯,4,除了位置擁擠 ！食材都還是很不錯的 ！味道對我個人而言偏鹹了點 ！（我沒用沾醬）建議來之前先預約 ！
郭又豪,5,"帶位迅速 結帳迅速
挖冰淇淋時可以順便鍛鍊臂力
夾蔬菜時可以培養排隊的耐心
積極的幫忙加湯
可以細嚼慢嚥方便消化
唯一的缺點就是兩個小時
只送了兩次肉  可以改善"
Benjamin Kang,5,大年初一還難得找到有開的店，真是太幸福了😍
田心妤,5,每樣看起來都食指大動！👍
魚兒魚兒水中游,4,"兩間打通，中間一個小通道的動線有點危險⚠️，服務人員送熱湯時要很小心，人都走來走去，有死角。
叫的肉原本都有送來，到最後一輪時我叫了三盤肉，結果只送來一盤，後來去上廁所，回來經過前一桌剛好服務人員上肉，結果那婦人說：疑，我們沒有叫這個肉，她老公還說又沒關係就吃啊，後來，我們這桌的肉就真的沒來了，可想而知⋯🤷🏻‍♀️
（價錢方面是有分的！）
其餘就都還不錯，冰淇淋很多種，都很好吃😋拿鐵咖啡也好喝，整體還是好的，第一次是在西門町聚餐吃的，這次是第二次吃😃"
林珈卉,1,叫四盤肉等了20分鐘，叫了第三次才送上來，肚子還沒吃飽已經先吃飽了，還要收10%服務費，馬的
Jung Tsan Chang,5,兒子唸小學的時候常去吃，很久沒去了。
LING Hsu,1,馬辣 郭撥彥 就是個拉雞
張仕杰,5,非常非常好吃！一來再來就是迷上了！！
李柏嫻,5,我來馬辣吃了十次左右 ，比其他吃到飽來說已經是最好吃的
Ivy,3,雖然價格不便宜、但有多種類的海鮮跟甜點可以自己拿 ！而且說草莓吃到飽 結果今天根本就沒有草莓 （太早就沒有了吧...） 店員很親切
Davy Wang,3,假日用餐時間人非常多，肉品幾乎都是隨便上，沒辦法指定（有指定也等不到上肉，只能隨便吃了），四人桌的空間也很小。優點是冰淇淋有哈根達斯跟莫凡彼可以選，口味眾多。
雅雅鴨,5,之前吃過，食物很足，現在剛好遇到草莓季，草莓吃到飽，開心
Chen Boris,5,"食物多樣也很新鮮，
但是哈根達思的冰淇淋太硬，
應該是冰太久了，挖不起來。"
Benson5788 Sun,2,門口明明掛布條‘大湖草莓吃到飽’，進去根本沒提供草莓，只說明產量有限，這分明是廣告不實！！感覺非常差。用餐環境差，廁所又髒，應該沒下次，唯一優點就是服務生態度佳。
王佳,5,"服務親切  肉片好吃
水果有草莓很加分

宵夜聚餐的好地方"
平常心,5,"#台北市大安區
#馬辣麻辣鴛鴦鍋

蝦子新鮮，肉質不錯！
花雕雞湯頭不錯喝！
還有好吃的安格斯黑牛咖哩飯！

自助吧菜色很多樣可以選擇，
各式各樣的飲料、汽水，
多樣化的冰淇淋、甜點、水果，
還有豐富多元的醬料區！

服務人員服務周到，
來回奔波很辛苦！👍"
momo hsu,5,梨子很甜，芒果很青。這是我第五次(間)馬辣，這間店的水果真的超級敵棒，以後會成為我吃馬辣的第一選擇。
Andy Hung,5,黑牛與花雕雞都很好吃！必點！
陳兪樺,1,"重點是：吃完 ....我和友人都拉肚子....
整體都比起西門町店差太多了⋯⋯環境取餐動線差，
座位太密集，兩兩坐四人位，
隔壁那組客人要去取菜就會不慎碰到，
看別人座位下有包包置物籃，跟店員要就會有（不是每個位置都標配）
一樣的價錢去別家店環境比較好，何必去這裡擠...
不會再去的一家。"
林煜崴,5,好吃 天冷的時候吃最舒適，不僅能吃飽還可以吃好，有機會還會希望下次再來
江旻哲,5,肉很美味  無奈春節期間人潮太多 2小時只吃到兩輪肉  真的是很可惜
Chih Lin Huang,5,食材新鮮，從鍋物到甜點都不含糊喔
周亭妤,3,"服務態度不錯 有草莓
不過除了肉之外需要自取 常常大排長龍 蠻擠的
上肉速度慢 可能因為人太多了
人潮很多 桌子有點小
我是為了草莓來的"
