author_name,rating,text
Yoyo Liu,4,麵包和蛋糕都很好吃，尤其喜歡裸麥系列的產品，口感很Q，麵糰很香。咖啡（拿鐵）味道很淡，比較不推薦。門口是階梯，沒有無障礙設施，推車輪椅都沒辦法上去，有點可惜。
Selene Ko,4,蛋糕還不錯
Rolenth Wang,5,道地的德國麵包，有些外國人如果不習慣台灣的早餐店，可以嚐試德國全麥麵包
黃月梅,4,每天都會經過 吃早餐的人享受一天的時光
Isaac C. Wang,5,很推薦，在這訂了餐盒給口試委員，受到好評。
Sasha Hung,4,健康無價
Tsai Simon,5,麵包營養
中秋小姐,4,"非常有特色的烘焙店！
推薦他們家的「蛋糕」，口感跟外面的完全不一樣，非常真材實料！
點了檸檬起司、南瓜以及綜合莓果都超好吃！尤其南瓜的肉桂味剛剛好！
雖然不便宜但是真的好特別！"
Peiyun Melody Chen,4,"簡單，低油鹽
擺盤美"
徐經武,5,餐點好吃
Abbie Huang,4,想回味扭結等德式麵包與蛋糕時，就會來逛逛。
LiesegangRings里色崗斑馬紋,5,用料實在，東西好吃，服務親切。
家欣,4,優點：在到處都是台式日式麵包店的台灣來說，算是比較少見的種類，因為是德式所以麵包的口感偏硬也比較不油，如果不想吃熱量過高的麵包，這家算不錯的選擇。缺點：價格略高。
Bowen Hsueh,5,高蛋白吐司、高蛋白貝果、酸種麵包太優秀了！
Peggy Jia Pei Pan,4,有騎樓下的座位區可食用餐點，很方便需要立馬解決食物的消費者。
ChunChun Han,5,麵包點心都好吃，用料用心又實在
Linda Chen,5,蔓越莓麵包酸甜自然，巧克力麵包有嚼進軟硬適中
Godbid7e Omy,4,從前巷子裡的德式名店歐嬤烏蘇拉，般到永康街，此處應為中央廚房。早起還可看到開放廚房裡的德國師傅揉麵糰，推重巧克力蛋糕，但價格實在太高。
jh L,4,"價格偏高但德式烘焙的麵包較為特別、少見，口味也還不錯，網站更有詳細說明供參考。
遇到疑問或問題，客服人員的回應相當迅速也很積極處理。"
高小仙,4,"產品品質非常好。自己進口的麥子，全麥就是全麥，不是白麵粉加麥麩。黑麥裸麥等等真正的麵包，聞的到麵香。材料好，味道也好。加入各種天然堅果蔬果，教人垂涎。
除了麵包，我也喜歡他們的蛋糕，磅蛋糕的紮實香甜，加上一杯咖啡，最能安撫我的身心。所以即使住的遠，也常常特別繞道去買。另外還有適合麩質過敏的人可吃的蛋糕。還有不適合食用澱粉的麵包呢!很特別吧!
早餐的三明治也很棒喲!"
陳怡儒,5,蛋糕超好吃，用料實在，奶油不甜膩，非常清爽，會讓人不自覺的想一吃再吃^_^
Sydney Trains,4,很久沒去。
Roger Tsai,5,我買麵包的首選之店。正統德式麵包，還有100%全麥的選擇，對於想吃健康食物或有血糖顧慮的人是福音。有賣早餐三明治加飲料，可在騎樓桌位享用。另外司康和各式蛋糕也很優。價格小貴，但健康無價。
wang jamescz,5,很有嚼勁的麵包
林淑貞,4,很多種沙拉 非常棒喔價位 也實惠！
Jim Chen,5,黑麥麵包、酸種麵包我很喜歡。
Andrew Chen,5,有提供特殊的麵包，如: 無麩質麵包，糖尿病吃的蛋糕 .....等
YUN Shan,4,推薦 喜歡札實口感 和德國吃到的一樣!
Meng Huang,4,晚上關店前好像會買二送一（不知道確切時間）。蛋糕種類特別，不過有些吃起來兩種食材有點貌合神離
Hsiang-ming Chang,5,德國原味
SEAN OU,5,歐嬤的麵包，回烤後依舊很好吃，外皮很酥脆。
Chris Chiang,5,法式長棍很棒，原味、巧克力都好吃！
王婷,5,核桃肉桂捲真的好好吃
Jerry Wang,5,吃了很多之前沒吃過的麵包
李公明,5,餐點好吃
Eddie HSU,4,"推肉桂捲。做出來的烘焙品別具特色，相當好吃。
缺點是有些小飛蠅，讓人對餐點衛生有些擔憂。"
Michael Chang,5,好吃的德式蛋糕，與一般麵包店不同的歐式厚實風格，一吃成主顧。
W CC,4,麵包有特色
shiba eat u,4,實在hen貴，但真的全麥台灣很稀少，多數人還是願意來買單
Lee Xin Ze,4,麵包雖説沒有每樣都非常精緻，但是有特色
邱芳柔,5,Lecker! 我找德國麵包找好久了，一直很懷念，吃到的時候很開心😆
ShanShan Kung,5,餐點好吃，服務好
Jennifer H.,4,德國人開的烘焙坊，供應少見的歐式麵包，雖然價格略高，但健康好吃，值得推薦！
Chen Hsin,5,非基改的德國小麥讓人吃了安心
