author_name,rating,text
Juliana C,5,"環境裝潢設計/維持狀況都很好，沒有二手書的古早味有燈光好氣氛佳的高檔書店。好書流動率高,手腳太慢是挖不到寶的。沒事就會去晃晃。"
UbiQuiTousLy,5,挖到想買的三本書，買滿$500直接入會員。生日當月八折，然後我就沒聽清楚店員說什麼了😄～
Wen Ling Chao,3,茉莉二手書店的舊書分類很好，方便尋書，店員的服務態度也很好。
Jessica Chen,4,店員服務態度很好 買二手書還有消毒服務 超加分！ 支持二手書 但是個人覺得收購價偏低ＸＤ
周愛玉,5,價格實惠，如果有會員卡還可以再打折扣，書多為熱門暢銷書，且每本書都有整理過，不會有舊書店的灰塵味，裝潢也像新的書店一樣，看書環境舒適，店員也和藹可親，書買多了，還可以裝入質感不錯的二手紙袋，相當環保。
Li Laura,5,"整理的很好的二手書店
只是熱門二手書跑的很快，網路上查詢後沒有保留，到現場就向隅了🥲"
Ellen Hsu,5,很喜歡在這裡挖寶，總是可以找到許多心頭好，若是閒來沒事，可以來這裡晃晃，總會有收穫的。
方紹玟,5,"意外找到幾年前很想找的一本書，原本已經放棄了，沒想到還看見在架上
這個二手書數量非常多也很豐富"
YR SN,4,可惜漫畫選擇不多，其他都很好。
吳小威,4,"2021/4/5
環境好，可電腦搜尋書籍
因晚上8點，人比較少"
275jk,3,"收藏相當不少，值得去分享挖寶。
但是要能自己認知取捨會比較好！"
CW L,5,"店內壞境舒適，
且書況良好，
是個愛讀書人可以好好挖寶享受的地方！"
花椰蔡,5,"隱身在鬧區裡的地下室，空間不算太大，但保持茉莉一貫的俐落和清潔。
內有廁所，維護的相當乾淨。"
Bird Qiu,5,"賣二手書非常方便
雖然價錢沒有很好
但是因為節省時間
又能讓物品延續生命
畢竟店面經營也需要人力和租金"
Clare Gao,5,小小的地下室空間，但不會覺得悶，書都被整理的很好，找不到的書也可以詢問店員
Sylvia Wu,5,店家位於地下室，不同於傳統二手書店，這裡每本書都好好的置於書架上。店內的氛圍很溫暖安靜，也許是因為燈光配置是暖色系的。由於整理CD，因緣際會來這邊估價。店員很親切友善，很詳細說明收購的項目及價格。
Wendy Chen,5,"非常棒的二手書店，也收CD, DVD等影音作品，讓資訊有效運用！"
Cathy,4,書的種類很多，有分類，也有特價書，可以來尋寶。有洗手間。
유정,5,完美，跟其他二手書店比起來cp值很高，我常常在那買到完好無缺無筆跡的好書，我時常去尋寶，一待就不小心四小時，想上廁所也不用離開。我最近在學日語跟韓語，在那挖到幾乎全新的三本只要150元，想每天去😆。有人說去賣書跟買書的體驗差很多，我想說本來就是，經營二手書店需要很大的成本，店租人事，跟其他二手店比那麼便宜，如果什麼書都收購的話，那麼賣不出去的自行吸收 ，賠的都比賺的多了，雖然我不是生意人，但也請大家將心比心
江芷瑢,5,充滿二手書和 CD ，也有其他優惠，環境舒服，很適合挖寶的地方。還有提供廁所使用，很方便！
高宗玲,5,"很多店都收掉了 要多多支持
找到想很久的一本書 😁"
翁俊儒,5,偏人文書籍類，雜誌類分類用心。
邱珞晽,2,"三天前因為在線上查書系統看到自己正在找的某書，當天就立刻到茉莉師大店想看看書況，結果在店內尋找許久都沒找到該書，故直接麻煩店員協助。
店員找了很久後才告訴我們該書已被店內同仁保留，若同仁放棄該書會再通知我們，詢問最晚何時會通知？對方僅說會請同仁盡快決定並請我們留下聯絡電話。
這三天以來該書在線上查書系統都仍然可以找到，店員也未致電，直到剛剛自行上去查詢才發現該書已經下架，估計是被店員買走了吧。 …"
陳映霖,4,二手唱片的數量不多，少見台灣獨立音樂，少見台灣嘻哈音樂，可以買到伍佰。書籍的部分整間店都在水準之上
Amy Liang,5,書況都很不錯！ 找到想要的書，而且價格好便宜～～～
孫殿銘,5,隱身在地下室的書店，還有賣影音產品喔！可以來尋寶！
Ting-Yu Hu,5,每次去都可以發現新書 很適合來挖寶跟賣書
巧克力薯球,5,"隱身在地下的寶藏！
雖然是二手書店，但藏書都整理歸類的非常有系統，同系列同種類的都差不多放在一起不用自己摸索，而且除了書可能因年代而可能泛黃或邊角磨損之外，其他書況基本上都很好！

重點是價格很便宜！！
很多好書的價格是$69、$109⋯⋯
甚至還有一本40三本100的推銷
真的都找得到心目中的愛書

自從知道這間書店店後，很愛買好書收藏的我再也沒在新書店買過小說了👍👍

而且店員態度都很好👍
每次上台北必踩的點❤️"
May Tsai,5,超級適合挖寶的地方！！很多二手好書可以購買！！
陳姿蓓,5,二手書選項眾多，空間很舒適
張碩紘,5,書目詳細，種類眾多，特賣及會員均有折扣，十分划算，愛書人的樂園~
chemei lee,3,你可以在這裡買書或賣書；雖然在地下室但是沒有霉味，就是光線微弱
Chen Tia,5,服務人員不但幫留書 ，而且現場問書 ，還客氣的親自帶我去書架上看 ，方便讓我自己選書 ，非常受寵若驚 。結帳時候也客氣介紹他們的會員規則 ，還有特價書區 ，特價書很大一區 ，非常划算 。
Love Pure,4,服務好，環境好，書籍多元豐富。
Cing-Huei Wu (吳老師),5,"文學累書籍不少,滿500可加會員,有些優惠的書很新,剛好在師大旁邊,可以逛很久,也提供座位可以慢慢選書"
翁勤能,5,提供書籍質量豐富不遜於大型的新書店，很好逛又好買，推推
Tony Su,2,來這裡賣書，結果被嫌此類書籍庫存太多，這點真的莫名其妙，我又不在茉莉工作，怎麼會知道你們有哪些庫存，後來又被嫌書況不佳，只願意以五塊錢收購一本，可是我的書都只是自然老化的書斑而已，沒有其他刻意的污損，後來我自己網拍以十倍的價格賣出，以後不會再來這裡賣書了。原本我給茉莉五顆星，有這裡的VIP卡，但這次交易經驗實在太差，收回原有好評給差評，給兩顆星是希望茉莉繼續活著，讓我可以來免費吹冷氣，但告誡其他顧客如果是要來買（賣）書的話還是三思吧。
呂叔瑋,5,二手書價格標明、分類整齊及附有廁所~
吳嵐平,5,"最近在做居家安全大清掃，把許多不要的CD跟二手書請茉莉免費派宅配來回收，茉莉收到貨以後會電話告知估價費用，並於告知估價金額後一個星期轉帳到提供的帳戶
為家裡有許多不要的二手書而煩惱的人提供了十分方便的到府回收服務，非常推薦給也有相同問題的人"
蘇冠豪,4,購買二手書的好選擇
Lisa Win,5,店比較小一些 服務人員很親切
"Jaw 趙, Mali 樂立 (Jaw Mali)",5,無論買或賣書 氣氛文青令人自右舒適
Phoebe Lin,4,氣氛好，書便宜
bella hau,5,不錯啊，提供舊書有新的去處，有賣書需求的也可以來這邊，想買書的也可以來這邊挖寶，這個書店的理念我覺得很好！
婉貞,5,沈靜的氛圍，清楚的分門別類。再加上木質地的書櫃，及幾個木製小凳子，像是走進了另個時空。二手書經工作人員的細心整理，可安心拿取閱讀。
Cliff Kao,3,空間較台大店小，所以呈列的書籍選擇較少。
Trump Yang,5,如果要查找和購買有興趣或相關的二手書籍，這裡是很不錯的好地方，整理的很確實，且可以省下大把的時間去跳蚤市場挖書的時間。
hsin fang chang,5,童書很多，價格公道優惠
李文忠,4,古典音樂CD中，偶而可以找到罕見的品項，但現場展示空間狹窄，數量有限，空調也不清爽。
Mocow Lin,5,舊書可以賣來這裏給其他有緣人
官志城,5,第一流的書店，值得留連………………
唐唐,5,"吃飽了飯散步走走，偶然發現了這裡，這裡有不少有意思的好書，書架上信手拈來不乏我就學時期紅極一時的名著。
我是五年一班的，也就是臺灣戰後嬰兒潮浪頭上的一代，我們這一年次的人不必考國中聯考，只需要考高中丶大專聯考，但學校的繁重功課壓力讓我一直埋首在教科書丶參考書之中，沒機會抬頭環視任何課外書，直到進入大學，我才開始廣泛接觸各種書籍。 …"
蔡宇軒,5,有很多漫畫可以挑選
吳翊銘（fuhaho）,5,人文、商業、藝術類書多，也有影視唱片類
Lee思諺,5,環境很舒適，價格很公道，算是四星級的二手書店。
董承翰（HANK）,4,把舊舊的書擺設成像高級書店一樣，可以找到自己喜歡的書，也可以把自己不要的書給他們收購，讓書的價值發揮到最大
hung jack,1,"為什麼師大茉莉沒有像台中與高雄那驗線上line可詢問相關服務,卻僅提供二手書回收詢價而已?"
林書賢,2,"我先說，這是我個人觀點，我並不是這家書店的內部人員。所以以下文字僅供參考。早期這裡的書定價，大致不會像現在這麼高價。現在這裡的書，據我所知道，很多是書友免費贈送，就算賣這家書店，也沒有收取多少錢，現在還好有開發票，更早之前有一段不短時間，連發票都沒有開。
雖然現在有特價書，但是令人乍舌的是，有的書的價格高到離譜，我相信茉莉集團也是愛惜羽毛。
但是我現在更相信，嘴裏說的和行為，不一定是一致的。
我上面所說，如果有錯，敬請指正。"
燕居,4,估價很低，場地不錯
KEEP ZIV,1,"詢問書籍是否有庫存時,留電話後也久無回撥,再致電又再留電話,然後也不回撥,全台茉莉書店,要說服務態度跟人員素質,師大店真的可說最差的了"
陳易,1,"服務人員常常愛理不理外,店內角落靠近文史哲那邊常有莫名的尿騷糞管味,師大茉莉相較台大真的差好多!"
Sharon,5,"買到絕版找許久的書集
心情就像挖到寶ㄧ樣
店員態度熱誠
很開心的體驗"
Cynthia&Ralph lo,5,很好找書打發時間的地方
Joy Hsu,5,顛覆我對二手書店的想像，燈光美氣氛佳，書又真的便宜撿得到寶，是一間會讓人想在裡面駐足看書，又真正惜書愛書的書店，除了排放井然有序，選書也十分有意思，值得常來，淘寶看書兩相宜！
小何,5,捐書給家扶基金
max169cm,5,地點很好找到了很多絕版的書
楊政平,5,二手書和二手影音產品，分類詳盡，整理乾淨，定價又超優惠。
Daniel Chen,5,書籍整理良好，查詢網站找書方便
洲遊獵國,5,店員親切，內藏書豐富
YI SU,5,服務態度親切，廁所很乾淨，工讀生很可愛
Hu jj,4,蠻好的看書買書環境
Mirai Huang,5,太棒的二手書店，完全滿足精神食糧又可以省荷包呀～
徐YA,2,接聽的男生似乎精神不大好，而且很冷漠，應該要讓他好好的睡一下午睡，振奮振奮精神。5/26，1345
Hank Schrader,3,"謝謝您的回覆。但我在網路搜到那本書還有在售賣，並非絕版書，且是多位學者共同編寫，非簽名書。我後來查到此書有更新過新的版本，可能貴店的那本書是舊的版本，所以比較貴？好吧，那我可以理解了。因為此系列的書我本人從小就愛不釋手，希望好書有更多的人能閱讀到，寧願用原價買到，也不願意看到有人花更高的價錢去買二手書。可能真的是我忽略了貴店也有自己的考量。
———

有些書賣得比原價還貴。如果大家要買中國古代文學類的書（文學唐詩宋詞），建議網購買全新，這裡的標價比原價貴太多。"
Purple,4,很棒但地點很不方便附近沒有捷運
圍巾,5,久久來逛一次，收穫不少
Dino Lai,3,沒有友善的閱讀環境
Deborah Lin,5,舒適的二手書店，每次來都可以度過悠閒放鬆的時光。
Shu chin Chen,5,超級讚！不錯的二手書店哦！
林輕清,5,前幾年蠻常來這裡看書的~環境很清幽
陳澤,4,環境舒適，書籍整理的很好且不會拿起來髒髒的。
HUI HUSHE SUN,5,沈靜的氛圍，清楚的分門別類。再加上木質地的書櫃，及幾個木製小凳子，像是走進了另個時空。二手書經工作人員的細心整理，可安心拿取閱讀。
蓁宸,4,"很喜歡來這裏找書，除了看書打發外，也有廁所，很方便！這裏有童書，很適合帶小孩來找書！也有很多文學類的書，有時特價5本100元，很划算！
加入會員還有再打折！！CP值很高皂二手書店"
P.T. H,3,二手書店卻書籍不多
Agnes Chung,5,適合找書的好去處
陳婕,5,人也太多了吧！好驚訝！😱
Cheng Shuo Wei,4,"雖然在地下室比較難找到，但是空間夠大，能擺放蠻多書籍，還可以多方幾張椅子讓顧客坐下來看書。
但是櫃檯結帳小姐找零時要小心，多給不是每個客人都會退還多的部分。"
0 Momo,4,"這是間我會願意推薦給朋友的店。
這間茉莉書店地點位於地下室一樓，地理位置不難找，一樓也很清楚的標示，不怕找不到，地下室的空間不大，可是裡面的規劃非常好，總共分成三區，左右兩側都是書籍，中間是光碟唱片這類的商品，而光碟對面就是櫃檯，一共有兩個結帳台，兩位店員會同時幫忙結帳，所以不怕會需要排隊等很久。 …"
朱書漢,5,服務態度算是不錯 找書也真的很親切
Hector Wu,5,隱身在大安區還算熱鬧的街道上，狹窄的入口往地下室，稍有不注意便很容易錯過其入口。空見配置並不會顯得壅擠，還有幾張小凳子可供人坐著好好看點書。以二手書店而言，算是很不錯了。不過，感覺店員的反應不是十分靈敏，有時候有點狀況外的感覺。當天造訪對其它一切感到還相當不錯。
Katharine Ku,4,很喜歡的二手書店 常常會在這裡找到令人意外的書籍
Nancy Chuang,5,"錢沒很多，又想看很多好書。
顛覆你對二手書店的想像-寬敞、明亮、還有很舒服的椅子。"
Pei Ling Chen,5,"提供良好的二手書買賣流程
還有這個消毒機器覺得很不錯
推薦大家可以來這裡找書"
莊葦白,5,二手書購買的最佳地點，價格實惠，種類多。且很多特價的書，49一本。
g 210.1,5,乾淨 整齊 （很像誠品）而且很便宜。書也很多
Russell 羅素,4,氣氛不錯，能找到滿多想看的書，二手價入手也不心痛
李銘,5,找找舊書，看看
鄭小湘,5,是個好地方，前陣子我拿家裡一些舊的書籍去那裡賣，覺得價錢蠻合理，太舊或他們不收的書集，還能放在那裡當作捐書，覺得他們做得非常好！
設計大叔,5,非常好，服務親切，速度快。
Nâ Kun-uí (君偉),5,服務誠懇細心，書量豐富分類完善
Iris Yang,5,"氛圍好，沒有舊書店那種暗暗髒髒、空氣不佳的感覺！質感非常好，且讓二手書有個流通的管道，讓非常環保。茉莉會收購二手書，遇到太久或是時效過期的書，也可以免費幫忙處理，非常方便；不用擔心帶了一堆書又要抱著一堆書回家，這是我第一次賣書的時候最擔心的事情。

賣書因為需要一點時間鑑價，可以選擇現場等，他們會給你美食街那種，好了會震動的號碼牌，你可以優雅又無憂無慮的，看看有沒有其他合你心意的書；也可以選擇電話通知～據我所知官網上好像還有到府宅配的服務。

網路上有TAZZE的服務，但對於想一次、快速解決的愛書人來說，茉莉服務非常快！（我就是看了斷捨離才清出房間存放已久的書跟垃圾）"
Young George,4,"整體而言，大致不錯，店員也很用心。
但是電腦庫存上有的書，架子上不一定會有。
如果查了電腦再過去，有可能會失望。"
Panda Lee,4,雖然在地下室，但不會有陰暗潮濕悶熱的感覺，整體而言讓人覺得乾淨而整潔，是個相當不錯打發時間的好所在，缺點是入口稍窄一不注意就會走過頭。
SUNNY,5,空間很棒，可以靜下來挑選有興趣的書
Raymond,5,讚，物美價廉
WY Lee,5,"CP值非常非常的好
便宜
而且
品質很好很好"
lee no,5,溫暖舒適的地下室書店
M Leung,5,我以低廉價錢買了很多已絕版的學術書，感覺相當滿足，非常適合在學的大學生來尋寶。
li do,4,乾淨整潔地點佳  地下室對障礙者似有不便
Astro Duck,5,"藏書豐富, 分類清楚, 售價實惠."
高瑛婕,5,規模比較小的茉莉書店，但還是應有盡有。
蔡睿恆,4,可以用比較便宜的價錢找到之前的舊書，而且書況還不錯
JASON LIU,4,書籍種類多且店面舒適
夜氣,5,找到車上被偷的任賢齊-傷心太平洋專輯，也買到張曼娟-那些美好時光，都還很新！
peng yuchu,5,價格合宜的二手書店，書本的狀況都還不錯種類也很多，不過在地下室空氣有些悶
Poki Chen,4,很溫馨的二手書店，隨興逛逛也順手帶本不錯的書回去吧！
Pihsia Chou,4,價格親民 比台大店好太多 明明同一個老闆 訂價差很大
wonsung Lin,3,茉莉2手書店提供各式新古書，同時也提供舊書回收的服務，非常有環保的概念，讓書籍雜誌可以在閱讀流通後不想保留，還可以繼續提供給有需要的人
林向德,5,"種類挺多的
可以時不時來這挖寶!"
陳颯,5,方便又親切，還有經營得當、價格合理｡
曹嘉峰,5,優質書店，服務態度好
Natalie Liu,3,有許多二手cd.二手書種類也算齊全。
Richard Chan,4,是個人在台北尋寶的優先選擇，書籍流通快，常會發現意外的驚喜！
Bertin Chiou,5,當你想換書買書 這是個好地方
cinderella Yen,5,以二手書為主，但這裡可以挖到不少好音樂.
winhai yi,5,有書，有冷氣，有廁所。很像誠品書店的二手書店。值得逛逛，能不能買到要的書，這就要看緣分了。書價合理。
張淑華,4,地下一樓，環境整齊，書籍乾淨
吳炯慶,5,環境很棒，書也很多，而且整理的很乾淨。音樂、整潔、氛圍，一整個讓人想要多待一下。重點是書的價格真的是超級棒的，很多都是原書價的一半。推推推……
jeffrey Kao,4,靠近師範大學，朝大安森林公園的方向走，位在地下1樓的二手書店，是個具有環保意識的好場所。
許博淳,5,"二手書都像新的一樣
讀書環境很好
也有咖啡可以買，一杯30元，贊助原住民小朋友
機車算好停，汽車要找一下"
Una,5,書種類很多元
Shiang-Yu Chen,5,"可以賣二手書或cd或dvd
也可以來這裡用便宜實惠的價格入手二手書
滿好的！推薦"
溫唯嘉,5,環境整潔！
YR Chen,5,一切都很好，如果書價能再低一點點那就完美了。
驊剛,5,環境舒適，二手書多，適合在空閒時間來挖寶，店內也有書的除菌箱，也讓書感覺比較乾淨，推薦來逛逛
許凱翔,5,"地點在地下室，但是空氣流通很好，氣氛也很棒
書況也蠻不錯的，各種書都有而且書都整理得很整齊，不會讓人找書找得心煩
時常會有打折與特價，沒事可以去晃晃，如果剛好有自己想找的書就賺到了"
Ming Lee,2,1.遇見有位男士對櫃檯小姐抱怨:放這什麼爛音樂，你們老闆知道嗎？他在不在?櫃檯小姐只能頻說抱歉應對。我覺得這位男士的確是怪咖。2.選購的是二手雜誌，書套薄薄的，活動式的很容易脫下/穿回，只是想確認一下內容，被櫃檯小姐制止，說要拿去櫃檯那裡才能拆閱，書櫃上沒有任何聲明，這個制止的動作是乎不妥當，二手書提升人文的經營理念很好，但，防小人的動作，確將消費的讀客的人文/氣質/格調拉低了，這難道是茉莉書店眼中客人的素質?不到1小時，買了近900元的二手商品，我是真正要找好東西買的顧客， …
鄭景升,5,"乾淨明亮的環境,進書很快，值得一探！"
Shang-Tang Chang,5,舒適的空間，豐富有趣的展示，很值得定期去逛一下，尋找自己想看的書。
Rick Lin,5,茉莉是不買電子書的最好理由
蔡聰,5,隱身在地下一樓的書店，內部裝潢跟其他間相同，藝術書眾多，選擇性很多。
趙如嵩,5,舊書豐富，物美價廉
黃新峰,4,舊書分門別類的排列整齊，營造舒適的購物空間，而且還可席地而坐。
Shy Shari,5,店員很親切，也可以直接把舊書以捐贈的形式幫助需要的人
Yu Min Queen,5,"愛慘~可以挖到好多好書喔!!一直想看的小說四本才100~買16本都不心疼~
還看到以前大學看過的網路小說~充滿回憶啊~"
H H,5,安靜乾淨氣氛好，書很多樣，常常特價又再打折。滿五百可立即加入會員！
Tom Chang,4,不定期有買書優惠  環境乾淨明亮 舒適是一個買書的好地方
MIN-HAN YU,5,價格合宜，氣氛佳，輕切有禮，客為尊
VIP _T,4,溫馨的書店。書價合理，店員服務專業親切。
PEi PEACH,5,氣氛良好  是個值得一去再去的好地方
黃兆慶,4,都是二手的，有書、光碟、影片可以慢慢尋寶搞不好有你想要的
Tarvis Yang,5,很開心在這裡找到尋覓已久的書，保存得很完整
richard liang,1,服務態度欠佳
林Meeka,5,"乾淨舒適、書況佳、價格合理，附有化妝室
有指定要找的書可在網頁上先初步搜尋"
林約翰,5,非常好的書店，提供愛看書的人士買書的好地方。。請幫我評論按＂喜歡＂，拜託，謝謝！
林敬翔,5,安靜不受打擾
陳書浩,5,藏書豐富 氣氛佳
Wang Silvia,4,是個尋寶的好書店， 很多很棒的書。 也有化妝室， 如果牆壁上加個掛鈎會更好。
Judy L.,5,書保持得很好，氣氛佳
Jean Chow,5,中文說很多，是個尋寶的好地方， 意外的看到多本琴譜，好讚！
Shrek Tsai,4,位處地下一樓，入口處不甚明顯，需小心別錯過。店內寧靜適合閱讀，可輕鬆自在地探索豐富的藏書。
金小毛,2,同一本雜誌 定價卻不同 而且價差高達3分之1
chou-iu Chen,5,書籍眾多氣氛清幽
難在堅持,4,這是一個位在地下室的二手書店，門口沒有明顯的招牌，若是騎車或是開車容易找不到，步行較易發現，雖是在地下室的二手書店，但環境舒適一點都不輸誠品書品，除了中英日文書籍以外也有販售CD唱片，擺設簡單整齊，書籍分類完善，分類標示清楚好找，若是會員還有折價空間，價格不一定便宜，但對於收書及書的品質上算是整理的不錯，特別是一些絕版的書，或許可以來淘寶找書，絕版書、冷門書有可能能在這兒找到，但地下室空間有限，台大店較大，這兒沒什麼座位可久座，是個適合書蟲尋寶的地方，每一種書的品項有限，數量 …
黃譯萱,5,書都很乾淨，也有很多經典好看的書
Sophia Luo,5,"位在和平東路一段，國立編譯館正對面，一處店面的地下室。環境清幽，書籍分類清楚，很容易找到所要的書籍。這兒有許多二手好書，常有特惠出清，可以找到許多早年的書，尤其是我最愛的早年作家如張愛玲、廖輝真、林語堂、金庸……可以找到不同時期出版的版本。
現場整理的很乾淨，完全跳脫早年二手書店舊舊髒髒的刻板印象，非常值得逛逛，常常有機會可淘到寶。
另外，還有早期雜誌、CD，店家在書架旁幾處，也有放小椅凳，讓想要逗留久一點的書客，有被呵護的貼心感動。這書店也會到府收購二手書，幫助出清家中多餘書籍，也促進書籍流通，很值得推薦~"
Mao-Jan Lin,5,"茉莉書店，位在地下一樓的二手書店，典雅二僻靜，非常耐逛，除了中英日文書籍以外也有販售CD唱片。二手書的價格主要應該是取決於書況，如果是看起來還新新的熱門書籍可能會打7到5折，如果有點泛黃或舊舊的常常都是100元一下。若有台大、師大或者茉莉的會員還可以再減價。
如果是特別要找什麼書建議還是去一般書店，茉莉不一定有，但如果是想看不特定書籍就很推，在裡面晃晃時常可以以很便宜的價格買到不錯的書。
另外因為是二手書店，也有收購二手書籍，當然收購價並沒有很高，有些書（比如說雜誌之類的）並不收，但也是家裡藏書過多的一個選擇。"
kelly,5,"挖寶的好地方
雖是二手但是書店很用心篩選品質以及保養書況，有些書看起來跟新的一樣
不定時有特價促銷
買起來真的超划算"
黃Gin,5,價格合理，書況與環境也不錯，以後多了一個可以挖寶的地方
莊宏昌,5,滿500元就能夠當場申辦會員 服務員態度超好
roy chang,4,常來真的會碰到想要的書
蕭普元,5,很喜歡這個書店的裝潢，一進來給人很放鬆的感覺。只不過入口位置不是很明顯，我以為是在一樓店面，沒想到在地下b1，樓梯（在信義房屋）旁邊喔，書價方面大部分會落在100上下，愛書人可以來這邊走走
啟男陳,4,終於找到(稀世珍釀世界百大葡萄酒)這本書，才知道我有收藏到價值連城的酒哦！
陳明晰,5,撿到很多年輕時想買卻沒有錢買的好書。這裏的書況都不錯。
