author_name,rating,text
周子修,5,"外帶自取只要5折超划算！
即使因為疫情待在家，也有餐廳級的享受！
推推推~"
達亢,1,距上次內用已是去年一月，在貳樓也是內用多次，也常與朋友去用餐，但疫情影響改為外帶，這次餐點「酥香透抽圈」粉皮非常之厚！幾乎都是麵皮不打緊，原與家人想說好吃就算了，但麵皮根本就沒有調味，比食材還厚，「費城酒吧炸大蒜牛排」也是兩大片來沒有切，若我們不是剛好是家庭有工具，是否要用啃的呢？且平台上也沒備著說不會切，若需要且要額外備著，覺得相當不方便，肉質也是很粉，加上厚粉吃起來相當噁心，「炸蘑菇 」也是相同比食材厚很多，「馬鈴薯」油到根本不想動他，加加起來要2000多覺得這一餐吃的非常不值得
陳沂,5,"疫情期間外帶真的一點都不馬虎
包裝超級仔細又精緻
包裝上的插圖也超級可愛超級用心
內容物還是一樣好吃到不行
因為知道五折吸引非常多人訂餐
我特別感謝店內的服務人員
爆單最忙的就是他們
跟他們說了聲：你們真的辛苦了
沒想到他竟然回我：天氣那麼熱你們才辛苦了
真的是親切貼心讓人感動🥲❤️

看到網路上很多人抱怨訂不到
真的早點起床就好了
我也是一次就訂到也成功取餐
我們訂餐只是早點起床躺著訂餐真的沒什麼
服務人員態度也特別好
真的不要一直抱怨他們
貳樓也不是應該要給大家五折優惠的
大家將心比心！他們也是非常辛苦非常用心！

謝謝貳樓的用心
謝謝這些美味的餐點
非常非常辛苦你們！大家一起在家stay safe！"
YU JOU HER,1,"五折外帶兩份麵、兩碗濃湯
先不論訂餐困難、系統lag
領餐時店面前拉封鎖線，完全沒有人員指引
從外觀上根本看不出來有營業
(外面同時也有顧客徘徊，大家都不知道怎麼拿餐)
繞過封鎖，自己打開門後
才有店員姍姍走來問：誰先來的？

餐點更是慘不忍睹，內用貳樓不下十次
沒有這麼難吃過
調味失常（一碗爆鹹、一碗沒有味道）
蝦子有冷凍生味、雞肉非常乾硬
麵體更是軟爛油膩不堪
兩碗麵都只吃幾口就放棄
唯一可以的濃湯，量跟價錢一樣只有一半
（照片是完全沒動過的情況）

推行促銷活動
卻因為人力不足、胡亂料理
用糟糕的餐點品質對待消費者
這種經營理念 不敢苟同。"
Winnie Chan,5,第二次到貳樓公館店，祛除掉以前擁擠難走的印象，重新裝潢過後，走在側邊就覺得很美，安排座位時，剛好坐在二樓窗邊，從窗口邊透進來的夕陽，讓緊張心情舒緩了。菜單琳琅滿目，但最終還是選擇了低碳飲食，舒肥嫩雞花椰米，是目前為止覺得口感偏好的花椰米，搭配上歐姆蛋和處理過的菇菇，以及軟嫩不柴的雞肉，讓人回味。選擇飲料時，店員貼心詢問是否要換成無糖，覺得蠻好的。加上150元，就可以選擇三種選項，而我所選的番茄濃湯，炸蘑菇小點和甜蜜入口的金銀島布朗尼冰淇淋，味道口感都很讓人滿意。若要說是否有需 …
GADDA LIN,1,5/15 號看到貳樓有外帶半價活動，5/16 早上八點起來透過系統下訂並完成(公館店)，一直等到中午 12：00 還沒收到可取件短訊，等到 12：30 打電話至店內確認可取件時間，被告知系統當機無法釐清訂單，等回復後會再電聯通知，然後一直等到 12：50 再度打到店內，這回被告知系統剛恢復，已經開始作業，訂單快完成時會發取貨通知，再度等到 1：15 電話詢問為何一直沒收到體質簡訊，經查詢才知道簡訊系統當機所以沒發簡訊 … 一路搞到 1：28 才拿到餐點，足足慢了一個半小時。 …
張譽瀚,5,"已經去過貳樓餐廳的其它分店，但這家不太一樣，為獨棟的建築，很有自己的風格，食物一如往常的美味，生意非常好，建議先訂位
二訪：因為疫情的關係，只能夠上網訂購後取餐，也因為特價的原因，讓同仁非常的忙碌，但服務依舊是非常的好且到位，謝謝你們，辛苦了。"
梁方頻,4,3點自取我提前五分鐘拿，差不多3點到家的時候發現其實都冷掉了，薯條還軟軟的，希望貳樓有看到我的評論😭期待下次外帶的進步
Richard L,3,"培根很焦又乾這樣品質還要出餐？！和之前買的正常版完全不同,無法下嚥入口最後丟掉了,官網私訊詢問被已讀不回冷處理,一句道歉也沒有....很失望不會再訂購,折扣留給其他人吧。

更: 由一顆星改三顆,雖然處理效率不是很好,至少有誠意解決問題。"
Amanda Cheng,5,因為服務給滿分，有漏給醬料打去店裡有馬上處理，這波5折點的主餐類都不錯，甜點以5折價位給過，飲料真的不太行。
Zizi,5,"印象這家是二樓的起始店，從十多年前
就是一個排隊名店。
現在有訂位 系統後位通知，非常方便
帶位員工，控場能力很好，親切美麗

麵包非常好吃，搭配焦糖奶油👍🏻
奶昔，非常多的奶油"
Jared Tseng,5,"公館貳樓一直都是我們家的最愛，但前陣子停業了超級久，不知道為什麼最近又重新開幕了，重新裝潢之後位子感覺變少了但整個變得很亮！

但依舊是熟悉貳樓的味道！

以往有重要的日子或是朋友聚會，我的第一首選都是貳樓，除了離家近外，東西種類品項都是我愛吃的！

貳樓同時也是寵物友善餐廳，想要帶著毛小孩一起來用餐也沒問題，還記得以前皮皮在的時候都還會帶他來貳樓！

但從去年夏天後，他們的菜單整個大換新，以前愛吃的那些燉飯跟漢堡好像都不見了

多了很多種跟東坡肉相關的品項....感覺有點奇特！

所以重新開幕後，喬碩媽的生日我們一定要回到最熟悉的貳樓！"
陳紓嫺,5,"真的大愛5折的貳樓！！好吃又划算！！
這兩個禮拜來吃了好多次😍"
Nina Shu,5,"因為去的時間是週一早上10點，所以不需排隊，也不會擁擠。入口處也是有放疫動作（量體溫+手噴酒精）。
整體環境非常乾淨，而且服務人員態度非常好且親切！
餐點口味也不錯，這次點早午餐吃的非常飽也很滿足！
推薦給大家！"
許翰民,5,晚間櫃檯小姐非常親切有禮，打電話詢問外帶時耐心說明活動今日已經暫停，還是親切招呼我們能夠安心內用非常貼心，防疫期間外出用餐難免害怕，謝謝「天使」的暖心和微笑接待，期待疫情結束再度光臨公館店。
李立軒,1,"1. 大肆對外宣傳疫情期間外帶半價，但沒說每日每店限量(且量很少)
2. 外帶自取僅接受線上點餐，不能電話點餐
3. 線上點餐系統設計與穩定性待加強"
崴崴,5,"順利的訂到5折餐！
感謝貳樓在嚴峻的疫情下
還帶給我們家這麼好吃的餐點
（雖然我冒雨前往
現場的人員辛苦了
看到他們努力的做餐點跟打包
心中滿是感謝的吃下午餐🥲"
Yi-ting Huang,4,意式連鎖餐飲品牌的優等生，打開菜單餐點樣樣熱量破表但就是吃了很開心，造訪過的各分店服務水準一致(一秒讓人以為在Fridays)，套餐分為+60選1種和+150選3種配餐，可跨濃湯/炸物/飲料/甜點自由選，項目雖多單邏輯清楚讓客人選擇不會吃力，人員訓練很專業，從點餐時我們這一大桌每位的餐點都記得清楚，麵包和多種飲料都續杯過還分去冰/少冰不同，及最後打包服務一應迅速回應滿足，低消每人$100(120cm以上)，人均價約$400-$550(看是否點套餐)。
wen an,1,"傻眼⋯⋯請問早午餐的牛奶外帶本來就這麼少嗎？而且這已經是最小外帶杯尺寸了耶（相當於一般小杯超商咖啡）還只裝這麽少！三口就喝完了吧👎👎👎👎👎

我一回家打開就傻眼到爆。我發誓我沒有灑出來也沒有先偷喝幾口，這個品質我真的非常非常非常生氣及失望。"
陳月霞,5,整體用餐氣氛和環境不錯，空間寬敞清潔，工作人員態度親切有禮貌。週六、日早上8點就開始營業，有提供早午餐，可以選擇果汁牛奶外，還外加一杯咖啡或茶類，都可以無限續杯，如果選擇其他餐點，可以60元銅板價搭配餐，有麵包可以無限供應，一人點用，同桌都可享用💞，還有炸物、飲品、甜點等等配餐可以選，如果超過3項，只需150元。主餐選擇性多，除了早午餐外，還有義大利麵、漢堡、排餐，CP值都很高，本人特別推薦用餐氣氛，可以放鬆悠然用餐。
CChung,4,"MEAL scale：4.1🌟

餐點：低碳-舒肥嫩雞奶油花椰飯（值得推薦）
價位：380元
低消100元
用餐時間限時120分鐘
加一成服務費

—————評分細節—————
餐點美味（M, meal）🥘
😍餐點口味是否適中？離店前餐點有無食用完畢？
✅食材、份量、烹飪手法是否符合應有之收費價格？
✅店家料理食物之熟度是否恰當？
——舒肥雞肉可，如果能再多汁點就更好了
✅店家料理及運送食物之衛生是否兼顧？
✅餐點內容物是否與菜單相符而無其他異物（如頭髮、昆蟲等）？ …"
Shelley F,5,"服務非常好，用餐環境舒適、氛圍愉悅，很適合聚餐
(店員很親切、熱情，讓我發自內心地覺得: 在這裡用餐真好，對外帶客人也一樣)

【早午餐】
紐奧良煎魚排班尼蛋：炒菇、魚排、水波蛋都是放在馬芬麵包上，一起入口，喜歡這樣的層次，調味適中，搭配起來不會過鹹或油膩。魚排有兩塊，每塊比水波蛋小一點。很喜歡在水波蛋上面加了一層起司的作法，畫龍點睛 (起司味可以中和5分熟生蛋的味道，不喜歡生蛋的人應該也可以嘗試)。有些店家的水波蛋調味偏酸，貳樓的則沒有，看個人喜好。ps. …"
Ellen Chen,1,"幹真的是爛死了欸🙃一大早就被浪費一堆時間

拜託要辦活動也有誠意一點好不好？官網寫的文情並茂超好聽，但是系統爛的要死，爛到不知道要怎麼形容比較貼切欸⋯⋯

衷心建議沒那個能力就不要隨便辦活動，否則出那麼多包只是在破壞自身品牌形象。

啊然後不要回覆我的留言，因為我不想收到你們回覆的通知，點進來又看到千篇一律的說詞，這樣會更不爽謝謝。

打到這裡覺得更氣了，怎麼沒有零顆星可以打啊？給一顆我都嫌太多啦幹！"
Chiung. Ta Chen,1,你們現在只能提供線上外帶自取的服務，但我昨天準時6:00上線系統就當機，上面顯示已滿線要等10分鐘，10分鐘過後進去了點完餐點又卡在計算價錢一直卡一直卡一直卡一直卡一直卡這時候已經6:30了還是進不去，更改任何時間取餐都還是卡在計算價錢哪裡！！！想請問一下如果你們沒辦法負荷這樣的點餐量就不要提供這樣的優惠誤導客人，現場又不提供外帶線上訂餐又進不去，到底優惠五折是什麼意思？！真的不懂？！
mi mi,4,"費城酒吧大蒜牛排💰650❤️❤️❤️❤️🤍
為菜單推薦菜色！
10oz牛排份量很足夠，肉質嫩不過老，炸衣也表現不錯，紹興奶酒醬與洋蔥的搭配增加了一點層次，薯條也是熱的，還不錯吃，較可惜是炸蒜仁不知是油炸溫度不足還是了放一陣子的關係？覺得不合胃口，而花椰菜調味不錯，但是有種冷凍的感覺

滋滋炸布朗尼❤️❤️❤️❤️.5
共有6塊布朗尼，是道特別的餐點，炸衣一樣表現不錯，內層就是布朗尼的甜味，鹹甜交錯，有點類似炸甜甜圈、炸湯圓的風格，可以嚐鮮 …"
李佳琳,2,終於進到結帳畫面所有資料都填完了，卻在結帳後說要重新點餐，重新用後又不給人結帳，然後跑了10分鐘後直接說不能訂了。一大早起床訂餐卻是這個系統品質，真的很不爽。雖然東西很好吃，但是系統品質需要加強。
Peter Hsu,1,"6點準時進去，結果等了40分鐘，然後說訂單已滿....
重點不是沒搶到，而是要等40分鐘才知道沒搶到，真的讓人火大⋯⋯
建議換個方式讓人一開始就知道有沒有搶到，而不是讓人在那邊等半天"
柔柔咖,4,"假日無法事先電話訂位，必須到現場候位，即使在很冷的天氣現場人依然超多，雖然有兩層樓的座位還是等了超過半小時才有位子。

有很多帶狗來用餐的人，要安排帶狗的人座位在隔壁之前店員都會先來問是否介意，服務相當周到。

餐點選擇很多也滿有創意的，飯、麵、漢堡和各式點心都有，有豐盛的餐點也有比較健康的套餐可以選。我們點的都是比較正常的餐點，點到的東西都滿好吃的，餐點的價位跟公館附近一直整修搬家的那間右手餐廳差不多。"
張智皓,1,爛的要死，看到新聞說外帶五折，也特別打電話確認到現場外帶一律五折，結果特別跑到現場才說不接受現場點餐，只能透過外送平台點餐，然後平台價格保持原價，不肯賣特價的餐點就直接說，不用特別出這種爛招把客人騙到現場，這輩子不會再光顧。
chuchu,1,"剛剛打電話確認外帶五折優惠
電話裡也沒有告知訂單很多已不接受現場訂單
來到現場說因為訂單多
只接受熊貓跟ubereat 點餐
不接受現場訂單
上網看ubereat是原價沒打折
讓人直接聯想不接受現場單是因為要給五折優惠
而且在電話中為什麼不能告知？"
黄家溱,5,"外帶自取優惠5折一定要在inline app訂餐
外帶自取優惠5折一定要在inline app訂餐
外帶自取優惠5折一定要在inline app訂餐

不知道新聞是怎樣報的@@才會有好幾樓抱怨現場不能五折，第一次吃貳樓是這一次五折外帶，平常價格真的昂貴。
不過不得不稱讚店內防疫真的非常優秀，外帶取餐有專門人員服務，開車取餐人員會將餐點送到車上，外帶餐盒包裝也都非常優秀！"
Aubree Lam,5,疫情期間。感謝貳樓的用心讓我們依舊可以吃到美食。外帶一樣美味 擺盤一樣美觀好拍照。👍
Nina W,4,"與三年未見的朋友約會，挑選了一間我一直都很想吃的餐館，大約一點半的時候到並候位，大概10分鐘不到就有位子了！

-
🍲主餐

✨法式丹麥佐海鮮水波 / 390 + 39元 服務費
生菜沙拉配上胡麻醬整體來講口感清爽，吃起來健健康康的的！馬鈴薯、洋蔥、花枝、蛤蜊、香菇炒醬汁，吃起來相當有口感，配上上面的水波蛋以及起司醬，好吃到痛哭流涕(T⌓T)！！！！
法式吐司配上蜂蜜反而普普通通，但畢竟他不是主角〜(꒪꒳꒪)〜

✨低碳 - 舒肥嫩雞奶油花椰菜飯 / 380 + 38元 …"
wan hi,3,"環境：1、2樓各有一間廁所，樓梯很亮，一上樓會先看到一面有書、相框、小物...等裝飾的木格子牆。

價格：2 人，均消 $424（1成服務費）。

時間：2 h

心得：
點了一份商業午餐（總匯三明治）跟 低碳-舒肥雞花椰飯，還加點炸蘑菇。
商業午餐的組合比一般點餐便宜 $80。
低碳的餐點在同一頁菜單上有註明可選2杯飲料，但，店員解釋因為要控制碳水份量只能選1杯無糖的無限續杯飲料，可是續杯又可以換有糖的... …"
Min,1,"最近推出外帶的優惠活動 但很明顯商家並沒有做好準備
昨天第一天已造成很多混亂，今天承諾會改善，結果也很糟
從3:45等到5:22才進去點餐頁面，結果好不容易進去，卻發現每個時段都滿了...
無法處理系統訂餐的不便，也不會提前在臉書專頁等地方即時公佈已經無法取餐的時段以及分店
讓消費者白等了這麼久 真的很希望可以改進
打去反應 但是服務人員的態度也不是很好 可以了解你們最近可能接到了很多類似的反應電話所以心情上不佳 但也請想到貳樓此類性質的餐廳本就以服務還有餐點並重
希望能多體諒一下消費者等了很久卻無法訂購到後失落的心情 好調整服務態度"
cncn cncn,4,"什麼都蠻美的餐廳....
裝潢、擺盤、服務沒話說👍
但餐點稱不上好吃
像是沙拉的酪梨是冰凍的
炸雞也像炸好冰過在放沙拉上
前菜馬鈴薯像油泡的含油，培根也不夠鹹香的去陪襯
鮮蝦意大利麵奶油香和蝦味很巧妙的抵銷了...
倒是那兩位蝦還蠻大蠻Q彈的
以目前客單價來說，這樣的餐點表現太貴了⋯⋯
喝喝飲料聊聊天還可以"
vivian Guo,4,"和朋友臨時起意，沒有訂位，很幸運的不需候位。點了墨魚麵和濕答答，另各加$150擇3樣小點，麵包和飲料可續。就今日所點的食物來說，大至普普一般。但是個人覺得麵包好吃，尤其是麵包的沾醬是亮點～順滑帶點黑糖味，非常好吃！
*服務人員親切有禮貌，隨桌附的檸檬水好喝^_^"
丹2丹2,2,"點了一個餐，兩杯奶昔，兩份甜點

💛一顆給餐點cp值高又美味
💛一顆給店內寵物友善空間

結果甜點最先上來，再來是飲品，最後主餐。

店員只問飲料要不要先出，並未詢問甜點
主餐吃得差不多時，發現生菜上有一隻蟲
詢問店員後，店員問要不要幫我們重做一份
我們說吃不下，才改成打9折

殊不知帳單一送來，只有主餐單品項打9折
原價$290變成$261
但餐點原本收一成服務費還是照算

餐點總計$941卻收$97服務費

#店員並未告知單品項打折
一般店都是總價打折

臨走前麻煩店員幫忙打包吃不完的甜點
結果拿到時卻是180度大翻車
整個起司醬都壓在底下...."
盧姿君,5,今天去外帶～打五折優惠，cp值很高，服務生很親切，東西好吃，讚讚讚～只有唯一缺點就是很難訂～哈
Ashley Chang,4,"2021.04.06 Tue.
🍝香爆椒麻唐揚雞細扁麵 $330
我今天點不調整辣度的，吃起來麻麻辣辣的
如果不是很敢吃辣的話，建議調整辣度～
肉滿大塊的！
🍲暖暖濃湯-火腿玉米 +$60
濃湯真的很濃～很好喝！

🌾服務員很親切！
🪵可以刷卡、可以使用載具
🌵有一、二樓
🐚平日11:30去就滿多人的～一樓都坐滿了！

+10%服務費"
卜卜波蘿,5,"碳烤牛排奶油花椰飯 480 🌕🌕🌕🌗
花椰飯就是白花椰菜，雖然叫飯，不過不管怎麼吃都是白花椰菜～胡椒調味很重，滿滿胡椒味。
牛肉有5oz，肉質軟嫩順口，但我吃完一分飽足感普通

白雪葡萄優格沙沙 160 🌕🌕🌕🌕🌕
這個好好喝啊～下面優格上面冰沙，裡面還有銀耳，葡萄味很舒服，上面一朵小花看了心情大好

ps.友人有點麵包盤，配上咖啡奶油不膩口，好吃！"
Hathaway _h,5,"整修之後外觀很漂亮，裡面的用餐環境也很舒適。
麵包可以一直續，剛烤好的麵包很好吃口感外酥內軟，但其實餐點蠻大份的最後也沒肚子可以塞麵包了哈哈，店員服務超好，整體來說很適合朋友聚餐，用餐環境舒適之外，也可以吃很飽，餐點也很美味。"
Rachel,5,疫情期間很有系統的，線上訂餐，取餐，且時間很準確，謝謝外帶5折
Lee Lina,4,"服務貼心，食物好吃。
但店內桌距很近，不是很自在。店內音樂太大聲，跟面前的人講話要特別大聲才行。"
李祖賢,5,"很久沒吃貳樓了 今天點的兩個套餐都很好吃
飲料可以續杯很棒
但續杯的那杯的不銹鋼杯有很重的金屬味
第一杯沒有
但服務和餐點和環境都很棒還是推"
黃國維,5,"用餐限時兩小時，基本上時間夠用。
建議用餐都提早預約。

品項多樣、美味。
適合三五好友聚餐。"
Summer,5,裝潢後第一次來用餐，但變動不大，菜單及套餐都改變，還好餐點還是一樣美味，但感覺量少價錢也比較貴😅
張庭瑋,4,貳樓吃過三家分店以上了，這間已經整修很久終於在2020年底開張~食物品質差不多，今天吃的曙光汁鮮蝦細扁麵調味不錯，但不知怎的花椰菜超級硬！
王曉鳳,4,"第一次來這餐廳軆驗一下，整體的消費感受還可以，只是在價格上可能沒能常來，哈哈！畢竟，這樣的裝潢與地段再加上超多的員工，是得要消費者支付的。
但，付的10%服務費並沒有實質上的感受到備受禮遇，三個帶位阿姐全在門口接待台聊的不亦樂乎。所以給店家的五顆星中，我收回了一顆。"
張雅芳,3,"舒適用餐環境
人員服務周到
餐點味道都不錯
餐點價位高

二人用餐點主食390+150的餐點
在+服務費594元
店員告知還是要在➕100元低消
不懂是怎樣計價方式

不會在光顧了"
Ember Chuang,5,"貳樓公館店休息了好一陣子，整修重新開業後第一次前來，依然好吃且選擇多元，整體環境舒適氣氛佳且店員專業、親切，是聚餐的好選擇。

其實從外觀就可以看出貳樓公館這次復出下了許多功夫，原有的外觀全打掉重做，內部座位佈置也很用心。

餐點的選擇很多元，前菜沙拉、早午餐、炸雞披薩、排餐、義大利麵飯等，想得到的洋食餐點幾乎都有。我與朋友們都是早午餐的愛好者，每人各點了一份早午餐，沒有點飯或麵等，吃到最後很飽，因為份量很多。 …"
Eun Ten,4,拿鐵咖啡、水果茶還不錯，甜點180元起，韓式炸雞稍微硬一點，淋在上面的辣醬好吃唷！可惜沒有下午茶方案！！
T Y,5,"用餐時間兩小時，有特別說明
魚類要特別說要熟，不要半熟的。"
shane Hung,5,第一次點了低碳餐盤 想不到非常好吃 而且還可以吃很飽 非常美味
魏柏宣,5,餐點味道整體來說很好吃，舒肥雞胸多汁而軟嫩，麵包外酥而內軟，炒蛋綿密而順口，咖啡可以免費續杯，坐著聊天是很好的選擇，最棒的是這家的水果汁，讓我記憶點很深刻，整體價位稍高，但份量多好吃，下次會再次回訪～
Ting Chang,5,服務人員態度很好，記得幾個月前去其它分店，有服務態度也很好，打狗霸 TAKAO 1972 德立莊店真的應該要和貳樓學一下🤭，義大利麵還是一樣好吃，麵的份量很足夠，很適合用餐聊天，給予5星評價。
Snow C,5,"貳樓一直都是我最喜愛的餐廳，尤其公館店。

重新裝潢後質感更加，地理位置很好不是在最熱鬧的地方，店內採光真的讓人感覺到很舒適，服務態度更不用說～

餐點上幾乎沒有雷，而且還會換菜單，不用擔心吃膩，價格上雖然不是便宜的價位，但CP值絕對夠，因為份量十足，對於我來說，貳樓絕對是我三不五時與朋友相聚，甚至想要吃早午餐時絕對會是首選，可以是屬於一人的早餐，也可以是與朋友的下午茶，也是情侶約會的晚餐。"
王裕翔,5,舒肥雞很好吃、東坡肉的漢堡很讓人驚艷、三明治裡面蛋熟的恰到好處😃
嘉,3,"魚是好吃的，但牛排卻粉粉木木的口感，不知道是反復冰凍、退冰？還是不新鮮，甚至有點酸腐的味道，生菜也焉兒了、軟軟的，這似乎不應該是貳樓會出現的水平？

服務仍然是非常好的，這點沒變。"
IMSUESUEಇ,5,"還以為這邊幾年前拆掉後
公館就沒有貳樓了
聽朋友說貳樓回到原址
就決定來這邊聚餐
套餐搭配的濃湯很好喝👍🏻
粉紅色的很吸睛
我點了波隆那xxx飯忘記名字😂
好像算蔬食類的
吃起來口味比朋友們點的更清淡些
裡頭充滿著蔬菜🥬
我覺得蠻健康蠻棒的😋
份量算多大家都吃超飽
麵包鬆軟好吃👍🏻
同桌共享也可以再續
只是附贈的抹醬吃不習慣
很像咖啡口味（？
倒是麵包沾濃湯味道很棒😂😂
然後就是最讓大家驚艷的甜點
完全忘記名稱的珍珠冰淇淋布蕾🍮
超！級！美！味！
服務小姐說是新品❤️❤️
真的是爆好吃的～雖然很甜🤪🤪"
蘇博宇,5,"每次來拜訪大概都是間隔2-3年吧~但是用餐體驗確實越來越好，菜單也不斷更新，永遠吃不膩
硬要說缺點只有侯位時間比較長。要忍耐一下而已"
Tina Li,5,"餐點選擇多樣、很難決定！
早午餐的份量很足夠、服務也很棒！"
徨唯羯,4,"第一次蒞臨「貳樓」餐廳，此餐廳採取手機QR牌號制，當時排還有15組系統預估95分鐘，實際排大約30分鐘就排到位子。

均單價約300-350，另外有套餐+60元與+150元。在這邊特別推薦加購歐式麵包，一人加點全桌都能無限加點。麵包盤的部分圓麵包有濃郁香料味非常推薦，而沾醬應該是焦糖奶油，塗抹在麵包上十分可口。

主菜我點了香腸海鮮飯，個人覺得還算是及格的海鮮飯，味道不錯，就配料稍嫌弱了些，尤其花椰菜應該再切小一點，不過份量十足，很適合分著食用。 …"
Miki Hsieh,5,"一直都很喜歡的餐廳
寵物友善
好一陣子沒有來（因為菜單吃的有點膩）

沒想到今天來已經換成全新的菜單
進入了選擇障礙

很喜歡無限喝到飽的飲料（雖然也不會喝超多，但整體感受是非常舒服的）

牛排是超軟嫩的，魚肉也很新鮮
（希望菜量可以再多一些）
整體還是非常棒

一位綁馬尾捲髮的小女生Angel服務100分 雖然戴著口罩，但您可以感受到滿滿的服務 滿滿的笑容

謝謝你們帶給我一個開心的午後

棒棒的午餐

下次會再訪"
