author_name,rating,text
Anna Wu,1,"第一，成人區:你們的滑水道非常不安全 我一個165cm,40kg的高中生溜滑道竟然在中間溜不下去只能全程用跑的 結果被溜下來的人踢到背部 衝擊力大還好沒事 管理員也沒在管!讓上面的溜下來
~ 滑水道弄安全再開門吧!~
第二，主要是給小孩玩的 入口不明確 票種也不明確 上次跟同學去
買成兒童區票
後來買學生票竟然要200 覺得裡面東西少空間不大 真的值得200嗎？
覺得孩子進去會沒事出來嗎？"
Cora Liao,5,水上運動 有兒童遊樂設施
Mario Chang,1,滑水道設計不好 池子不夠深 一不小心很容易受傷
weichen kao,5,現在打卡送好看毛巾哦
趙炳堯,1,"戶外水樂園設施有建議
U型海盜船水道設計似乎有問題
起降重力加速度太強
容易使後頸受傷
首先，水道上頭雖有警示標語
乘坐著下巴要收緊
然而，實際乘坐時，由於水道近乎垂直
快速下降後，馬上攀升
這是，脖子在沒有依靠、依託下
非常容易因為重大力矩而受傷
重點是，即使你想用力收下巴避免頭往後仰
而壓迫後頸部
問題那力道之強，大人都難以承受
更別說小孩，頸部更是脆弱

敝人玩前是一對小朋友在玩
記得那時小朋友滑下水道時
頭部也是被力道拉向後仰
工作人員還拼命大喊
頭別後仰！頭別後仰！ …"
richard liu,1,"3月SPY水池水很冷,加溫氣壞掉也不修理,SPY沖水壞掉很多年也不修理
6月13日冰水池是溫水,7月15日SPY池8個底下往上衝的只有3個可以用"
林約翰,4,有健身房、户外游泳池、温水室內游泳池、SPA等運動設施。在公舘自來水博物舘旁邊，交通方便，收費中等價位。。請幫我評論按＂喜歡＂，拜託，謝謝！
王榮光,3,戶外水髒，門票偏貴，沒什麼設施，漂漂河 一點也不漂漂，去過一次就好
戀雪炎,3,"大人300小朋友150
台北市精華地區
腹地小所以能夠玩樂的設施也偏少
個人認為需改進以下幾點
1.很多人未戴泳帽遊玩，頭髮四處飛揚實在有點無法接受，也沒看到工作人員宣導
2.池內的水，除了飄飄池是涼的其餘都是熱的，是否沒有一直進水循環，感覺就像泡在一個溫熱的大浴缸
3.一樓入口大廳一直到樓下更衣室，全程室內空氣非常不通風很悶熱
4.禁帶外食，館內飲食有限，且露天販賣區還賣酒是否有點忽略安全性
如能改善會更好"
羅森,3,"兒童水樂園家室內設施票大概450
是可以溜小孩一整天的地方
兒童池跟室內設施還算不錯
漂漂池深受孩子喜愛(清潔可以在加油一點更好)
早上玩水，中午吃飽後帶去室內玩耍
是平日去的，室內設施可能人少空調沒有開很強，有點悶，假日人多起來應該不會...
有些設施看起來有些缺少維護跟加強清潔
例如說:
沙坑有些雜草看起來沒在整理
女廁有些暗跟味道
室內設施遊戲間玩具很多，可能牆壁潮濕，有些地方有些微滴水(或是漏水
不是那麼新，有潔癖的父母可能不會喜歡 ，整體而言可以接受
票價490有些價位，我可能考慮小人國(同樣價格但是設施比較有維護)
但是以台北市可以放小孩去處，可以偶爾來玩玩
靠山難免有蚊子跟小黑蚊，有被叮一點，自備防蚊液就OK"
邱淑月,1,看到電視播出，天氣熱了，自來水公園玩水人潮熱鬧滾滾，忍不住就跑來看看，預定順便拍攝洛德城堡的照片，前一陣子，因冬季時節，城堡沒有營業，沒拍成，這陣子，熱成這樣，一定開門營業了，果然，營業了，在外面拍了幾張游泳人潮戲水情形，就進館看看，沒想到有很大的健身中心，運動的人還不算多，可能季節才開始，遊泳課及健身課程還沒進入狀況，裡面設備還算齊全，有無障礙電梯及廁所，也有露台餐廳，備有健身中心的服務台及平日進來游泳的收費台，當然游泳池必需的設備也一應俱全。
陳佳,5,"分為室內跟室外的活動空間
去的時候剛剛好是晴天☀️室外有飄飄河，有溜滑梯！覺得真的非常好玩！
在去過之後一個禮拜，發生了性侵的新聞
只能告誡所有帶小孩前往的父母們
到哪裡都要跟著自己的孩子
千萬不要讓他們單獨行動
水上活動畢竟有點危險性
再來，壞人無所不在！
做好安全措施防護，就會很好玩的！"
林一源,3,運動好去處，但設施有待加強
taki taki,5,很棒的水上親子樂園
氧氣台大公館國際酒店式公寓（S&J 氧氣台大公館國際酒店式公寓）,5,非常好的健身房 輕鬆自在 的運動
Chris Secret,5,健身房器材還ok，整體環境不錯！
Grace Chan,2,網頁見到仲有兒童遊樂設施同埋室外有一個大滑梯都冇開。食品只得地下小賣部沒有餐廳。 室外只得一個好寬闊嘅大滑梯適合所有年齡另外高嗰個滑梯唔記得係十歲以上或係高度限制 所以我仔七歲冇得玩 。 沙池完全似一個廢墟可以唔使去玩 。 室內spa 有年齡限制幼童不以去。儲物櫃每次上鎖要20元。所以一次過攞曬需要用品才上鎖。
Nannan Wang,2,很棒的玩水地方！但地方標示不明確，完全沒有路標指示，停車要找路走一大段路才找到， 玩水處都有救身員很好，但漂漂河沒有，很替他們擔心～ 有設置親子洗澡更衣室很貼心！很好的地方！但設備有點髒，地方也規劃的很雜亂，很可惜～～希望能多多進步改善！加油！
minyi chin,5,最棒的運動空間！
許宏誠（Kaz）,4,有SPA與游泳池，也有戶外的滑水道設施，平常人多需排隊。暑假玩了一次就中流感，衛生可能需加強
S.Y. Liang,5,地方很大，有戶外及室內，不玩水也有遊戲區，一票到底，帶小朋友去非常適合。
詹雁翔,3,近公館捷運站，交通方便。有滑水道、漂漂河、戲水池，適合12歲以下小孩！大人票300元、學生票200元，夏天遛小孩玩水很經濟，所以也別對設施抱太大期待！
Lingyu Lo,4,小孩遊樂的好空間。單一票價可以玩一整天算划算。可惜去的時候天氣不好下雨，戶外的電動車沒有開放。室內也有幼幼版的電動車（才兩台），但是服務人員並沒有一個明確的機制安排每位小朋友可以開多久，造成有小孩一直開著車不肯離開，我小孩只能眼巴巴一直看著別人開，直到我去和服務人員反應，其中一人才去和巴著車不放的小孩溝通請他讓位。服務客氣但沒有效率。
沈名寬,5,響應我們台灣人的號召!對於修辱台灣的人我們沒有必要讓他在台灣享受，我支持該員工阻擋CJ不給他進入設施的舉動，希望我有機會也能去洛德城堡玩玩~~~~
李國蘭,5,超喜歡這邊
香瑩,3,"樓梯有高低差，走下來時跌倒腳扭傷。
租借游泳圈時沒說12歲以上很多不能玩...那租那個要幹嘛，12以上只能玩漂漂河？"
Han Shen,4,設施沒全部開放，5歲150元，3歲75元，但是台北市區能玩水的地方也不多了，還可以
吳旻倢,3,遊樂設施有點少，還有時間開放限制，早去沒辦法全部玩到，飄飄河的游泳圈還要額外租
Ning Chin,3,"樓上露臺餐廳，美式餐點CP值還不錯，可以看球賽、免費租借撞球、桌遊還有PS2，感覺很適合學生聚餐，但是不知道是否因為是主打水上樂園和兒童遊樂園，餐廳人潮很少！
相對餐廳，兒童遊樂園部分CP值就很差，很不推薦，小孩一個人就要450，大人要陪入場還要加100，雖然不限時間，但小孩體力以及父母耐心有限，通常2個小時就很久了，相較現在很多類似的室內遊樂園，太貴！"
胡博淳,5,支持這位老闆，趕走 CJ ( CJayride ) 希望別的店家也別做他的生意。
戴家芸,1,洛德城堡是個非常道地商業賺錢的地方。門票不親民。要進入到裡面的人要自帶所有裝備。基本的泳衣帽。還包括毛巾跟吹風機。裡頭是有毛巾租借，有吹風機但卻是需投幣的使用。連個脫水機都沒有的戲水城。
iChun Tseng,4,"戶外幼兒區的溜滑梯設施樓梯有破損，既然幼兒要收75元門票，設施應該注意和加強，避免幼兒或人員發生意外。

以上建議，謝謝。"
Koofy image,3,以前叫水悟空，算是台北市裡最近可以玩到很多水上設施的地方，也有室內泳池烤箱等等，票價還算可以接受，門前有機車停車位，汽車旁有停車場
William Meng,1,櫃台服務差 管理爛 室內泳池溫泉池壞掉超過一個月沒好，其他水療大約一半壞掉不管，此是與自來水場bot合作，最近還發生小孩被性侵上電視，時間有偷竊，政府單位應該嚴查取消合作。
郭雨涵,3,設施多樣化，有室內室外游泳池及滑水道及SPA水療池，空間大，只是服務人員服務極差。
秦馬克,3,"露台餐廳在三樓，空間很大，有撞球/Xbox體感/桌遊可以消磨時間。適合朋友聚會與親子同樂，餐點不錯吃。
缺點: 集哺乳室環境衛生太差，根本不敢使用。不知道是不是水上樂園的關係造成超級潮濕的空間。"
lita Pan,5,離市區近交通方便玩水的好地方，員工又能保護遊客的安全……大推
杜偉漢,4,單次入場100元。人不多。是個健身的好地方，可惜健身完不能洗澡。購買月票或季票才能洗澡跟使用其他設施
乓董,4,喜歡在泳池開趴的氣氛
劉晏辰,4,重訓室人不會太多器材選擇也不馬虎，如果有戰繩和壺鈴的選擇或許會更好，單次消費的價格合理，如果要認真練習的話，是不錯的選擇。
SHIH I LEE Lee,1,"5/16 下午2:30左右 地下室女子淋浴間有男生侵入，管理人員完全沒有介入處理。
女生來這裡只能靠自己注意安全。"
小潔林,5,"夏天消暑玩水好去處，但我們拒絕CJ色狗出現
店家嚴正拒絕CJ色狗進入，這樣的舉動需要表揚與讚揚，無限期支持洛德城堡。"
Memory Aleon,5,"這裡的員工跟主管是非常不錯的
他們維護了台灣人的尊嚴
拒絕真正有種族歧視的白人CJ入場"
陳上正,4,很好玩是很好玩～幾乎所有設備都有～spa泳池三溫暖都有～可是我覺得更衣室太暗～如果不是假日去～會怕怕
鍾振銘,3,夏天帶老婆小孩在台北市玩水的好去處，（如果沒有去外縣市或風景區的行程的話）
Derek Yang,5,"我們歡迎各種人種來玩
但是不歡迎貶低消費台灣人的王八cj

就是要有這種有guts 的老闆"
蘇乞兒頹廢,5,"光員工阻擋EZ進館 跟阻止他在騎樓偷拍妹 就挺啦
還有橘男員工超帥的啦"
Roger Lo,3,水樂園的玩水項目(設施)還不差，不過更衣室(盥洗室)的環境還要加強、地上積水(排水)狀況不佳！
甘蔗綠,5,不要臉的低等外國人抹黑造謠，做賊喊抓賊，被打臉就上網討拍，白癡腦粉不明是非、灌水負評，滾回你的國家啦！欠檢舉。
黃立成,5,"看到報導，不得不給分！！超讚的做法~~
超級支持趕走CJ，如果放他進去不僅危害其他消費者更污染水質，改天如果有去台北必定去玩~😁😁😁推推推~~！！！"
Yen fu Lin,5,感謝主管以及當天請CJ離開的工作人員，不給五顆星對不起自己
Kenny Huang,5,健身房人少 沒有搶器材問題 收費相當便宜 健身房cp值超高
Alan Kuo,4,泳池很好玩，水質也很不錯，唯一缺點是廁所稍微有點不乾淨。
Yuzuka Wang,5,注重品質好業者，我們需要健康游水環境，不需要情色無恥老外污染
周業維,5,我們台灣人不是歧視，我們是強勢，我們能夠善待、熱情 不代表就是好欺負，支持店家！
忍者不行死,5,主管、🍊衣男站出來⋯你們太👍了！ /挺
Jao Andy,5,第一次來，還不錯，戲水區救生員人數足，給人池內戲水時有安全感，公共環境非常好，整體非常好。
王斯民,5,"為遊客隱私把關，不讓垃圾cj老外進來
支持五星。注重客人隱私給推"
黃遙,5,"因應館長！
在此路過評分五星！
我給橘衣員工一個讚。"
廖秀珍,5,乾淨又寬敞的健身房 器材夠你用。游泳池 噴水按摩區也很棒喔～很喜歡😁😁😁
陳奕安,5,錢可以再賺、尊嚴不容踐踏，我雖沒去過，但支持你們的做為！
Jhang Cheng,5,感謝你們維護遊客們的隱私與安全，不讓狗進入為什麼不能給10顆星？
北科大-吳季庭,5,這裡好玩，再加上看到你們的不歡迎CJ的片段，只能給5星了
寶寶兔,5,"CJ別再混了快滾回國吧
其他白人都不歧視就只歧視你，爽沒"
P H,5,"支持本店店員及經營者

大家不要相信廢物洋男的小圈圈按的一顆星！
人太噁心被驅逐、禁止進入，玻璃心碎了跑來洗一顆星幫QQ"
蕭玉珠,1,設施超爛，，大人300元太貴，，，台東老爺酒店的泳池設施都比這好
Leonardo Dicapio,5,看到報導，驅趕CJ是對的行為，我們台灣全體人民支持驅逐CJ.
