author_name,rating,text
王皇文,3,"紅殼類的生物 讚

綠葉類的植物 讚

服務員與廁所 讚

地下室， 稍嫌潮濕，燈光不足，相當昏暗。你若中暑想吃冰，還得上後去盛（可呼喚那遠處的服務生，但他們內心將因無意的重複而癱軟）

最後是消費者，建議兩人以上同行，並請帶上影子。"
SE Dear,5,來吃過很多次，食材也很新鮮
余友德,2,工作人員動作迅速但環境髒亂
王Baby,5,真的很好吃！服務超讚！
湯伯虎,5,肉品種類多樣，火鍋料海鮮蔬菜也十分齊全，還有超級多種冰淇淋可以吃。但是辣辣的
潘淑華,5,"馬辣真的是好吃，生日聚會 好友相聚的好餐廳
食材新鮮豐富 服務親切 價錢合理👍👍👍"
荒野亂鬥-潘及好看,5,價錢合理 永遠吃不膩的吃到飽
anny yu,5,高cp值吃到飽～～～～推推推！！
曾晨威,5,好吃草莓就是棒，肉蝦螃蟹吃到飽
Jonathan Chu,4,經典火鍋吃到飽，好吃cp值又高
Mas Tsai,2,這大概吃過最沒氣氛的下午茶套餐，限制又多，座位又是混座，旁邊鄰座火鍋味陣陣飛過來，吃蛋糕還混雜肉香，喝咖啡好像喝開水，還不如去IKEA下午茶99元喝到飽，又有氣氛.
Linda Wang,5,寵物友善超棒，對待流浪動物也很有愛心，值得推薦的店家！食物也豐富好吃！
張育瑄,5,環境乾淨 食材新鮮 菜色肉品多樣
bumi young,5,平價好吃，料的種類多，服務也很好
KAKA ACA,3,Haagen-Dazs有16種口味可選擇，但是不太好挖；另外還有莫凡彼冰淇淋，食材選擇還好，不算多元，汽水有可樂跟雪碧，飲料有綠茶、可爾必思等選擇
黃毓庭,3,"草莓真的不錯
唯一不行的是服務態度，非常差"
ABBY阿肥ABBY阿肥,4,"座位稍擠
動線不良，ㄧ堆人擠在拿菜區
東西蠻不錯👍"
Tom Peng,4,料多供貨充足，但是同樣馬辣各店家菜色略有差異，公館除了設備空間較舊小，其實栒當不錯，人潮排隊也是多，建議提前預定
王曉彤,5,"好吃平價
值得一來再來"
佳諭李,5,"馬辣好好吃嗚嗚
評論送帆立貝"
Yuhan Ho,5,服務好又好吃😛
林柏瑋,5,好好吃～～～那個牛舌在我嘴巴裡彈跳嗚嗚☺️
-Cafe racer Max.C,4,好幾年沒來吃了，牛肉依然吃到爽吃到翻......但吃太多好膩.....已陣亡，年紀不年輕了，吃得有限
吳逸韡,1,下午茶寫14:00到17:00，16點多來只能吃到五點，有夠瞎寫也不會寫清楚，那是不是我午餐時間15:00來只能吃到16:00不然就算晚餐時段了
cafe hsu,5,CP相當高的吃到飽，肉質鮮美。值得到訪
江芯如,5,東西多 都很不怕吃膩
tallmantk007,5,好吃料豐富還有雞南佛
Lin Lin,1,"湯鍋點麻辣跟酸菜湯
結果送來不是酸菜湯
有枸杞跟紅棗的湯....
服務人員說：你們點的是酸菜鍋嗎？
（我們非常確定點酸菜）
服務人員竟然沒有把湯鍋拿回去
只是回去廚房拿了一碗酸菜倒進這個有紅棗枸杞的湯.........

靠近櫃檯的位置非常爛
4人位
排兩個人兩個人
位置很擠
靠近牆的人根本不方便出來拿餐
要出來外面的人一定要起來讓

女服務生都有來巡加湯服務態度很好
但後來跟另一位服務生加點
加點的肉都沒有送.....

用餐經驗不好"
yakisobaj,5,蝦子🦐、台灣豬🐷好吃😋，服務也親切！
洪誌勇,5,食材多，服務也不錯，座位稍嫌擁擠
李慧青,5,"許久沒吃了
昨日再度回味
但是感覺麻辣湯頭好像變了
沒有以前濃郁"
李哲維,5,服務很好  環境也很華麗與乾淨 湯底也很好喝
郭貞吟,5,超級好吃 CP值超高：）
Adwaze Aric,4,停車稍微不方便，食材還蠻新鮮，肉片有小牌子告知總類，蔬菜和海鮮總類不少，奶酪和芒果不錯吃。以吃到飽來說還算不錯。 咖哩牛肉有別於一般滷肉飯，相當不錯吃。
許雅婷,5,現在有草莓季可以草莓吃到飽
吳育樺,5,"服務人員態度良好，服務也很周到！
知道和牛上桌速度比較慢，就會請廚房幫客人趕一下，很貼心！
有機會會再訪❤️"
Chelsea Li,5,最喜歡到這間馬辣！服務親切有效率！
mos a,1,六人桌要塞八人，有夠不舒服
陳廷威,5,來吃超過十年了，好吃好吃
魯牛男,5,東西選擇多   服務很好  值得推薦
李祖源,5,天冷來吃麻辣最對味
Athena,1,有客人未戴口罩邊盛冰邊講話，店員完全無制止，有夠沒衛生
Pellaeon Chi,4,肉質普通 冰淇淋很硬
周秉逸,3,剛用完餐感覺服務態度不是很好 用餐到一半才離桌拿一下甜點而已 掛著襄理名牌的服務人員在收我的桌 西瓜皮垃圾全往鍋裡到 看到人回來當下也沒道歉 轉身離開換成拿帳單來？急著趕人走的態度感覺很糟
Jenchien Huang,5,服務很好，上肉的速度也很快，冰淇淋種類很多，哈根達斯好吃，莫凡彼的檸檬和芒果口味好吃，湯頭部份也都Ｏｋ，肉品切得很薄，好入囗！
英式點心餅,1,好吃，不過公館店質感需要加強，我看很多人都評價反應了一樣的問題，不知道真的有心要經營嗎?
ChingYu Liu,5,好吃 推花雕雞鍋
陳冠源,4,肉品上的速度夠快有誠意
劉涵均,5,評論有送帆立貝～好吃！
春日野いのり,5,"首先，要先給予馬辣公館的新同仁，陳威達服務生，一個肯定。很高興有這麼一天可以在用餐時特別記住服務生的名字，他是一位很認真巡場與提供客人良好用餐體驗(主動加湯、收盤等)的服務生，這也顯示了貴店的員工訓練是良好而有效的，請繼續保持。
另外，食材的部分，以吃到飽來說有不少特別的食材，豐富多元的食材實著令我驚艷。
最後，整體面來說服務生的素質是好的，除了陳先生以外的同仁也都有積極提供服務——無論他們是新人還是儲幹或是幹部"
shao-en Huang,3,甜點不太好吃之外，其他的正常發揮，因此給予三分
Alex Huang,4,食材水準中上。牛肉只有牛小排、梅花牛和安格斯黑牛三種可以。滷牛肚不錯！牛筋和肥腸也還可以。餃類比一般大廠牌的好一些。絲瓜甜，娃娃菜、高麗菜、杏鮑菇等蔬菜類都新鮮。咖啡普通，但拿鐵太甜似乎加了奶精。生啤酒也還可以接受，至少沒有稀釋到太淡。
林白白,5,奶茶好好喝 肉質軟軟嫩嫩不會硬
邱子瑄,5,服務人員都很親切，尤其陳姿佑服務員🥰
Bruce Chen,1,東西不新鮮 是怎樣 有味道了快不行的食材 水沖一沖硬要放到架上？ 當客人都白癡吃不出來？ 其他人我是不知道 但至少我不是白癡
郝智潔,5,CP值超高的吃到飽！沒有其他！
milaier yu,5,給星領北海道大帆立貝囉
蘇嘉怡,5,服務好 食材新鮮  又好吃
賴賴,5,人很多 很好吃 要先訂位
古阿舅,5,來台北公館必吃的火鍋，麻辣火鍋最棒了
Ming-Fang Weng,5,時段客滿，人多拿取食材動線明顯不夠好。麻辣湯頭夠味。香瓜品質一流。白蝦，草蝦大小不一致。進口牛肉肉質沒得挑剃，吃過後可能就會覺得平價涮涮鍋的牛肉根本不是牛肉。我們生日禮，選了和牛（另一是紅蝦），但沒有太多的驚艷。
Grace Wu,5,離峰時間來用餐，覺得舒適，食材新鮮，親切服務
Julia Chou,5,"感覺店家很棒，有認真經營，水果類很驚豔，都選用當地好吃食材，補肉補食材也蠻快的，服務人員一看到空盤就過來補湯收盤的，好吃的店家

110／4／27今天又來吃，一樣沒讓我失望，東西好吃服務也很到位，我不小心自己燙到，第一時間服務人員陳沛辰（希望沒打錯名字）馬上為我拿冰塊冷敷餐具重置，謝謝他，也讓我用餐愉快的餐廳"
林尚吟,5,草莓吃到飽活動真的很爽
ken ken,5,服務非常好，店員辛苦，謝謝
陳囷澳,5,草莓季吃到飽，食材好吃新鮮
卡卡,3,位子動線規劃的不是很好. 多人聚餐 進出不大方便.
戴小瑩,1,馬辣我吃十年了都吃不膩，近期去發現它的麻辣湯底換配方，加了豆瓣醬味道超怪。拜託~還我以前的馬辣
Ying Yi,4,食材不錯新鮮，但是網站上看有果汁現場是沒有看到，因為還有很多飲料甜點一下就忘了沒果汁這件事，牛肉好吃一連點了好幾盤。是星期一晚餐用餐，現場沒有客滿，但是時間一到店員馬上提醒，有點趕人的感覺。
lin Lin,1,小馬辣個人鍋...懂吃的我給0分，根本不像馬辣的湯，麵完全沒味道，還出現稀飯會有的脆筍...鴨血都是八角味，整個尬電浪費💰。
joanne chang,5,環境好，服務態度佳，食物也很讚！
廖俊銘,5,好吃，推薦草莓季必來
mimi chou,2,常常去吃，也已經吃了大約有十年左右。對於店家的食材一直維持還可以，但是今天去吃卻吃到大腸頭有臭味，導致整個火鍋湯底都是臭味.無法吃下去，希望店家之後能夠改進.
陳建安,4,食材豐富新鮮，麻辣鍋夠味，冰淇淋好吃。
楊淑婷,5,價格實在，菜色優惠，謝謝店員
Sunny Chan,1,"曾經在西門吃過新馬辣覺得非常滿意，所以想說吃吃看同品牌的平價版，個人覺得體驗起來感覺相差非常多，完全建議加一點錢去吃新馬辣。

空間狹小擁擠，有壓迫感，取餐也要等很久；食材方面，蝦類本有提供草蝦及白蝦兩種，但草蝦補很慢，都是空盤，整場下來只有取到兩隻，其餘海鮮腥味也頗重。
主打水果有荔枝，結果荔枝吃起來不是很新鮮，甜度有但口感很怪，感覺很像反覆冷凍、解凍過。

整體而言，覺得以平日午餐的價位來說，個人覺得......不推，但口味及感覺因人而異，僅提供參考，不過就是有人請我我應該也不會想再去吃了。"
YenTseng大姸看宅看命理,5,草莓吃到飽，很讚！
Nish,5,麻辣湯底也不至於太辣，年糕好吃，肉質也好，冰淇淋好吃
黃東尼,5,Cp值非常高，在台北的大學生不可能沒吃過，是一群朋友想吃麻辣鍋的首選，肉類種類多且不馬虎，冰淇淋還是哈根達茲，值得一吃！
Ching Chen,4,"料蠻多的 選擇蠻多的
還不錯吃"
陳孝武,5,好吃，常常都來，寵物友善，讚
五加一,5,東西很豐富，服務態度佳！
許文瑋,1,服務人員服務很差 餐飲業服務這麼差 當月壽星生日說了也沒什麼東西。裝做說了跟沒說ㄧ樣 這間麻辣服務真的差。
andy,5,好吃湯頭鹹度適中服務良好
小乖,5,這家馬辣除了肉品，其他是自助式的方式，感覺吃起來更自在。服務都有到位。
陳安晴,5,環境很好 服務人員很輕切 食材很新鮮
Chen David,5,全家都喜歡來這裡用餐
小翊,5,全家都喜歡來這裏用餐
Nanako shen,5,全家都喜歡來這裡用餐
Gary Chiang,5,"好吃！
食材都很新鮮 真材實料
海鮮 肉品 火鍋料 種類都很豐富"
Amigo Wu,1,"今天的鍋底真的無比清淡
麻辣+花雕雞
是稀釋後上桌嗎？
麻辣顏色而已
花雕雞更不用說清水➕枸杞灑點酒嗎？"
寬心,1,拿調味醬料時隔壁一個弟弟，邊拿沙茶醬邊咳嗽也不帶口罩，店家都沒用隔板隔離生鮮食物，調味區，整家店衛生堪慮，疫情還沒消失，以後和家人不敢來了……
林柏宇,5,食材新鮮服務態度非常的好
Chin Wei Liu,5,😋超好吃，來好多次了。
Someone C,4,草莓季又開始了、另外蝦子也很新鮮大隻、和牛還可以
洪惠美,5,因為可以用振興券，實在很划算，尤其是我閨蜜跟小孩及我自己都愛吃他們的湯頭及新鮮食材，當月生日訂餐還有送頂級食材二選一，真棒
Ting J,5,食材新鮮，服務用心，五星好評
Linda,3,"服務態度好
但是食物的品質有待加強
肉夾起來都碎掉
很多菜都沒有即時補充"
Hsien Chi hui,5,座位較擁擠，服務很好，菜色豐富只是取餐位太小，造成大家都擠成一堆，湯頭讚、肉品優、食材豐盛，很值得來吃
Mirror Shih,4,門口放了個水盆，要給狗狗喝水的，覺得很有愛，服務也很不錯
莊鎔岱,5,第一次來 很好吃 以後會常來
芯如江,5,東西非常多都不怕客人吃
徐豐勝,5,送餐快，菜色豐富新鮮
Chiuもも,5,"補菜上肉快速，但草蝦很難取得～
座位稍擠，座裡面很難出去"
林將將,1,"因為去信義馬辣感覺不錯來公館吃看看
沒想到這裡服務態度差就算了
走道位置都很小，建議不要帶小孩來
走道那麼小拿東西真的很麻煩也很危險
地上高麗菜掉了也不撿起來，是不怕客人滑倒嗎？
服務人員加湯跟送餐服務也非常的慢！"
