author_name,rating,text
AAM AAM,5,"打開心胸，放鬆身體，覺知呼吸，用心去看

一切原本即是圓滿，只要100%投入實踐🙏🏼"
Emma WANG,5,"近視二十幾年，意外得知「眼睛瑜伽」時，十分好奇～很疑惑視力真的可以改善進步嗎！？

第一次參加團體課兩三個小時後，驚奇地體驗到視力模糊的情況有所轉變，開始學會放鬆的觀看，也看得更清晰了。當下覺得很感動，十分感謝Marx因自身近視而遠赴印度將Amar Eye Yoga帶回台灣，以自身生命的轉機來分享、協助視力需要改善的人。 …"
林宥璁,5,很棒，值得來一試
張宛茜Rosa,5,原來，視力是可以恢復的，系統化的訓練完整又有看的到效果的效率，就算是拆解出的小方法也是受用，眼睛明亮又健康，視野變得更加清晰，每次來都有進步，這是立即可以感受的到的。確實是用眼過度的現代人一個方便法門。
Dolphnisss Blue,5,很有趣！幾次下來感覺眼睛變明亮而且不會痠痠～很舒服！
歐費,5,學習到許多眼部保養知識，很實用！
YiHsien Lin,5,學習到很多眼部運動的方法。
Matthias Dilger,5,"(由 Google 提供翻譯) 很棒的經驗，強烈推薦

(原始評論)
Great experience, highly recommended"
軒綸劉,5,
