author_name,rating,text
GoddardLiu,4,書很便宜，一般可以輕易買到七折或七五折，但老闆對女生較好，男女同行請派女生去結帳。老闆很愛聊天，是優點也是缺點，由於是股東身份所以喜歡推銷智庫文化的書。較明顯的缺點是老闆政治立場鮮明，談起相關話題會較偏激。
Phiphy Lin,4,如果你是愛書人，和老闆交流必定收益良多。但對怕生的人來說可能就有點負擔了……
卡道因,1,老闆大小眼，都看人給折扣，看好像會買比較多的就一直推薦聊天，也不管後面大排長龍，多買也只給7折75折，特別跑去弄那麼久，也沒比網路書店便宜。自稱全國最便宜，水準書局卻不如店名有水準。
螺絲釘,5,"現金折扣很多! 還可以現場喊書價,不介意的話.書會被老闆蓋章喔"
"Chia-Yen Chang,",5,購書便宜，老闆喜歡推薦書，另有優惠^^
HCA HCA,5,老闆猛爆
jyhsam chen,5,書價折扣最優惠
陳家楨,5,獨立書店愛店
JopheiY,3,不再是全國最便宜的書局，折扣落在75折左右。藏書不豐，老闆娘說話不客氣。
陳亮宇,5,超便宜書店，而且商管和文學類書選的很不錯
Kelly Cheng,4,"買書超便宜，大部份都7折起。
老闆熱愛日本文學，可以請他推薦這方面的書籍。"
Michael Huang,5,台北有名書店，現金折扣很多，文史書很多，老闆很有趣，一定要來看看買幾本書！
Yuwen Li,1,老闆超級盧(沒水準哈哈)
Sky Ting,5,價格實惠，要找書訂書直接問老闆最快
Hector Wu,4,老闆很會唬爛！都說是賠錢賣書給你。
王亭方,4,書很便宜，不過老闆會在書上蓋藏書章
陳冠宇,5,可以在這裡買到便宜實用的書籍
William Tsau,4,書很便宜，但找書不易。
艾明璋,5,新買了兩本有 羅馬 英標的日文書
Ann Yang,2,超級渴，找不到地方買飲料，很慘
Chieh Chien,5,"老闆很健談,書會打折,書種偏文史哲"
K K,3,多數書算便宜，老闆常會替客人打很多折。。不過女士優先，買一送一之類的
Tzu-Shih Shih,5,"老闆十分有趣 這本算你六折
這本不看會後悔
這本看了你一年內沒去日本玩 我送妳機票"
B Chiu,5,很便宜，第一次來買書發現打了快七折，書上沒有標價，老闆看一眼原價就會給出整數了，很隨性 😊
Violet 00,5,老闆很好聊，人很好，打到快五折，會再回購的好書局！
C.W. Chen (老王),4,老闆很有個性，很會推銷你不知道什麼時候看的書
Kuo Yaoming,5,老闆人很好笑，小小書局展現了無限的溫馨！
翁振民,5,老闆話很多！！！
Michelle Chen,5,好多好多的書可看，也感覺得到店家嗜書成癖
陳顥,1,態度超差
游主靈,5,我以無法用言語來說這家店的好了~
