author_name,rating,text
sandy,4,"除了檸檬果萊姆很像感冒糖漿淡淡的
除了空氣很悶很不舒服之外
在此扣一分

另外來講餐點：
今天第一次來點上的是
低碳舒肥奶油雞肉花椰菜飯
吃得出來食材很新鮮，
舒肥雞胸肉很軟嫩很厲害👍
花椰菜飯代替主食令人覺得不可思議的好吃雖然外觀看起來不怎麼好看
但在意飲食習慣的人確實是不錯的選擇喔！
麵包還可以免費續
餐點很豐盛
吃的出來店家很用心
吃得出來真材實料
菜單設計的很像雜誌書籍
服務態度：
服務人員訓練得很好
服務人員會一直過來問你麵包要不要在續
會讓人覺得麵包超划算覺得賺到了
會讓人之後一直想念這家店會不斷的來這消費
服務人員還會關心今天的餐點還習慣嗎。
覺得很加分
最後結帳離開還會送客"
REY目黑二七,5,"義大利麵比我第一次吃的味道還要來的好吃很多，餐包也十分美味，推薦
位子很大也很舒適"
oakley Lee,4,"知名連鎖餐食咖啡店，都不錯，假如平日想吃點好吃的不知道怎麼選擇，可以來這。
顆星
口味：    4
環境：    4.5
價格：    3
服務：    4
平均：    4"
GG Chang,5,"全新裝潢、環境舒適，餐點水準維持一慣優異。晚上也能吃早午餐～！
建議非尖峰時刻來，假日也可以不用預約馬上有位置。（下午4點左右）"
Teresa Lee,4,"重新裝潢之後環境舒適，服務也很好
唯一美中不足的是食物的品質不是很穩定
有時吃青醬扁麵偏乾，有時候醬汁又很多"
路盛德,5,"美味的食物+親切的店員=無與倫比的體驗
防疫加油！台灣加油！"
Yu-Chun Tsai,2,終於重新開幕，換了新菜單，結論是非常失望。今天因為慶生去吃，4年前的今天是在仁愛店吃的，回顧照片，壽星招待的蛋糕居然長的一模一樣XD 平常個人用餐是在師大店，可能上次用餐還是舊菜單，沒感覺到這麼糟糕@@ 今天11個人點的東西，品項不相同，最終口味卻好像吃了一樣的東西？！感覺貳樓退步很多，東西炸的比例偏高，口味上也偏重偏鹹了。服務人員盡心盡力，但餐點部分只能說請多加油了，畢竟價位也比以前高，感覺沒能跟上預期中的水準
Miao-Hua Shih,4,三明治約會千萬不要點，會吃的很狼狽～
Mimmy Lu,5,超級美味好吃的餐點，每次去貳樓都有回家的感覺，每次都想像要是那是我家該有多好，這次貳樓真的裝潢太久太久太久了，然後這次回來全部都漲價一整輪。。。嗚嗚嗚，可是還是好好吃，好吧！就吃吧！
朱燕明,4,餐點還不錯，服務也還可以，朋友聚餐的好地方
Ching Hao Chao,5,"帶了全家老小上從93到2歲，到之前自己吃的感覺很好的貳樓，感謝壯碩帶位人員幫忙協調讓我們可以併在一桌（週末沒有訂位）慶祝長輩生日

1. 餐點好吃份量夠
2. 年長到幼童都有適合的餐點
3. 附近有水源停車場，稍微走走就到，吃完也可散散步
4. 餐點辣度等可調整，需跟服務人員講

當天雖有一個麵稍辣
整體服務員的態度、餐點都是很好的體驗"
羅Bryan,5,"餐點口味偏重，份量大，吃的很爽但也較容易膩，吃不完，看到剩餘餐點打包的人很多；服務人員親切，但可能餐廳較大或是服務人員人數不足所以需要服務時會找不到人，或許可以設置服務鈴減少客人等待時間所引起的不悅，參考
消費餐點：法式丹麥海鮮水波蛋，碳烤牛波蘿"
Sup Eric,2,"你們聖誕甜點的餅乾底是烤過嗎
有苦味是什麼意思
上面的蛋糕體味道也不三不四
甜點0分
爛炸
兩顆星給服務人員和聖誕濃湯"
Hu Anny,5,"公館店過了豪～久豪久才重新開幕
餐點和服務態度還是一樣令人滿意"
西卡潔,4,東西蠻好吃的，中午套餐有附飲料，覺得很划得來
Huang Huang,5,好吃 氣氛好 不過坐位間距有點近
Hs T,4,菜色多樣，可帶寵物是加分的點，但口味偏重，反而掩蓋了食材的味道，口味沒有層次
老翔,4,"訂位了，到現場卻公告暫停營業，也沒額外通知，臉書也沒有消息

11/11更新
臉書粉專聯絡後，有收到回覆，說願意補償，並感到抱歉，有感受到誠意。所以改為四星"
Penguin Tsai,5,聚餐聊天好場所，飲料可續杯，假日人潮多需要提早排隊，無法訂位
謝秉芳,5,它的餐雖不是很便宜，但很好吃，人員服務也很好，有熱情，人真的有多，不算安靜的場所；這是公館店重新裝潢後，第一次再回來光顧，點了一個傳統海鮮總匯三明治，不過有一個切片的邊邊魚肉不是像煮熟的是白色，而是肉色，所以也不知是不是剛好沒炸熟，範圍沒有很大，且因為我敢吃生魚片，所以就還是有享用完，只是心中一直有疑點而已^^
CF Kao,4,"口味跟服務跟其他分店沒有太大差別
不過來吃過幾次感覺品質不太穩定>..<"
李家奇,5,"重新開幕的貳樓餐廳，原本對父親而言是一間不會特別吃的餐廳。因為家庭聚餐，感受到了貳樓餐廳的溫暖，家父特別推薦服務員「Angel」的服務態度，雖然依規定戴著口罩，但完全可以感受到笑容及給予人舒服的歡迎感。完全不做作也由內心給予的關懷。

讓我們感受到了整體貳樓餐廳的服務素質又提升了更多，感謝「Angel」及貳樓餐廳給予我們愉快的午餐時光。💪💪

這是由一位父親請兒子轉達想要給予「Angel」的鼓勵。

謝謝貳樓餐廳"
evin k,4,"戴帽子的女服務生到底有什麼好不爽的?
你站在對面講話 音量又這麼小講零卡可樂
誰聽的懂啊"
謝一升,4,服務好，飲品續杯沒在怕的，食物也好吃~就是價位偏高了些，不太能常來，算是奢侈的享受！
chichih kao,5,絕對要事先訂位，餐點很豐富
winston winston,5,好吃，服務生親切，
許鬼鬼,3,還不錯，服務生很可愛，餐點中上，價格中上
顏昱正,5,紅茶好好喝，不知道是什麼牌子的。下次還要再去續杯。
Ching Han Lin,5,久違重開餐點還是好吃
張家瑞,4,店內氣氛很好，食物份量很夠，廁所很乾淨！
Peter Chu,5,服務態度太棒了。餐點不賴！
僑儀蕭,5,好吃，人員服務親切，貼紙在門口掉了還會出來幫忙撿，很感動。
徐優俊,5,服務人員整理收盤迅速，餐點美味可口，攜帶寵物先告知，免費提供毛小孩炒蛋
Henry Lin,4,適合青年學生聚餐的地方，價格適中、食物不錯、服務也佳。
黃柏清,5,服務很好、食物很驚艷，可以攜帶寵物。
沈大為,4,麻辣鍋湯頭好，料理新鮮，免費冰淇淋好吃又可外帶。
龍凱莉,5,雖然要排很久，但是真的很好吃
BAO,5,"環境不錯，菜色很多樣化，價格稍嫌貴。
女孩可能會吃不完，不用點太多。"
陳欣怡,5,"沒看過這麼超級寵物友善的地方
竟然還有寵物早餐"
湯發凱Tang Fa-kai,4,服務與餐點都好吃，用餐區也令人愉快；只是貳樓比起從前，也相對提高些價位了吧~
施怡,5,好吃～～適合聚餐😆
Rufus Hsieh,3,低碳套餐值得嚐試，熱美式免費續杯，廁所乾淨！
Kao Melisa,5,服務態度超級好 飲料還可以續杯 超讚😄😄😄 下次一定會再來
老丁,4,"現場等的客人相當多，還好有先預約
餐點偏重口味，服務人員態度良好，檸檬水只有檸檬片沒有檸檬味"
Jenny Liao,5,店員人很好，都會主動關心口味是否還習慣，服務態度佳！
lan sun,5,菜單更新後早午餐較不油膩，吃的到食物本身的香味和香料的提香，很值得一吃！
Charlotte Yeh,4,菜式多樣 薯條和chips都超好吃
瓦拉克Valac,5,調味重，好吃，但價格稍高。
Wind Numen,5,"餐點種類多樣，份量也不少，套餐連一般大男生都可吃的很飽，CP值高。
相當熱門，需提早定位。
推薦: 鹹香杏鮑菇山苦瓜寬麵、挪威鮭魚奶油飯"
鍾小湘,5,"謝謝現場親切的服務人員～
生日當天貳樓會送一個小蛋糕唷！非常貼心～"
owerd H,5,他們服務態度很好雖然上菜很慢，但是店員的態度與天使般的面孔有加分。店員真的是整家店最重要的角色之一。店員Angel Jolin真的服務很好
Li阿水,4,餐點雖是年輕人的口味，確也老少咸宜。
Joe Joechiboo,5,"11月重新開幕的貳樓公館店，
很幸運地入場沒有排到隊
空間寬敞，東西好吃
是一家寵物友善的餐廳"
陳姵樺,5,店面裝潢很棒   服務態度非常好，食物好吃
nai hsin chiang,5,"櫃檯跟二樓的服務人員態度都很好很親切～～
特別是Vicky(⁎⁍̴̛ᴗ⁍̴̛⁎)肉醬麵也很好吃！"
沉汁晃任紮nickchen,4,第一次造訪。環境明亮舒適適合朋友小聚談天。餐點風味中上，格子薯餅有點炸過頭希望改進，第二杯飲料續杯時可以換飲料感覺貼心。
arthur pao,4,人氣很旺的餐聽，食物料理位中西合併！還算不錯
黃彥慈,3,餐具不是很乾淨，環境也沒有以前好
陳芃竹,3,菜單越變越貴，但食物品質卻沒有提升，覺得稍嫌可惜
張志豪,3,"服務客氣，很有人味，唯一希望改進是訂位確認，店家跟我們確認三次電話，每次都記錯時間又改時間，有點困擾。
餐點上已經是第三次吃，都有一定水準，品質和價錢符合，願意推薦"
Allen Hsu,1,被收桌的服務人員手肘撞到後腦，建議檢討相關動線維護安全
黃郁珊,4,以前cp值比較高，菜單改後價位也變高，但東西好吃😋
Wang Andy,5,重新開幕的貳樓公館店裝潢優雅，餐點非常好吃多樣，用餐氣氛很棒！
Ben Lin,2,去吃了商業午餐pizza跟南洋飯， 就只吃了一半就吃不下去了， 味道不怎麼樣， 性價比實在不高
chiwei ma,5,甜點變少了，有點可惜，期待聖代能重回菜單
LIANG,4,餐點不錯吃，服務也很好，只是每次都要等座位，常常客滿😂😂😂套餐飲料還可以一直續杯，冰奶茶好喝，冰咖啡個人感覺就soso.
Clement Kuo,5,東西美味份量十足，推一個
KO-WEI TSENG,5,食物份量充足美味：推薦吃早午餐，非常豐盛多元，裝潢好氣氛佳，對得起這個價格！
Tsu-yun Ho,5,餐點再進化，懷念的好味道重回公館。
Tiffany Hsu,5,"對寵物真的很友善
餐點也很好吃
雖然顧著狗狗沒機會拍食物但是真的很棒"
蔡耀瑨,1,沒很好吃又超貴，還要收一層服務費，價位大概300、400開始起跳
vivien Wang,4,餐點還不錯，可是換了菜單後選擇性變少了，餐廳的位子也稍嫌擁擠
Hanlin Liu,5,好吃~老店新開，口袋名單
David Cheng,5,菜色略有不同，不過依然很美味
元梃,5,用餐環境比師大店好很多！
黃久權,5,服務親切熱情有心規規矩矩好溝通好吃好暖心
陸如容,5,公館貳樓餐點意外好吃，以後會常約家人、朋友來聚餐！
An,4,不錯的聚餐地點，菜單選擇豐富，早午餐系列以外的套餐要加130可能會花到五百元
劉秋彤,5,早午餐餐飲多樣很不錯！
有希ゆき,5,"服務很好👍有收10%服務費
份量很足很飽🤤 CP值很高💕
餐點多到不知道要吃什麼 每個都想吃😂
下次再訪❤ 建議提前訂位😉"
mandy yang,5,貳樓的歐姆起士蛋最高👏🏻👏🏻
Wesley Lee,5,始終表現的很好
Shannon Chang,5,終於等到它重新開幕，每次來都是很愉快的經驗
Danny Yang,5,十二生肖一起去很划算，，飲料可以續杯，店員有禮和善，非常推薦！
Vivian Juan,4,整體的環境感覺很好，餐點也很好吃~ 本來以為量不多，沒想到份量十足~
喵兔,5,餐點好吃，服務親切，聚餐的好地方
張湘慈,5,餐點多樣而且是寵物友善餐廳，上次和朋友一行人帶狗狗一起吃飯，服務生會為狗狗們送上招待的炒蛋跟水，狗狗們也能開心享美食，再來是服務真的很棒，細心到會有受寵若驚的感覺（10%服務費付的很甘願）只是生意真的很好～現場候位都要半小時以上
Joanna Kao,4,"價格稍高 但份量非常足夠
現場訂位後等了約30分鐘才來電告知有位子
但在用餐的一個多小時裡
二樓的位子有一半以上都是空的
離開後看到樓下排隊的人潮還不少..."
Amy Wang,5,公館店重新開幕，服務態度比以好太多，推德國豬腳！
Chuntang Chang,5,東西都有一定水準，價位中等。聚餐的好地方，就是要早一點定位。
Jin Yuan LEE,3,很多商業午餐可選，飯類可以吃飽
Hitomi Sato,5,"食物好吃，環境好氣氛佳!
適合親友聚會的地方，可惜無法訂位還有限時，還是大推薦!"
Noel Yuan,4,焗烤類好吃，份量大，吃不完可外帶。服務親切，但等待時間有點久。座位不會離隔壁桌太近，雖然吵雜但仍可聊天。
Jimmy Hung,5,餐點選擇多樣，口味也在水準之上。板腱牛早午餐牛肉部分稍微過熟有點可惜。
張湘琴,5,餐點好吃，服務熱忱又親切。
Peilun Kao,4,重新裝潢過的餐廳，格外舒服，生意仍然非常好，建議要先訂位
賴韻安,4,"餐點不比以前CP值高
不過份量大 可帶毛小孩 且有氣氛裝潢美
很適合聚餐"
Jennifer Chan,5,服務很好，同行有孕婦，還有幫我們準備靠枕！謝謝Sherman的貼心！
aaron chen,5,"義大利麵蠻好吃的~
服務很好~
麵包無限提供~"
Shi Xin,5,公館聚餐的好地方，也可以線上訂位很方便
Weichang Chang,3,菜色還不錯但是湯不是我喜歡的
KEN HSU,4,好吃，而且服務態度很棒！
Peter Lin0316,5,服務好。餐點新鮮好吃。
陳蓉美,5,餐點好吃~環境也非常的舒適~
胖樺,5,吃了N年的好店，服務好菜色佳，升級套餐的飲料可以無限續，除了一位難求外，沒什麼好挑剔的
tracy hung,4,可以帶狗狗，也會問客人能否接受旁邊有人帶狗狗，是很貼心的服務！餐點也不錯吃，適合偶爾的小聚會。
冠樺李,5,氣氛很好，服務很棒！真的適合聚餐、聊天
Lian Lee,4,餐點及服務還不錯，只是感覺價格越來越貴，荷包緊緊啊！
徐德浚,4,舊日據時期 鐵路局員工宿舍改裝
Brown Jh,5,歷史建築再利用，創造新舊融爐
我是熊,5,餐點好吃且多樣化，服務超好，那麼多人等待候位不是沒有道理的👍
朱祐,5,"超級好ㄘ><
而且態度好到我都不好意思ㄌ"
孟tony,4,口味向來偏重，很適合年輕人，拼盤很用心精緻，服務人員很認真。
Kayden Lai,5,菜色豐盛，服務親切。
王卉喬,5,燈光美氣氛佳服務品質好
chingping liu,4,東西好吃，份量很夠，價位適中
黃翊閎,4,吃到後面會有點膩，建議要點喝的
方淑娟,4,餐點豐盛，悠閒吃早午餐的好地方
1yuan,5,"2021/01/14

鹽水雞好吃🤤"
jojo o530,3,麵、飯這類現做的口味可以。但肉類乾又材，朋友點的板腱牛，表面雖有煎痕，表裏卻都很乾，沒有任何汁或油，像是微波加熱的預熟肉，肉質也很材。旁邊的沙拉的蔬菜和水果也已乾扁，例如蘿蔔片是乾枯的，蘋果切片的邊緣果皮呈現凹垂，不是鋒利的切面，應該備料已經過了太久還在使用的關係，需要改進。
lien連連,3,都是炸物居多，盼能多點健康食材
王鈺潔,5,餐點很棒很入味，很好吃~
莊硯婷,5,環境、餐點都很好👍🏻店員Angel好親切😆
馮映萍,5,服務貼心，待人親切，餐點好吃，每次去都有都有不一樣的驚喜，寵物友善餐廳
Wesley,5,餐點用心，服務好，菠蘿包很好吃！
YC Liu,5,"充滿回憶的地方
很開心看到恢復營業
祝福店家生意興隆"
ChienFeng Wu,5,餐點好吃，員工服務態度良好
小不點Paine,4,"小不點看世界 FB : paine0602
餐點一般，但是環境跟氣氛很好。"
Sharon,5,餐點好吃 服務貼心
Louisa Lu,4,波蘿皮很特別
HONG CAISER,5,狗狗友善，還有嫩蛋可以吃，超讚
鄭閎中,3,味道好就是價錢高了些
劉祖维-Wayne,5,低碳奶油花椰飯系列非常好吃 😋
Alex Shyu,4,薯條，熱狗，法國吐司不錯吃。二樓的環境不錯。蛋煎的很差，很可惜。
vera8172,4,牛肉稍微有點柴，垃圾薯條塔好吃，整體而言不錯～
沈佳琳,5,店員服務態度好 餐點也好吃
Jack Hung,5,"份量大 味道很好 做為配菜的水果也很甜 不馬虎
服務人員態度很親切
唯一的缺點是人很多 經常需要
建議提前訂位"
D X,5,位置好氣氛佳，餐點也很好吃。
Rick Hsu,5,"公館店裝潢很美
餐點很美味
份量很足夠"
George Chen,5,服務佳，好吃又不貴的美式餐廳
Hsing Chang,4,價格稍貴但東西新鮮好吃 氣氛不錯但有用餐間限制😂
Lien Angela,5,食物好吃，環境氛圍棒
Ryan Tsai,3,服務普通、食物很貴、品質普通，有限時2小時用餐時段需等候
Kao Leta,5,"用餐環境舒服
服務很好又貼心
餐點好吃
人好多（平日也是）
建議一定要訂位唷"
Vincent Lin,5,餐點好吃，環境乾淨，服務優，值得推薦的好餐廳。
Ray Ray,4,重新開幕也換了菜單，加了新的元素
Huei-yi Hong,4,"推垃圾薯條
甜點布朗尼是熱的👍
寵物友善餐廳"
Hailey Hsieh,5,東西好吃 服務親切～～
Yeah Hank,5,"店員服務積極，朋友臨時離席處理事情還告知可再加熱餐點
漢堡肉覺得很棒，份量不讓人失望"
Timothy Yeh,4,餐點好吃且選擇多樣，份量很夠，裝潢佈置和服務都算有用心
Sean Chang,4,料理好吃價位合理，雖然餐前發生小插曲，但服務處理得好，下回仍會前往用餐！
Frank Yen,2,二樓真是一見不如百聞，原來是間台味十足的美式餐廳。配麵包的醋可以再嗆一點。廉價的芝士，餅皮過焦的披薩。帶甜味又乾到不行牛絞肉，無調味可言的漢堡。酥皮湯是哪招？
Danny Liu,4,一起同行的朋友都說吃很飽
安安,4,餐點好吃，服務親切!
鄭志偉,5,服務很好，餐點好吃∼
C. WANG,4,"雖然價位不低，但份量尚可，餐點口味也不錯，服務親切。

用餐環境乾淨明亮，只是音樂有點太激烈😂有的飆高音略顯吵😅～

是寵物有善餐廳👍"
彭子芸,5,重新裝修後很寬敞很漂亮～～
Martin Lai,3,"份量大，總覺得食材再精緻一點點就完美
布朗尼也只是普通的類巧克力馬芬"
鄭子,3,餐點很貴，
愛米粒,5,"Angle是我們桌邊服務人員，真的非常非常親切耐心，服務超級好，完全會為了她再回來用餐啊！😍餐點也美味,份量足夠喔！貳樓是早午餐聚餐最棒的好選擇😄"
Tsai Kevin,4,餐點有特色、口味也很多樣、飲料還可續杯，在此與朋友相聚很有氣氛
Chang Jessica,3,環境氣氛挺不錯，食物份量大、味道還好，適合聚餐
Rita Cheng,3,好久沒來了，今天來點了商業午餐：青蔬野菇義大利麵和泰式雞柳炒飯，結論就是不難吃，但是味道都太重了，很鹹，無法吃完。
陳威翰,5,"非常棒的餐廳
咖啡好喝 服務人員親切"
曾香羚,4,喜愛重口味的可以去吃唷！份量蠻大的
范庭榛,4,小鳥胃建議共食～
May Liu,4,"座位寬敞舒適
好吃😋"
gil Yang,5,"新裝修新環境, 服務真的很不錯"
MICHEL KANG,4,服務不錯，價格小貴，東西中上
桃樂思,5,好食、乾淨、便利。
徐中盈,4,帽子先生補海鮮好吃！服務親切，座位舒適！
林candy,5,可帶🐶 很友善餐廳
L SU,5,餐點好吃服務不錯
郭彥廷,5,人很多，好吃且價格合理
林佳容,3,均價$290以上的早午餐，培根和火腿都蠻鹹，套餐精緻度普通，算是吃粗飽，不過兩小時用餐時間算是充裕。和仁愛路店面比起來，座位和氣氛都不是很舒適。
Perton Chang,4,來這裡，最好要事先預約
HungAnn Lee,5,"空間大,餐點多元可帶寵物"
Jo-En Chien,4,巧克力提拉米蘇很好吃，現在有電子候位系統，等待更方便了。
Kai Ho,5,服務好 食物鮮美好吃。#挪威鮭魚奶油鮮魚飯
愷祤,2,"食物可以 服務和態度不行
求快求方便 不在乎客人感覺
而且用餐環境非常不友善
感覺一直在催人
常常要排隊 等很久"
紅中,1,明明一堆空位，硬是要客人在外面傻傻的等15～20分鐘
Mivian Wu,5,寵物友善，真正好
李昆錞,5,餐點不錯吃，但若要聊天的話會有點吵！！
Karine Lee,4,"食材實在用心，服務很好，貼心又親切
Delicious food and kindly service^___^"
eric liu,5,服務人員親切有禮，餐飲好吃量足，到餐廳預約位置後，系統會主動通知且隨時可用手機自行查詢座位等候進度很方便貼心
林中毅,2,不再是學生時期的平價美食了
Noann Fang,5,食物好吃，環境好。angel服務很nice
金木瓜,5,寵物非常友善❤️❤️❤️
Brandon CHANG,3,餐點在水準之上，但個人還是覺得名過其實，用餐環境不錯，但人多
汪小小,5,…人潮…錢潮…美式餐廳…有美國家鄉的味道…
鍾紀程,5,食物美味 裝潢有特色  價格也OK
cookie,5,服務餐點用餐環境都很優
Joyce Q. Cheng,4,寵物友善的餐廳，很棒
郭愛米粒,5,價格略高，但每次都可以吃很飽
Wanjing Su,4,服務很好，餐點還算不錯
郭仲頤,4,東西好吃，份量很多，符合價位！飲料可以喝到飽，麵包也可以一直吃！非常推薦。
Derek,3,"假日常要排隊
東西還可以
煎餅有點乾
員工服務好"
Grace Chen,5,服務很好，很適合朋友聊天聚餐
Kai Kuma,5,麵包盤的小圓麵包極推！
唐芸,4,南瓜核仁蔬果起司飯，南瓜醬味適中，米飯好吃
戴瑋志,5,好讚，整體用餐體驗很好
Daniel,4,飲料充足 餐點好吃 價錢來說是值得這個價位
CHEN EDDIE,4,雖然要等，但是通常半小時內就會有位子，餐點佳，價格小貴，適合悠閒假日吃早午餐。
郭展瑋,5,友善餐廳，服務人員態度親切
廖路易,4,服務不錯，東西可以
孫日輝,5,超級無敵好吃的喔！
玄奘你爽嗎,5,對狗狗非常友善的餐廳！
Lin Louis,5,義大利麵好吃!
Mickey,5,食物好吃，店員服務態度親切
Leaf Lu,5,餐點美味，食材用心，再加上精湛的廚藝，以及份量十足，非常值得推薦。
Thomas Yeh,4,"看來是很大的一間餐廳，兩棟分開的房子之間，好像有個庭院。整修中，被塑膠布簾給包圍住了，只知道是貳樓，寫的是“New American Cuisine”，沒試過，不曉得和在敦化南路巷子，或者是在仁愛路新生南路邊的貳樓菜色有何不同。

等隔一陣子，再來看，也來嘗試。"
Chen Chen,2,桌子座位距離太近了
Mimier Lee,5,北車服務的主管很好
游鎧藝,5,環境乾淨，店員服務親切
糖餃子Sweet Dumpling,3,"價格中偏上，份量也蠻大的，
但是口味則一般。
店內環境與氣氛還不錯。"
Jessica Lee,5,親切，餐點美味
Rosa Liu,3,目前關店中，期待開幕～～
Min Ching Hsu,4,餐點份量夠，服務態度也超好😄😄
Andy Tsai,5,環境氣氛好，食物超好吃，cp值很高
林士凱,4,對寵物很友善！
宋季霖,5,好吃 種類多 服務好
Ricky,3,食物不怎麼樣 環境還可以
Jerry,4,還可以吧
SF C,4,很棒的用餐環境
陳品睿,5,餐點好吃  份量夠
JIA-HUI SHEN,1,"大家請注意⚠️
此間已關閉！！！
上次打很久去現場才發現。
請不要再花時間打電話訂位了～"
林青揚,3,清爽不油膩好吃，空間明亮環境整潔
廖彗岐,5,餐點美味服務好
wmouse,5,餐點美味 服務好
鯨魚,3,環境還行 餐點普普
