author_name,rating,text
柯Hank,4,環境還算明亮，桌上有茶可以用，茶壺跟杯子建議可以集中放置較衛生
陳麗娜,3,便宜又大碗，不能再嫌棄.....
陳小AN,4,老店好吃，人潮，出餐快。廣東炒麵特別。漲到100元。
Yu-Shan,2,"滋味普普，但出菜快，飯多
一定吃的飽的小店"
盲什麼東東,5,鳳凰城燒臘我認爲是全台北市最好吃的
汪秀美,5,物美價合理，衛生可口
吳孟弦,4,乾淨整潔的廣式美食，三寶飯系列都很好吃。
莊欣如,4,"化皮燒肉飯 100元

午餐時間真的好多人～～
肉的份量超級多！！
讓愛吃肉的我好開心！
白飯份量也超多～！
但是配菜偏弱.....

不過這個便當真的超大
還剩下一半白飯就不行了～"
Yuan Kh,5,"老字號粵菜燒臘
道地、好吃！"
Shane Master,3,"招牌三寶飯主菜量偏少飯多
醬汁不錯吃 偏甜
叉燒很好吃 其他普普
環境衛生不錯 桌上有免費茶可倒
上菜速度快 人很多 位子也很多"
林海,5,香港不能去，來這邊回味吧！
Ethan,4,"台大學生也推薦的燒臘店

漲價啦...三寶飯變100了QQ

不過青菜好像有變多的感覺

飯都會給很多 食量小或在減肥的記得提醒少飯"
R,4,"90$的油雞、燒鴨飯，配菜有點少只有水煮高麗菜跟酸菜，飯份量多，整體來說還不錯吃！
今天再度來吃，烤鴨腿飯很香很嫩，也點了傳說中最好吃的叉燒，真心覺得不錯，叉燒軟硬度適中，蠻多塊很Q彈，下次會想試試看炒河粉跟炒飯"
陳祐軒,5,老字號的燒臘！！在我心中排名前幾名的燒臘店！！
Percy Chang,4,食物好吃，價格合理！
Wan-Hsuan Lin,3,名氣很大，但是沒有特別驚艷，可能期望太大了，有一點失望
Robin Chang,3,垂頭喪氣的一餐。滑蛋配河粉不太合拍
洪尚平,4,公館最好吃的燒臘店，還有些家常小炒菜與廣式炒飯，麵等等也很好吃！
Vanessa Liu,5,鴨腿飯，淋上烤鴨的甜鹹醬汁太下飯。
Jacqueswilldo,3,老品牌 台大人和周遭生活圈的食堂 物美價廉。
Seiya Sun,5,"好大一盤 好大一盤 好大一盤 真的是嘉惠學子
乾炒牛河有鑊氣 燒臘也好吃"
吳仲融,5,把燒臘帶進台灣的鼻祖之一，豐富的菜單，美味道地的各種燒臘，乃台大周圍必吃美食之一。
Irene lai,3,燒臘便當裡酸菜味道沒以前好吃，很可惜。
徐培鈞,2,滑蛋牛肉飯普通，乾炒豬河太油，豬肝湯很雷。
歐陽良杰,5,老字號燒臘名店，炒飯燴飯超好吃，愛吃醬汁可以跟店家説要多，醬汁很下飯。
熊泰,3,生意很好。平日午間用餐需與別人共桌，跟其他網友說的依樣，點了叉燒燒肉，上桌後以為店家送錯，只有半份肉？因為飯有一半以上都露出來了，看了評價真的如此，只要點燒肉二拼的主菜，肉都少得可憐，是五根手指頭可以算完的。特典就在淋上的醬汁，因為學生關係，所以飯量足，只要有醬汁白飯再來一碗也可以吃完。建議想吃肉的人避開燒肉。
William Lee,5,外帶人潮多，停車是一個問題，常常有警察檢舉違停車輛。
Axl F.,5,"爸媽大學時吃到現在的店。

不只回憶，也很好吃~"
Alex Hung,4,有一點不穩定，但還是值得來試試看
Sean Kuo,5,經濟實惠又好吃
Ann Chen,5,"好喜歡鳳城的醬汁，甜甜的好下飯！
店員也很親切～"
李詠春,5,好吃！公館必吃店家！
曾志仁,5,叉燒燒鴨油雞是好吃，味道到位不柴，是道地粵菜館，服務員都講廣東腔，下午非用餐時間還客滿，買了300元三寶拼盤，就一支油雞腿一支燒雞腿及叉燒肉，價位高是不錯吃
Coco Yang,2,"從學生時代開始吃，多年以後，只能說每況愈下，讓人失望的老店，不進則退，不建議再去吃第二次！
環境老舊髒亂應該是大家都習慣的事，但老店不能爭氣點，改善調整一下嗎？
服務人員態度一樣的差，這點是從來沒有變過，我們應該習慣這種服務態度嗎？
口味跟以前比起來差很多，不知道是自己美食吃多了、嘴巴刁了？還是如我身邊吃過鳳城的所有朋友們感覺一樣，真的是店家退步了！在燒臘店林立的台北地區，不把自己餐飲的水平提昇起來，消費者去一次就不會再去了！這將會是店家最大的損失，可惜了！"
鄧樹正,4,燒肉油雞好好吃
Wong Ron,2,"份量減少, 味道也不行了"
Bill Liao,5,經典老店，必吃。
のきたゆ乃木田侑,5,"蜜汁叉燒很脆，可惜沒賣蔥油。

有後面，正門人多時會叫你去，在巷子的裡面。"
this is EL,5,滑蛋麵太好吃了，很後悔以前沒進來。100元有20隻滑溜蝦仁，物超所值。
kaiYuan Cheng,3,雖然感覺沒有以前的好吃，但還是算可以了。幾乎每盤都100元。
Jim ny,3,現在感覺沒有以前好吃了
YUOTO LIU,3,不太像香港的口味，真的香港味醬汁味道應該不是這樣。
Paul HUANG,4,燒臘老店，配菜已經比正統香港多了
Tom Chen,5,"東西好吃，也不會太貴
把飯換成河粉，味道也蠻特別的
雖然人多，但出菜速度很快！！"
Hs T,3,不算太差的價格與味道，嘴饞時可吃
VVN,4,出菜速度超快，但配菜只有酸菜另一樣菜，看起來單調。上面的醬甜甜的頗下飯的。飯一律90
陳麗榆,1,"三寶飯的三寶都普普通通
淋上醬汁後更不知道師傅皮烤得好不好
香氣夠不夠
滑蛋牛肉麵的麵微焦，吃起來乾乾硬硬的，不確定是特色還是火候不夠...
生意很好，但吃一次就好"
鄒乃誠,1,從小吃到大，但肉的品質越來越差，服務態度倒是一如既往的爛，難怪人越來越少¶¶
Celio Franc,2,廣炒：不油膩，但味道較無層次感。滑蛋燴飯：相對較優，但還是不及格。
Wayne Liao,4,個人覺得醬少比較清爽好吃
Emi Nagashima,4,吃飯吃麵好難抉擇，只好都點了😂
Kuang Wei Wu,5,"算是蠻道地的港式燒臘飯館，因為有好幾位香港師傅，從以前的70元套餐，到現在漲價的100元套餐，不太記得成為死忠顧客已經多久，只要經過台大校園，就一定會過來用餐，很適合全家一起用餐的飯館，因為有很多選擇性，飯，麵，河粉，都有得選擇，不怕不知道要點什麼，只怕您吃不了那麼多琳瑯滿目的餐點。

但是您若是要吃港點的，可別跑錯地方了唷！這裡可不是

易X居 唷！"
ok963ok,5,"三寶飯好好吃
上面有店家的特製醬汁
可是我覺得有點太甜
會想到台南哈哈哈哈哈
三寶裡面我覺得燒鴨最棒，下次想點燒鴨"
邱郁珽,4,"燒肉飯好吃
但價格真的越漲越多
配菜常常不夠優秀是鳳城的缺點之一"
Sullivan Sun,5,好吃還用評嗎
蔡承臻,4,餐點選擇多，口味稍重，價格還可以，如果配菜可以多一點會更好
小雪人,4,生意很好，醬汁不錯吃，便當配菜不多，所以個人只能靠醬汁吃完飯（但醬汁給的不多。唉）這裡檢舉魔人超誇張，停著買個便當就被拍（附近整條路沒機車停車位叫人停哪？）
Tom,4,今天點了三寶鴨腿飯，鴨腿肉的皮不算脆，叉燒則是普通，燒肉皮脆調味也不錯，是我覺得三樣裡最好吃的，主餐的肉味加上特殊的醬汁讓整體口味更重，是我沒吃過的燒臘，算是滿特別的體驗。
沈勇賢,3,動線尚可，上餐速度快，這次吃了叉燒燒鴨油雞，鴨嫩，叉燒普通，油雞跟燒鴨皮沒到期望值，醬過於搶味，肉算多青菜算少～
陳福建,5,新生南路台大對街的鳳城燒臘，是老字號的廣東料理ˋ快餐店，飯足料多每份100元，外帶便當裝得蓋不起來（外帶有多加酸菜）。店內用食需趕在20：30關鐵門前，點齊需要的餐品。
張志堅,5,"價格便宜，份量多
重點是超級好吃"
OCEAN SU,1,"一代燒臘名店沒落，難吃非常差，比新北市一些小燒臘店還不如，一盤超小份180元金牌燒鴨 醬汁冷的，鴨肉也都是冷的，醬汁非常死鹹。 清炒蝦仁一盤200元，，明明是“清炒“，端上桌卻是三鮮式炒法，5-6隻蝦仁勾了一堆噁心的勾芡。。幾許青菜應許了事。。 燒臘炒飯竟然還有白色飯粒！！代表沒有翻炒均勻，且飯溫超低沒有粒粒分明，到底有沒有開大火？？ 廚師也太打混了。。 慘！！！ 如果你想來所謂的“鳳城燒臘“朝聖的話，不要來台大店！！ 去吃""新店鳳城燒臘""，您絕對不會後悔!!"
[Chris] Chu-Yeh Lee,5,"從大學吃到畢業，從70元吃到100元
味道只有變過一次（又變回來了 開心）

叉燒拼燒肉👍"
虎克,5,點了三寶飯，主菜喜歡燒鴨>燒肉>叉燒。配菜炒的也不錯。
Chun-Ming Chang,3,2018.12.09=友人說是最好的港式燒臘，吃過，嗯…真的很平凡，完全是你可以想像到的味道。人真的很多，以學生的水平算是不錯吧？
Norman Lin,5,最愛他的廣州炒麵
Yu Hsuan Hsieh,3,個人覺得就還可以
yasuike Q,4,三寶 臘味 口味皆不錯
Guiwn Taffy,1,"以100塊的皮蛋瘦肉粥來說
這是我看過料最少、皮蛋最少的的一碗粥了
完全無法接受花了那麼多錢買這看起來只有半顆皮蛋跟肉絲的粥（連蛋花都沒有⋯⋯）
吃起來也是濃濃的味精味，讓人口渴一直想喝水
老實說有種受騙的感覺
早知道直接去買公司附近的日式便當
下次不會再訂了，真的很差"
周芷絹,5,滑蛋牛肉飯也很好吃 翻桌率高
鐘CHUNG敏華MINHUA,3,份量大，服務和衛生普通
滿浩淳（阿滿）,5,"牛腩湯50塊超值肉好多大塊又嫩！
滑蛋牛肉讚"
Laurence Chen,5,好吃的港式燒臘 單點熱炒類也很不錯
LuLu,4,好吃~排隊也願意
Alice Lin,3,100塊肉好少，我點三寶飯，只看到滿滿的醬蓋在肉上，好處是會開發票!
Heidi Lin林映竹,4,"油雞燒鴨雙拼
沒有很驚艷的表現
可能剛好切到都是骨頭的部位
沒什麼肉
醬料蠻重口味
不喜歡太重口味的可以跟店員說醬少或是淋旁邊"
Derrick Wu,4,經典的港式燒臘店，叉燒 及 醬汁，我喜歡，好吃，重口味，吃完要喝一杯茶。專業的分工，快速的出餐。不提供漂亮的裝潢，不提供親切的服務，而提供好吃的燒臘系列的食物。
鬼達摩,5,"內行人必點
叉燒燒肉雞
不在菜單上的喲
(我是花蓮人，但這間燒臘令我朝思暮想魂牽夢縈)"
HsiuKan Lin,5,便宜的好滋味，從學生時代吃到現在
Jackson Pan,5,"出餐超快
肉鮮
燒鴨皮脆 肉不乾澀
燒肉皮脆 價格不貴"
Elaine chen,3,三寶飯，店內有提供熱茶 上菜速度很快，不會太油膩 太重口味，米飯屬細長，唯淋醬偏甜，青菜稍少
Wei YU,3,看評論數很多第一次來，環境普普，然後湯匙筷子放一起不是很衛生，叉燒飯份量蠻多白飯也很多，但味道普通，只能說cp值算高適合學生吃粗飽。
A-Kwon Fang,4,"除了公館人從小吃到大、就連外地人也常常慕名而來的老牌大家燒臘店，雖然在台灣各縣市都能看到其分店但最有名的就是這家大家也大多集中來排這家，縱使是在不遠處的羅斯福路小巷子內就有它的分店也亦然；平時不管是要內用還是外送都要提前很早來排隊來訂餐，想到想吃才來排的後果就是要一直等到用餐離峰時段才吃的到。

價位一路演變到今天也真的不便宜了，雖然飯量實在很多很大一包，但三寶一百元、四寶一百三 的價位在燒臘界已經算是可以用高價來稱之，更不用說一個鴨腿二百元，然而肉質和醬汁就是不會讓你吃了後悔的那種。"
Shanice Pot,5,CP值高，麵跟飯的份量很足，蠻推三寶飯跟廣東意麵，三寶飯是燒鴨，燒肉跟雞肉，每樣我都很愛，皮脆肉嫩很下飯，意麵口味偏脆，很有特色
275jk,4,"維持古早的風味（ 走味不多）
約30 年服役期間的印像"
洪維志,5,好吃的老店，下午沒有休息，人少一點吃起來比較悠閒^_^
Jineee Chen,4,20年後再訪，三寶飯怎麼有豆芽菜了，2000$70>2007$80>2013$90>2018$100
歐瑪,2,"吃了二十年的鳳城，看著他一直漲價從70漲到100，這也就算了！
今天買的三個叉燒燒肉飯真的是讓我太失望了，價格漲、肉變少、菜變少、飯軟爛，連唯一請求醬汁多一點也沒有...

二十年後的今天唯一留下的只剩下失望"
Roger Yu (Rogie),2,跟學生時期的印象不一樣
iris liu,5,台大旁的好味道，一直都沒變~
JC P,4,台大老字號，飯量足，口味偏重，上餐快，適合學生上班族。空間尚屬衛生明亮。
SHANYU,3,"內用會有人指引座位，一個人也不用擔心，只是通常併桌。
油雞飯一般般，價位比其他燒臘店貴一點，整體普通。"
黃翠文,5,價格公道仍保有粵菜傳統的口味
Ho Jessica,3,"腰花粥三顆星，腰花很多，粥清淡，好吃！
四寶飯2.5顆星，菜飯都冷了！"
Yachen Chiu,5,招牌三寶飯好吃！
Sylvia Shih,3,上菜很快，廣州炒飯$90有加醬油炒，中規中矩。三寶飯$90裡的鴨肉好吃，油雞稍鹹，叉燒偏乾柴，酸菜酸味十足。個人更喜歡近麟光站的香檳燒臘。
李鑫,1,"燒肉根本難吃到爆！！！一份100塊量超少！！
及第粥也不好吃！！！
廣州炒飯勉強及格！！！
這樣要300塊真的是CP值有夠低！！！"
Kevin Lin,5,內用直接找位置坐、大姐會幫你點餐
lise0656,4,好吃！服務好！
Vicky Lin,4,好吃的港式燒臘飯，我愛燒肉，這次吃還好。但滑蛋蝦仁真好吃。朋友吃的三寶也是美味。
Wu Leo,4,食物平價也好吃
jon lin,4,"我在進到燒臘店的第一件事：
觀察店內環境。
鳳城在這部分做到滿分💯
大家幫鳳城拍拍手好嗎（啪啪啪
老店但環境還是不會油膩

食物部分：
價格平實 肉量豐富
沾醬清甜 配菜清爽
讚讚讚讚讚讚讚讚"
Deny us,2,肉變少醬也變少 味道其實也變了
Chia-Hsien Ho,5,"燒臘淋上不少的醬，較為重口味一些。
吃完後 個人口味覺得：燒肉>油雞=叉燒>燒鴨。
整體來說肉都很紮實有嚼勁，不會乾柴難咬，份量也不少！"
Hsu Chia Kai,5,久久沒吃還是一樣好吃，這醬汁跟荷包蛋真是太黯然銷魂惹，價錢還是這麼親民，從20歲吃到40歲的好味道
Yu-Xuan Lai,4,"菜有點少
但還蠻好吃"
Olivia YU,2,不曉得是否換人經營或換廚師，調味變差好多，乾炒牛河很油、肉也很韌，蝦仁燴飯蝦子很少很小，幾乎沒有味道，可惜了多年老店
新靚自然良,5,燒臘道地，炒河粉及炒麵、飯等鍋氣十足。
郝鈦鈦,3,沒有油蔥醬⋯少一味
