author_name,rating,text
黃小雯,4,"10年前就被帶來吃的台大經典美食 ，一試成主顧，必吃餐點有：

現滷雞腿飯：用筷子就能輕鬆撥開的軟嫩雞腿 ，醬汁很下飯，太晚來還會吃不到喔！

泰式雞塊飯：無骨炸雞塊酥香不柴 ，配餐有清爽的川燙高麗菜 ，好吃的地瓜薯條 ，滷胖嘟嘟的豆乾＆畫龍點睛的荷包蛋 ，搭沾醬吃有另一種層次感

餐點附上一杯清涼消暑的很大杯紅茶(可補價差換其他飲料)，環境也OK!!

以學生講CP值來說餐點很可以，外籍店員的服務態度都很好，推推!!"
豆豆醬,1,台大學生當路霸卡在門口，要進去也不給進去，事後終於進去了，闆娘當我們空氣，這間給我的回憶
G-Hung Lin,4,"推100塊的特餐
特別是菜單上有粗體標示，一個是泰式雞塊，另一個我忘了
學生之友，特餐還有附飲料，讚"
Ember Chuang,4,"古早味風格的簡餐店，配菜是雋永的高麗菜豆干荷包蛋，主餐推薦滷雞腿還有泰式雞塊，贈送一杯招牌紅茶還可以加價換珍奶。

價格在公館台大這帶不算貴，是學生或上班族解決一餐的好地方。

點餐櫃檯的麥克風、格子花磁磚、泡沫紅茶店般的飲料、播放著90年代的經典流行歌曲，讓人有時空錯置的體驗。"
A-Kwon Fang,3,在公館站台灣大學旁，這處被羅斯福路和新生南路底端夾成的三角區域內的這家簡餐店和附近幾家異國餐廳都成了在地幾十年的老店、也成了這裡的居民和學生們的共同回憶；縱使經過幾次的整修，店內的橘白相間磁磚牆和黑白相間地板及格局仍是令人熟悉的不變，只是以往那拿來叫餐的櫃台麥克風似乎沒有這麼常用、以及三不五時的就會將椅子搬上桌讓人以為要打烊結果只是方便暫時清掃而已了。 …
phoebe chu,1,"一打開便當就看到完整的螞蟻在菜上很不舒服，
滷雞腿便當味道偏鹹"
Chan Jack,4,"超級便宜又簡單好吃的店
100元就有不小杯的飲料跟一份好吃餐點
主菜又給的很多
真的推薦"
yi teh han,5,"100元左右
還有贈送飲料，雖然個人認為市圖旁邊的稍微好吃一些
但這家也很棒
奶茶好喝"
許偉成,4,調理包風味的紅燒牛腩，以學生餐來說還可以吃，飲料大概是這裡的重點，每次來必點超大杯珍奶
劉銘治,1,3/20 中午，點了二份雞排一排骨，二份雞排沒炸熟，反應服務生拿回廚房多重炸沒熟那塊還是沒熟。
Tony Tsai-Hsuan Hsu,2,"從大一吃到畢業
肉的份量真的越來越少
也變得不好吃了…"
倩妤吳,4,經典滷雞腿飯，這裏的招牌還有一個是泰式炸雞塊飯。簡單的飯會附上高麗菜和一塊豆乾與一顆荷包蛋。滷汁是經典。從小吃到大的味道，前幾年好像換老闆了，橘色招牌已不再，親切的老闆娘也離開了。味道是沒什麼變。每個餐點都會附一杯紅茶，但我一定會加價換成珍奶。就是最邪惡的奶精珍奶又香又爽快呀！！！他的花生厚片我記得也蠻好吃的！還有炸豆腐！但現在菜單好像已經調整過了，不確定還有沒有這些品項。可以吃飽味道也還不錯的簡單餐食，讚讚。
TeYi Lee,4,"食物CP值頗高,雞腿飯的雞腿鹵得入味和雞肉嫩滑,如果拿來當下午茶會不錯."
Tsai Simon,5,同性質針對學生族群的店家同條路有兩家(七里/柒貳)。七里1.白飯比較軟、好吃。2.泰式雞塊炸比較軟、好吃。3.紅茶比較淡，也比較不甜。以上個人的經驗。
Ivan K f a,1,"泰式雞塊便當： 配菜過於簡單， 而雞塊只是酸辣醬放上去配，整體口感尚能接受 ，價格不太算平民。

衛生： 偏差， 附送的紅茶雖然是贈送的，但未開封的情況下，能明顯看到雜質在裡面漂。"
Shan Shan,2,菜色永遠都ㄧ樣 沒有為學生健康著想
Hsieh Jessica,5,滷雞腿🍗飯，雞腿滷到入味軟嫩，入口即骨肉分離，$100元還附大杯茶飲，CP值超高。
Christine Chou,5,滷雞腿吃了十幾年還是一樣好吃 價錢過了這麼久只漲價10元 值得推薦！
Frank Chen,5,懷念的學生時代名店！雖然換人經營之後，少了老闆娘用麥克風對內場點單的聲音，現在的口味倒是跟以前相去不遠，甚至配菜完全沒有改變。上菜速度一樣神速、還有紅茶可以解膩，練完球之後最適合來這裡吃飯了。
Benzai Kariya Ch. 剎太シャッテン,5,"算是從小吃到大的店家

對學生很親切的餐廳
百元以內就能吃的很飽很飽
很推他們的泰式雞塊飯
每次來都點
飯都會附當季青菜 豆干 荷包蛋
飲料量給的不手軟 非常大方
單點的大杯更是讓我差點喝不完😮😮😴

老闆跟店員們都非常親切和善
店內有很多大學生們辦活動的海報
有時候看一看也可以知道大學生們在幹嘛

適合在這裡跟三五好友聚聚吃飯又不用花太多錢
記得他們禮拜日公休哦
平日則是11點開門

聊的太開心了照片沒有拍到
下次光顧再補拍😊😊😊"
L ZW,1,"大家能猜出這是什麼品種的蟲嗎？

有頭、有眼睛、有翅膀
老闆娘說，給換一份菜

我心想，難道不是同一個流程，同一個鍋子裡煮出來的嗎？

這好歹還煮熟了⋯"
Chou-Hang Chen,5,餐點OK，點餐附大杯飲料，選擇很多。
魏柏宣,5,黑胡椒牛柳飯味道很棒，還有附紅茶～
元元,5,懷念以前的老闆娘~~換人經營，漲價90到100，重要的是口味依舊經典，偶爾還是會回來品味大學時代的好味道！
Yun Vari,5,配上泰式醬汁很夠味，淋飯的醬稍鹹以外整體還不錯，會有飽足感，附有紅茶一杯
Nick Chen,4,許多台大學生的回憶，不是特別美味的餐點，但多年來都保持一貫的味道，價格不高，出餐速度相當快。
H Y,5,座位流動率高，服務態度也不錯。裝潢懷舊，餐點擺盤也很令人懷念☺️蠻好吃的，有經過會想再回訪～
艾佐瑞,4,價格還不錯，口味還可以
陳俊佑,4,"先上菜單最實際，這次點的是泰式雞塊飯，沒有出現上面評論所說的菜冷狀況，可能是在正常時段前往用餐所以是熱的

炒青菜就是把套餐裡的青菜裝出來自成一碗，個人覺得CP值不大好"
王佳祺,5,正宗台大學生料理。這裡吃的不是口味，是情懷。必吃滷雞腿飯！
歪歪踢,4,外送便當一律100元付一杯紅茶，香菇雞，泰式雞塊口味都不錯。
Neil Lin,3,"菜色普普沒有到很驚訝的感覺
珍珠紅茶+魯雞腿飯105元
雞腿魯得很軟爛
但醬汁味道有點把雞腿的美味蓋過去了
整體來說普通"
shih석yachih아지,4,雖然大學時代的份量已一去不復返，但以現在的物價來說，還是cp值挺高的店。
cinsec tsai,4,餐點內容CP值頗高，地點也方便
邱郁珽,4,"台大人應該沒人不知道這間吧，初號店七里亭
隨餐付紅茶，配菜固定
就是穩定的滋味，推雞腿、雞塊"
Jason Tsai,4,"上菜速度快, 還附一杯不小的飲料, 相對附近餐廳也算是平價, 想要快速解決一餐是個好選擇"
Timothy Yeh,4,好吃出餐速度超快的簡餐店，餐點和飲料選擇多樣，店員服務蠻親切且店內空間環境也很舒適
陳柏臻,3,雞腿飯這個醬有點可怕，鹹出新境界，算是吃個粗飽吧，上餐挺快的還有飲料，窮學生可以來吃。
Caleb Huang,1,這種顏色的炸雞，應該不用解釋什麼吧
鄧雅文,5,到台大必吃！餐點加飲料只要百元
gogo loveat,3,泰式雞塊飯100，雞塊不硬但偏乾，沾了泰式醬後還可以，配菜口味淡，附上三根乾而不脆的地瓜薯條，有顆荷包蛋，蛋下的醬汁很不錯，有免費送一杯味道偏淡的紅茶，環境與服務尚佳。
信勝利,5,"滷雞腿飯,泰式雞塊飯，好好吃，紅茶也很好喝，價格很親民。服務人員也很親切。適合一群人在此 聚會"
R,4,"100$的滷雞腿飯+紅茶經濟實惠，醬汁太鹹了我都請店家用小碟子另外附給我，紅茶還不錯喝，餐點配菜真的不是很好吃⋯⋯高麗菜不好吃，煎蛋也不優，滷豆乾還ok,但是份量充足可以吃很飽，算是不錯的平價小吃，最近比較少來吃因為滷雞腿越來越沒入味，變不好吃了⋯⋯
今天跟男友嚐鮮一下，點了炸雞排飯跟紅燒肉腩飯吃吃看，炸雞排肉大塊又厚鮮嫩胡椒鹽也撒的恰到好處，意外的不錯👍倒是紅燒牛腩飯，有一股調理包的味道，牛肉很少而且柴柴硬硬的，cp值滿低的口味欠佳以後不會再點，炸雞排值得推薦一下！"
Chia-Hsien Ho,4,"很像以前的泡沫紅茶簡餐店，尤其奶茶的味道更是讓人懷念，這裏還有現在手搖飲店幾乎喝不太到的胚芽奶茶！
不過個人還是最愛瑞安街的七里亭的菜單和口味，這間的配菜感覺有些單調。"
Pony,5,大學時代最懷念的一家餐廳，現滷雞腿飯必點，甜甜的滷汁淋在滷得油亮的雞腿上，小食量的我居然可以整盤吃光光，再配上一杯贈送的飲料，絕對是一大享受！即便畢業多年，生活圈也不在公館，還是時不時要回去吃一下！
HCA 1208,3,"泰式雞塊飯不錯吃（附紅茶）
但廚房衛生 有待加強⋯"
吳諺,2,100塊真的對一個便當來說貴了點，菜量不足不說，喜歡重口味的可以嘗試。
忻聖瑀,3,"日式燒肉飯，燒肉偏甜，有很多莫名的勾芡。
白飯多，青菜偏少。"
ckshangel,5,副餐飲料可選無糖加分，魷魚份量也夠，便宜的超值午餐，很推薦。
kensun cheng,3,運動完流汗後，就會過來順便用餐，有一定的水準且飲料止渴好喝！
Ling Wei,2,"週一晚上在這裡吃滷雞腿，結果在高麗菜中發現蟑螂
當時把店員叫來，她有點愣住傻眼，說：「要不要換一盤」
我覺得實在倒胃，不可能再吃了
於是走出去，我出去之前看了一下剛剛店員她的反應是去和廚房反應而不是安撫客人
覺得服務態度有點需要再加強
後來我回頭想要和他們理論，是否應該退費時，他們立刻退費但沒有一句抱歉或流露出歉意
覺得整個體驗不佳，覺得他們比較被動消極
基於衛生與服務態度考量，給2顆星，再也不敢去吃"
吳宗翰,1,"難吃! 難吃! 難吃!
非常難吃!
每一道菜都冷的 …
且份量少，CP值低…
這輩子不會再踏進這家店"
sky chu,4,"雞腿飯cp值爆高啊！
上菜速度很快，兵貴神速！"
paleomort,4,雞腿滷得很軟，好吃。
Sunny Shih,2,雞腿飯的肉沒有嚼勁 根本不是肉吧 醬也很不搭 牛腩飯還可以 但是這個價位我不太行 位置的關係所以這個價位已經算平價了 但是要再訪應該是不太可能了
林愷軒,4,"泰式雞塊飯100元 附紅茶
吃得很飽～這個價錢挺划算的"
Ngan Jan,4,"店內環境光亮
每個飯有送一杯紅茶
紅茶不會太甜 不錯
滷雞腿飯醬汁偏甜
泰式炸雞塊有附一個甜醬 還不錯
白飯不會太軟太爛 不錯
配菜就是普通的燙高麗菜"
Ethan Yang,5,好吃，不膩。
JY,5,價格划算，非常推薦！
林建輝,5,"吃起來很像料理包加熱倒出來的食物,高麗菜也是用水煮川燙的."
劉建緯,1,雞肉都沒熟 QQ
顏雋承,5,出菜迅速，滷雞腿配上紅茶很好
Mify Hu,5,很喜歡，飲料、白飯、配菜（高麗菜好吃，荷包蛋不老）都有一定水準，尤其是泰式雞塊飯的肉，沒骨頭有咬勁又不乾。
CHIEN-TING LIU,3,還不錯  學生時期常吃 ：）
Yen-Chiao Huang,3,典型大學生快餐店，有飲料、有青菜、有薯條、有主菜肉食，一百元上下算是實惠微經濟，非常適合需要匆匆解決一餐的繁忙都市人。
ZJS W,3,大學城邊學生價，味道不差能吃粗飽的選擇。
yu Tz,5,"大學時代的回憶
他不算好吃
但每次經過都忍不住要來吃
我都不知道我吃的是一頓飯還是一個回憶

畢竟學生時代很多店都倒了
這家開到現在屹立不搖"
陳怡靜,2,紅燒牛腩飯+紅茶，這樣100元，算還可以，不知道吃什麼的時候可以吃
Jason Bourne,1,飯粒黏成一坨實在噁心，高麗菜竟然一點味道都沒有，除了肉吃完了，其他實在難以下嚥~店家要改進!
Meng-Ying Tsai,3,"有附紅茶還算不錯，但是這個宮保雞丁！！？？？
這個是羹湯吧？又勾芡又加紅蘿蔔是怎麼一回事(  ；∀；）
奉勸所有信仰宮保雞丁的人千萬別來這家踩雷"
愛探險的朵拉,4,"雞腿很嫩！完全不用啃得很難看，用筷子就能分離
價位一般不到超級便宜但還可以接受
朋友之前點豬排飯感覺也很不錯～"
Orange Hu,2,"吃粗飽，從學生時代就不知道這家好吃在哪⋯
一百塊不如吃鳳城"
Ricky,3,品質越來越差 但也還算哦可以
山杉,2,十三年了吧，難得經過這家想來喚醒一下從前大學時代的回憶，卻怎麼也想不起了…如果口味沒變的話，那應該是我嘴變刁了吧，泰式雞塊飯完全是去骨鹽酥雞再附一碟廉價甜辣醬！這樣也可以叫泰式嗎！？或許真的只有雞腿飯能點吧…重點是：或許是符合學生水準的品質，價錢可一點都不學生呢！(還是現在學生太有錢？)95元居然只付紅茶，記得以前他們奶茶不錯喝咧，現在卻要多付10元價差…這種價位過對街的大福利雞腿飯簡直大勝阿…
Gloria Chen,3,"我喜歡七里亭
價格實惠，份量剛剛好
營養👍👍👍"
張紜銓,5,東西好吃又便宜，台大神店
板橋李準基QQ,5,"出餐速度快
大學吃到現在
還有附紅茶
算是還不錯"
Jenny Tsai,3,Cp值中等，但是上餐很快，趕時間的學生選擇！
ilovemagic9,5,環境整潔店員服務良好
辰岳的聖經日常,5,現炸魷魚飯非常酥脆可口可樂，再搭上一個紅茶珍珠，簡直置身夜市的美食中（附近就是公館夜市啦XD~
Hn Jo,5,"東西不錯
價格公道
基本上就是100塊
有鮭魚能選很不錯"
Hallie Shiao,5,"大份量又可以吃得飽
每次來都點炸雞排，份量很大
我不想要喝飲料的話會跟老闆說給我水但菜多一點🤣🤣甚至還多一個豆干"
簡依文,4,"偶爾路過還是覺得不錯的選擇~
---
學生價格還有紅茶我覺得很划算欸...而且第一次吃雞腿有嚇到！用筷子都能吃！肉超嫩很好剝開...不用用手拿起來肯可以🤣"
Joching Chen,3,"只是吃個回憶，從沒吃過泰式雞塊飯以外的餐。
內用飲料會給塑膠吸管。"
Cindy Liang,5,一大盤滿滿的100元有找！吃得很飽！
Sheng,5,以一個社會人士的角度來吃覺得這是一個cp值很高的便當店，沒有很多便當店複雜的雷配菜（三色豆、瓜類、茄子之類的），很純粹飯、菜、肉的搭配還有附飲料，如果住家附近有開我會天天光顧，好吃大推
Jimmy Lin,4,東西似乎變小
吳漢堡,4,台大第一代七里亭，品質穩定有附紅茶，可補差價升級巨大杯。
Andy Jiang,3,菜色變化稍嫌不足，且高麗菜上有不少黑黑的，份量足夠
朱彥如,3,簡餐店，是個朋友聚餐打屁的好地方，所有餐均100元，有附紅茶，甜度、冰度隨便調。原來七里亭的原般人馬分裂成三派，其中一些去柒貳，另一些在台大後門118巷的七里亭。這家之前去沒有學生證折5元，比較喜歡去柒貳。不過三家味道吃起來大同小異。不過我同學認為原來七里亭的滷雞腿師去了柒貳（它的滷雞腿，把肉滷的嫩且好撕，不會乾柴，非常下飯），所以後來都去柒貳吃。
Tomthecat Huang,4,學生快餐還不錯
Gî-ûn Tēnn,5,附餐紅茶有夠大杯
YUNCHANG CHUNG,4,推薦泰式雞塊，沾醬甜鹹好吃，米飯中下有點軟爛沒香氣，每日的菜色都一樣，有附紅茶
Amy Su,4,"位於熱鬧的公館商圈，是附近大學生吃膩學餐的好選擇
上餐速度極快，雖然人多但翻桌率高，通常尖峰用餐時段也不用等太久
招牌是滷雞腿飯和泰式雞飯，兩者都算好吃，會附贈一杯冰紅茶，也可以加價換成其他飲品"
洪郡祥,3,"本次用餐點了雞排飯和宮保雞丁燴飯
雞排飯的雞排不算大, 配菜普通與一般的便當店無異, 差別在多了三根地瓜薯條
宮保雞丁燴飯口味一般, 不特別好吃也不難吃, 沒有地瓜薯條
隨餐附贈20元紅茶, 可以加價換其他飲料
紅茶喝起來與一般便當店的大桶裝紅茶喝起來差不多
販售的飲料很多為泡沫紅茶店會有的商品, 像是薄荷奶茶, 蜂蜜紅茶...
店內的裝潢也是早期泡沫紅茶店的裝潢, 不得不說相當有特色
不過除非特別想回味泡沫紅茶店的特別飲品, 不然應該不會特地來光顧"
蔡育宏,3,"隔了一年半來吃感覺Cp值變低了  除了漲了五元以外 雞排縮水到只有原本的2/3的感覺 然後胚芽奶茶不知道為何有點酸味
但唯有滷雞腿跟豆干還是滷得很入味也很多汁有記憶點外 高cp值的印象就讓他停留在從前吧"
Rola Lee,3,一般平價快餐飯館
陳尚裕,5,餐點選擇多、飲料種類也多。出餐速度快，價格以北市來講算親民。
翁娜美,4,"簡單的平民美食
口味略重"
Louis Jhuang,5,"平價好吃, 環境乾淨有冷氣"
joey Koko,3,還可以～宮保雞丁飯推～只是有點少(對男生的話
Hedera Lin,3,"外帶的泰式雞塊飯居然沒有醬！！！！！
沒有泰式醬還叫泰式雞塊嗎我整個傻眼
店員會不會太不用心了，有夠扯
地瓜薯條也是，切超粗但根本沒炸熟....."
JG L,1,"外籍店員非常吵鬧
一直用尖銳的聲音大聲聊天
極為惱人！"
江彥勳,4,份量多，味道佳，cp值不錯！
邱士玹,3,"在台大附近價格比較親民的店家
一律都是100元一份餐+飲料
以公館來說算是可接受，但是口味普通"
黃峻昱,4,Cp值高！適合學生飽餐一頓！
Jain Hirookie,4,平價學餐，出餐快速，飲料大杯!
李宜閎,3,"勾芡超難吃 拜託不要點
其他還行 價位100左右 附飲料"
張育翔,2,"從大學吃到現在 口味雖有退步  但偶爾還是想回去吃
今天中午去吃 高麗菜裡面有小蟑螂 拿給吧台店員看 沒有任何一句道歉或賠償 只是把高麗菜換掉再送回給我 （高麗菜不都是同一個大鍋一起炒的嗎 換來的還是同一鍋泡過蟑螂汁液不是嗎xd)"
Arnold Peng,3,滷雞不嫩了 一個月前還好好的
林書夢,5,星期日也營業喔!
Jing-Tian Sung,5,滷雞腿飯好吃~
天兵好,4,滷雞腿飯好好吃! 滷的很軟 醬汁很香
皮皮,3,方便 快速 還行
王宏豪,5,一般人點雞腿飯及泰式雞塊飯，但我喜歡雞排飯。
Darren Lin,3,口味還可以，附一杯飲料，適合學生
XIAOYU SI,1,"炸的太油膩還在餐店裡吃到塑料硬片
很糟糕的體驗，不會想來第二次"
Dino Gau,4,開了十年以上的點，大學時代的回憶，不過跟十年前比配菜似乎變少了
Emily Chou,4,超愛滷雞腿，排名第一商品，八點之後就有機會吃不到了哦
林芫醇,1,"餐點大份，還算好吃
但用餐體驗實在不ok
一進店裡，雖然空位置很多
但考慮到是用餐時間，還是詢問了女店員可以坐哪邊
女店員態度真的是讓人白眼至極
連正眼都不看客人一眼，詢問也不會回答
整個尷尬 只好自己默默的找位置坐
以前因為出餐快、餐點還算好吃離學校又近的關係會到這裡用餐
但經過這次，店員的態度足以讓我不想再踏入這間店
直接打大叉叉！"
Daydream白日夢,4,"一百元一餐
有荷包蛋的快餐飯，配菜不算多
紅茶可以加價升級別的飲料"
Tsung-Hsun Ho,5,大學時期的回憶
Cheng-Wei Chen,5,從大學開始吃到現在（十多年飛逝）的好味道~
陳俊諺,4,雞排讚讚
許立仁,1,咖哩雞超雷 沒什麼肉要100
周宇威,5,主菜好吃，配菜普通，價格便宜。推薦滷雞腿飯和泰式雞塊飯！
Po Yi Li,4,一如既往的美味實惠，店內座位稍擠，可是尖峰時刻依然一位難求。
oy hy,4,打拋豬有點慢
01 he-yi Hsieh,4,出餐速度快。奶蓋綠茶放久一點，味道會出來。
丹丹Djchiyu,5,很棒的餐館，座位寬敞，很像學生餐館 ，餐點份量也剛好
quesadilla94,2,不怎麼樣
Masini Chiang,5,上餐速度很快，大杯飲料用啤酒杯大小的杯子裝的，喝起來很過癮！
林志儒,3,有越來越差的現象，肉質不太新鮮
Lizzy Chu,4,烤雞腿的醬有點過鹹== 但吃很飽就是
Gin Crow,4,100元能買一個雞腿飯和一杯飲料 在公館價格算很親民
張文源,3,稱讚cp值的人到底是活在台北的什麼地方？
謝銘,4,Cp值夠，餐點大概100元，菜和肉給得都算大方，而且不油膩。雞腿飯的醬料很好吃，不過除了雞腿飯，蠻多料理都做得像燴飯（例如糖醋排骨的糖醋偏稀。但不水啦），喜歡與否就因人而異了。但整體不錯，蠻家常，不易膩
Tina Weng,5,Cp值高，餐點乾淨便宜，送餐速度快
Andrew Chiu,3,餐點的肉很大塊，但青菜和飯都還有改善空間
Camel Luo,5,魯雞腿飯吃了十多年~~
Alan,1,"服務態度超差
無論收銀人員還是飲料吧
口氣都不是很好  找錢用丟的在桌上
還是在走幾個巷口過去
吃 柒貳 優質太多
跟這間水準完全不是一個等級的"
Hyatt Pan,5,"2021年5月更新，炸雞排飯經歷幾十年終於進化，原本單調的外皮終於帶有一點鹹酥雞店炸雞排的口感，接下來最大的關卡，就是看能不能將幾道快餐裡的白飯多配一點醬汁，以免吃到一半嘴巴過乾。
—————
見證台北快餐店、手搖飲料店發跡的經典店家，台大周遭的代表性商家。

氣氛無比自然，在這個地方不論你的任何個人特色再強烈或再透明都不會引人注目。 …"
曹家銓,1,晚餐外帶了黑楜椒牛肉，回家馬上吃，發現醬料的部分整個是酸的壞掉的，覺得很誇張，之後沒意外都不會去光顧了，總之如果有人要點黑胡椒牛的話自己要小心了 。 BY附近區民
Aries,2,食物不錯，但是服務態度差，週六中午才來用餐不到三十分鐘，就兩次來會催促客人快點吃完。「你們吃很久了喔！我們今天客人很多，你們可以打包先離開。」
Jenny Li,1,還沒吃完就把剩下的食物收走，太傻眼了
蔡慧諠,1,"並不好吃，分量算還可以吧...出餐快但都是冷的，紅茶也沒有很好喝。
當天點的菜泰式雞塊，雞塊是冷的，泰式醬料是某某廚房的，不好吃；配菜高麗菜炒得不好，地瓜薯條冷掉也軟軟的，豆干微苦，蛋包不香，
整體來說這樣100元，我覺得CP值不高，另外味道也不好，菜也是冷的，唯一好的是出餐快吧。"
Meimei Lin,5,佛心價格，讚，適合學生吃。
Kuma Lee,5,份量足夠～👍🏻
蔡東樺,4,價格上還算親民，大概都是100元左右，還會附一杯紅茶
Anderson_c.t,5,cp值高，推薦魯雞腿
Wen Lyndon,4,台大學生常聚集吃飯的餐廳，消費一般，沒有豪華的外觀，隱身在台大正門口誠品旁邊的巷子裡面。
Roy Lu,4,"台大學生必吃的簡餐店之一, 價格幾乎沒漲, 平價實惠的好選擇"
劉昂昕,3,主菜不錯，出餐速度快，高麗菜的味道不太能接受
GO YO,4,上菜極快，份量充足，還附紅茶，至於口味部分，作為一位路過台北的外地人，百元價吃到這樣飯菜我也是吃得笑笑的，100元呼去啦、福氣啦！
樹懶,5,泰式雞塊好好吃
鄭曉峰,4,吃了三十年，經濟實惠。學期之中，午餐要早點來吃。
宋嘉嵐,5,店家親切，餐點好吃
kyu akira,2,口味太重了，讓我無法下嚥。純屬個人口味。
Eartha Lin,4,"好好吃，份量十足，配菜也不單調
招牌泰式炸雞必點，附一大杯紅茶，可補差價換其他飲料"
Cooper Rannie,5,念書吃到出社會的店，好吃平價！
Roger Wu,4,"招牌的滷雞腿和泰式雞塊不錯
出餐速度很快
偶爾會喝到很稀的飲料，扣分"
豎笛,4,換了人經營 餐點品質仍然穩定 營業時間長 球隊練完少數還開著的餐廳 3.5分
尤繼謙,5,店員服務尚好，古早味這詞用來可以說是穠纖合度，營養、健康，和朋友一同吃飯氣氛也還好。
Lifesolomon Lifesolomon,4,好吃，實惠價格。
Pearl Shi,5,從學生時期吃到現在的店，推薦泰式雞塊！餐點都會附飲料（推薦加價換成胚芽奶茶），飽足感很夠。
WeiWen,5,經濟實惠
李浩廷,4,⑧ 平價，舊台北的簡餐店，飲料很大杯
Brendan YU,4,價格合理，可加飯，餐點上菜快速，適合趕時間的人。
洪詳宸,4,"上餐速度快，口味一般，賣很多飲料，套餐送的紅茶很大杯
結論：要吃飽可以來"
Aaron Lu,4,"價格主餐都一百，有附餐飲料，換飲料補差額即可
招牌的泰式雞塊和滷雞腿幾乎一點完就送上來了，其他稍慢些，大概需約10分鐘
位子很多即便人很多位子還是很多
份量足菜色豐富味道還行，趕時間又想吃飽七里亭是不錯的選擇"
ja Ja,4,"價格便宜上菜很快，餐具自取
填單寫完桌號，先去櫃檯點餐付款
滷雞腿有點滷過頭太軟爛了，淋醬太多有點鹹
燒肉飯，不是日式燒肉的樣子，比較像豬肉燴飯，醬汁偏甜
有送紅茶，可選去冰不去冰"
徐乃威,5,店員很可愛(重點誤
Jason Soup,1,"雞腿飯很好吃，有附紅茶。有一次坐牆邊，發現一隻小蟑螂在爬XD

以上是三年前的評論
三年後⋯
出了社會，難得放假來回味一下，不知道該說什麼，這就是我的回憶⋯⋯"
Yu Tzu Chang,4,雞腿很嫩！滷汁很喜歡！
楊紹熙,4,台大正對面 巷仔內 內行人的選擇
